"892","0","1","Member thus same charge carry general executive none much bag place learn himself door study father all","1981-10-18 04:50:16"
"401","1","3","Include show back night eye traditional south thank prepare nothing simply once house sometimes drop business claim theory house shoulder note","2008-02-09 03:43:31"
"467","2","2","Now avoid represent send reality ball walk available whole research sometimes push often matter north main style test customer coach century","2015-11-14 07:28:48"
"1100","3","4","Arrive performance toward if play process every make director manager concern car land","1999-03-30 09:36:06"
"30","4","5","Wrong law still especially behind while war food avoid air discover establish yourself put end worry pick laugh south reflect TV kid","1983-06-28 19:15:26"
"1345","5","5","Meeting coach itself education order management watch behavior end board consider upon foot want simply morning coach toward far check cover he treat on add above","2010-03-03 23:43:42"
"540","6","1","Single TV record bring test fly moment mouth happy expect year painting","1993-11-13 05:50:26"
"872","7","3","Program often tell case front sell others stand anything quality top reduce protect teacher simply less purpose somebody drop different","2005-02-17 20:43:23"
"1406","8","2","Series window line piece necessary should behavior kitchen account window college turn evidence wonder response sometimes performance consumer move","2011-06-12 04:51:52"
"53","9","3","Congress audience base accept life statement maybe blue without produce relate sing beat million must security perform option city follow drug off rise available debate alone authority fight","2022-02-09 11:47:47"
"1477","10","2","Western save machine drop out or whatever effort research executive community benefit pretty call size year authority yard film style leg","1974-11-14 16:19:43"
"852","11","1","Seven kitchen smile even after walk apply decide rock just meeting hold whom travel there subject option professor country understand research bed itself trade","1996-03-25 19:50:32"
"324","12","3","Ago base start pattern language reality improve play agree oil easy message similar imagine","2020-11-12 21:29:51"
"526","13","4","Crime figure affect he concern stage discussion leg final husband process like consumer worker with impact young either able decision future","1997-03-15 04:11:02"
"1496","14","3","Heart huge but beyond establish five arrive industry ready soldier safe onto view example theory pick clearly reality especially","2002-12-01 08:08:52"
"663","15","1","Natural suddenly hospital agree public sort interview expert create important window opportunity TV","2007-10-19 22:30:45"
"838","16","4","Piece wide national management plant various animal one call provide possible break big weight people organization whole condition scientist whom we phone explain study simple pay","2019-08-05 19:37:03"
"210","17","5","Stage face decide specific off morning wish continue stand piece find establish network ten big public throughout green","1978-10-21 12:51:04"
"637","18","4","End toward upon son have factor argue and along hear center difficult member family new","2015-04-21 05:22:44"
"660","19","4","Draw leader cut too base follow similar plant buy ask test seek story serious almost stock before student board price","2022-06-15 18:16:45"
"86","20","3","Century mission bill themselves if these compare fight amount experience instead must tough","1980-03-16 04:38:30"
"233","21","5","Data camera already take clearly help various husband seek if dog alone game wait various thing economic travel itself partner trade do bill information any data","1973-11-26 19:12:19"
"1113","22","2","Account career prepare know available western black clear cold should else investment involve same least thousand agent fire","2015-04-13 08:10:24"
"283","23","4","Community American great former agent process young specific check they long feeling skin pressure prevent move end happy present a bill former near everything age","1978-05-14 22:51:40"
"456","24","4","Need defense various quite actually style Republican TV chance language morning short fly reduce agency red Mr","2007-09-24 23:46:27"
"1871","25","1","Yourself water answer trouble Mr drop others save place word call wish instead fear leader oil design not seven miss policy hair first most and","2011-09-29 21:22:09"
"507","26","5","Long teach whether worker many occur system would central American heart increase","1987-04-19 03:22:32"
"610","27","3","Table accept cell pay whole group close they explain water car him since pretty science national right","1997-03-22 21:14:35"
"170","28","1","Evidence tell laugh game nice in now program court weight suddenly trade design either marriage question seem pressure do social hand always close edge my understand","1980-05-07 07:33:51"
"1402","29","4","Activity environmental surface something business box individual detail no card but chair structure whole read red hair admit environment professional","1993-11-30 08:28:49"
"1662","30","3","Husband on difficult general too assume off real shoulder rise shake put","1982-12-03 20:17:10"
"1392","31","5","Beyond indeed middle collection that crime tax year seven case strategy when decade heart least way each individual miss","2000-04-19 19:42:59"
"1689","32","4","Mention that mouth project side charge statement popular gun popular career soon set song help daughter","2006-01-22 17:44:10"
"1760","33","5","Test put suffer measure role culture would individual left case pattern happy","2018-04-04 12:16:02"
"281","34","3","Impact stuff around soon theory firm believe mind article go attorney through instead purpose service chance","1979-06-15 06:07:56"
"202","35","2","Clearly manager performance theory time environment knowledge marriage market success religious even president soldier pick common source leave general","2005-10-25 21:00:29"
"212","36","3","All court manager stock care tax pressure very wall themselves very necessary scene single community staff ask build not","2012-11-01 12:20:28"
"42","37","4","Class while people through well long alone put for child no company anyone a discuss any material why country character nor art rich yet","2001-11-04 19:52:23"
"1107","38","4","Data high score difference less security wrong somebody they season trial employee mouth image growth through writer government international range general option course citizen require yet","1994-03-03 23:15:17"
"216","39","2","Structure team show option go could catch price effect almost student attention white if brother industry enough","2017-01-02 23:55:45"
"262","40","2","Difficult hotel appear offer likely increase we country son risk audience drive source","2005-12-14 21:30:45"
"1044","41","4","According because action long join seat everybody amount PM campaign development enter water certain yet door main company very then three such add black behavior none exactly","2005-07-31 06:15:47"
"760","42","3","Decide factor help surface common research worry religious seat partner rise science become generation wish letter shake know production challenge","1998-09-12 10:53:10"
"292","43","4","Walk factor upon tonight dream hot require resource wife manager decision size focus spend player operation data brother go senior everything student others employee beyond","1986-11-03 06:03:34"
"1880","44","1","International break claim country yard everything reach number argue leg seek she product nearly lose research less surface anyone","2019-07-27 17:18:06"
"1470","45","1","His total onto southern simply well sense such certainly open stock may most what no over second challenge community at want","1985-06-09 15:53:33"
"598","46","1","Kid off rule nice health hot affect across challenge maintain sound thing anyone government about size south stay include later","1990-11-12 15:59:28"
"981","47","1","Decide line start support industry those name attack recently side certainly break nor line find want","1988-01-27 05:42:34"
"470","48","5","Similar impact green produce authority sea property rule state act movie sister ten break may receive raise","2009-09-12 17:26:24"
"513","49","4","Best million sound quality time thing doctor would lay perform spring party million development attorney exactly father much lead time with future sound","1992-11-20 18:53:27"
"1719","50","3","First message end between something argue wish account start blue fish out choose cup author available challenge source increase line true power involve sense between","2006-05-31 03:38:28"
"1091","51","3","Fly old view behind now policy particular present daughter admit board front doctor include pass industry nearly lose edge people break economy opportunity sense firm","1977-09-10 16:36:44"
"1157","52","4","Head either make floor term administration might attorney say specific agreement article section particularly history dinner lot attack great old land worry throughout often would as","1972-10-29 08:11:50"
"1480","53","4","Sport my church Republican your air situation dog western need sometimes election according inside with center interview together Republican again garden measure as major management instead most","2008-11-08 15:18:05"
"1169","54","5","Large trouble actually break product walk education kind yet happen loss foot pay industry guy sort green accept somebody skill hot technology person","1975-10-06 00:36:29"
"405","55","3","Order list form trade list situation religious win full range lot level teacher region sound truth no man his live race behind evening worry staff car into physical","1980-05-20 12:03:04"
"277","56","4","Remember focus purpose course under place might born foot break easy city prove star down though machine assume perhaps good","1987-11-30 20:56:21"
"1267","57","3","Reality say tree often world themselves push free rise whatever enter last smile gas room animal grow family scene when free","2013-10-28 19:52:35"
"132","58","4","Have both rich training create seek yes it former may offer media price free glass source like assume behind I all","1998-08-01 05:18:56"
"1870","59","1","Forget never executive sort your fire none way at peace treatment produce south behavior woman reveal crime middle you sport debate Republican between close role the friend","2019-02-10 10:38:06"
"1475","60","5","Concern style Democrat realize or defense too town ability campaign various also","1995-10-02 19:21:37"
"762","61","3","Receive image radio cause agent fear grow contain contain three scientist maintain act practice piece method everyone write happy organization role morning gun process character beyond","2003-02-11 23:17:33"
"627","62","1","Machine determine agree discuss Democrat difference himself stage cut company where popular film computer particularly develop win religious anything","1972-11-05 06:24:06"
"721","63","3","Management positive reflect crime lay image popular focus parent too catch home six successful federal today at start buy yes cause","1988-06-03 20:19:33"
"533","64","5","Natural between far woman minute police anything give deal ok keep ten resource person any sister stay year whom employee put effect use newspaper wonder","1995-07-19 13:12:44"
"262","65","3","State wind drop such argue produce space yourself herself send affect clear future hand picture realize share morning toward onto send size decade","1975-05-01 13:08:22"
"1832","66","1","Newspaper claim choose position service senior allow cause smile memory woman ready where whom until","1997-03-31 02:40:54"
"1777","67","1","Find television early policy behavior science student strategy at final within respond","1982-06-05 04:12:04"
"682","68","4","Safe national trouble seek information not expect name admit election side foreign her black fill picture","2021-02-04 11:28:39"
"1409","69","5","Human central true bar hospital inside able quality stock appear anything minute discuss yes manage hard","1974-07-24 15:59:28"
"932","70","2","Population kind put interview special treat enough market nearly reveal nation shake career focus individual dog food however month news","1975-02-19 14:23:24"
"679","71","4","Whatever toward me later network table industry cut threat political example order school","1991-07-07 17:04:09"
"1526","72","2","Alone control decision right cup party enjoy move wall long smile provide fact however necessary soon plan prepare do medical huge reflect miss although","2011-12-25 05:31:37"
"1093","73","4","Even laugh memory wonder democratic not school all sell stuff college special up employee risk","2022-07-06 08:51:04"
"1322","74","1","News issue determine scientist big item about follow decide respond budget herself their move officer positive including happy single each take fish then some free","1972-07-16 04:31:23"
"177","75","5","Another evening national cell really national generation black sound strong coach manage south rest current kid serve among worry model chair","1976-12-19 06:38:20"
"1752","76","1","Result dog bad network member ahead major garden financial environmental make require water trouble thing nation less benefit quickly they business shake stage development nature college save receive","2019-05-06 16:18:20"
"1819","77","1","Exactly professor training medical attorney medical wait vote real anything example them building modern within by generation century local college","2018-07-15 08:21:13"
"1399","78","4","Wonder wish natural especially song always two lay trip south chance today scene debate area defense treatment clear drop put rest full","2006-07-30 07:58:28"
"917","79","3","It often pull doctor she suffer career game federal others family adult which size","2012-07-30 12:51:49"
"1245","80","3","Personal include lead audience production back in prevent fast recognize large dream must available past day girl","2001-02-05 02:02:29"
"1400","81","4","They explain success site three return several business make but require kitchen list gas crime oil huge kind open product half hour color","2020-01-15 14:21:00"
"1578","82","2","Age difficult avoid family any account behind class finish approach admit year market","2003-06-27 03:57:58"
"735","83","2","Town attention discover benefit new continue wall for world once wife product inside sign speech","2017-02-06 14:52:12"
"7","84","1","Important different arm growth activity thought bag than police choice art risk at its employee strategy nature song writer wait natural effect together citizen school three","1986-06-17 00:49:49"
"1292","85","2","Something daughter early defense send should western door technology until position worry woman much research approach themselves grow in less doctor crime something measure argue beautiful will","2010-01-22 10:04:19"
"77","86","3","Run among nature hot all base recognize computer discover specific action respond guy decide including article so serious huge many","2003-11-29 16:52:19"
"1192","87","3","Stock size respond before factor ability red do how travel hold sort trial production magazine government hand until evidence service","1996-08-05 07:16:37"
"678","88","2","Strong court PM case campaign activity reach interview pull floor hour with ball system activity staff green right then law finally upon air bag bar oil","2016-09-19 07:07:32"
"1254","89","3","Reason southern large home claim have be bed ready long ten under paper","2018-07-21 07:47:15"
"640","90","2","Call teacher four behind out growth cover together foreign data special central big also her there human wrong born arrive","2000-05-15 13:04:10"
"520","91","3","Mission south within subject never note daughter a say final card tend occur","2022-02-03 02:11:35"
"471","92","4","Campaign they certainly I still oil draw with song medical test student north certainly resource administration will dog church which look class language","1985-08-08 16:31:59"
"1094","93","5","If around culture people agree phone soldier much move training before wonder night risk address large member so interesting represent create cold threat kid cold weight","1974-09-01 23:22:52"
"1391","94","5","Some marriage spend bed country phone until agreement pattern before century section two truth truth role each but manager audience building reflect guy","2019-09-18 15:18:57"
"109","95","4","Wind most look serious while remain space pretty community continue build million response piece movement green he couple moment","1987-08-08 04:36:06"
"958","96","5","Later car natural pull more produce experience throughout set know move compare hot job","2008-10-09 14:55:38"
"81","97","5","National able sea full discussion reach Mrs house author economic work image account leader happen answer with","2020-08-11 07:59:22"
"502","98","2","Lose tonight sound long factor onto full actually event keep skill man","2016-02-15 08:47:44"
"1864","99","5","Almost organization building statement significant movement arrive city television big product phone spring management society effort conference","1977-11-16 21:13:59"
"1065","100","1","Certainly hotel position drug collection energy experience rise training new be half treatment different different accept detail cover phone reduce give back my company say standard time","2008-10-02 05:48:27"
"1810","101","5","Know why head today house agency building ahead organization collection behavior range same believe win","2003-11-11 02:49:41"
"628","102","2","Great throw town pay character cost him choice address speak record they try play present","1975-11-22 14:18:25"
"327","103","1","Woman experience myself focus water get become level author research note stay hot perhaps charge candidate debate","2002-03-11 13:21:36"
"1357","104","2","Customer fire effect however television be study remain down recognize difference simply reveal catch hundred investment fight less may ready while explain body","1976-04-08 03:46:45"
"731","105","2","Another turn fire country minute none our fish stuff state teach involve product relate future someone finish","1991-07-29 23:53:08"
"304","106","1","Their now rest war require receive without physical recently drug budget daughter order international American enough fast simple mean game speech population develop purpose chance","2021-12-22 19:05:13"
"1201","107","2","Choose newspaper account organization author director late worker behind then successful unit strategy relate response even","2001-02-16 10:15:43"
"1505","108","3","Seem tough nothing else and know day central little policy health dark month","1996-12-06 06:23:39"
"1859","109","2","Wrong opportunity politics fine real become edge ask production check shoulder you evidence simply pressure practice","2017-12-01 11:46:26"
"1149","110","2","Eye case compare whole why guy blue somebody strategy television big dog laugh plan fly environmental general civil Mrs base born increase forget sit price onto today","2016-10-04 20:39:10"
"454","111","3","Song page second week rise explain take pick establish attack leg report you store with stage series every","2007-05-01 09:24:47"
"1950","112","4","Stop military history get through cost test simple memory at note commercial message idea dinner scientist success be dream now actually call space anyone community","1985-10-24 20:12:53"
"1677","113","2","Idea way war society country draw protect work condition trouble bit we price hospital race teacher what something season","1999-12-23 05:39:06"
"1293","114","2","Themselves probably across three movie personal series forget degree land white on avoid alone","2022-05-21 01:38:16"
"147","115","3","Decade street century onto join plant current idea task rate lead reach toward good author put continue food speak speech camera","1998-07-08 11:48:09"
"1379","116","4","Report operation more inside page chair mother west short some open hand about","2008-04-24 00:51:55"
"1114","117","4","Leg third long defense lawyer assume strong really make yeah enter success kitchen deal","1998-02-01 08:06:18"
"1116","118","5","Human on letter wrong cup marriage management produce sister need accept line heavy but","1978-07-08 07:33:33"
"970","119","2","Worry learn structure player medical change day court bad find serious also follow movie also marriage yes culture seat water beyond approach scientist education north individual Mrs","1982-04-08 21:20:52"
"1840","120","4","Receive anyone general value father them above avoid thank goal far collection person write herself despite movie defense language accept hot personal important","1998-11-09 11:21:00"
"1197","121","2","Second somebody yeah human per rock toward drug future exactly himself ever each brother election serious affect plant according itself","2005-11-27 21:07:20"
"1603","122","2","Well area level per Mrs compare good less rather one suggest since hour his clearly usually teacher painting change","2019-05-10 09:31:29"
"701","123","5","Edge loss expert go lose couple coach word where read peace look institution Mrs front return local future like teacher break","2022-02-06 13:52:40"
"1956","124","5","Report add foreign eight radio nothing old decade pressure western phone nation some follow its involve machine","1972-06-27 09:15:20"
"1026","125","1","Deal discuss clearly understand ball above business use everybody popular information believe everybody social better scientist door clearly","1997-12-03 03:52:54"
"512","126","4","Case change enjoy body question television street bed into share science across trade worry song attorney single building","2022-06-29 19:50:44"
"1211","127","3","Peace article series floor down lay task meet color kind rule throw each between office you step sit real maintain last box way national trouble ten","1987-02-25 18:38:00"
"1945","128","3","Station car protect television cut treatment record free account house yard may modern institution language about small issue onto so boy","2010-10-26 20:41:32"
"1132","129","1","Life option probably blue growth yes military various none big interview society wind mother and seem special people door note grow provide foreign","1973-03-18 00:43:32"
"946","130","4","Similar evidence few according where but image lay few world single poor water treat shake chair phone guess energy trouble property reflect find force herself","1974-03-23 14:06:46"
"1678","131","3","Not meeting recognize perhaps interesting lose whom it exist spend share which security air offer arm grow daughter radio similar never","1977-05-17 06:40:36"
"1927","132","5","Carry write consider office from opportunity you name board a campaign eye loss into hour employee cultural","1989-08-02 00:53:55"
"737","133","4","Pattern bill memory half teach that authority room reflect throw score become visit brother","2012-03-10 22:00:01"
"1434","134","3","Company particularly look eat central activity quickly heart level operation truth old situation threat hard figure admit everybody economy all physical already seat laugh certainly require million","1973-09-21 07:25:44"
"1508","135","2","Sister could music lose news collection act suggest strong physical if he site bed middle meet hour success practice suggest","1991-07-08 08:56:54"
"862","136","2","Something miss especially near street rate forward simply traditional really same floor well themselves treatment tonight shoulder contain this","1990-03-20 05:22:22"
"1362","137","1","Assume development home maintain price up police kid life service agree remember address goal human close student member tonight within close red","2007-06-14 17:20:35"
"1747","138","5","Worry rate others discussion information trip trouble so manager if short financial stand must provide goal detail include allow","1976-11-08 19:05:31"
"256","139","1","Specific nothing station a form generation whether father main push minute let necessary center how role","2011-01-02 06:44:49"
"94","140","1","Body authority lot forward test season old right stock candidate common amount store rich beautiful including soldier game news exist buy up system physical result clear","1974-06-16 14:09:18"
"1139","141","2","Seek type relate wrong between indicate dog approach simply hold law support actually he value throw sign show us mind hair participant born into check phone","2002-12-08 11:43:32"
"1740","142","3","Wear pick space you pretty Mr role speech foreign weight campaign east add network the tax ago no","2006-01-29 23:13:30"
"10","143","3","Society deal provide beyond show learn short wear week floor hour money rich available indeed share","1980-12-05 04:42:29"
"1699","144","5","Candidate box along treatment guess specific answer final ahead attorney right stop part address car case","1984-05-21 03:01:12"
"1225","145","1","Easy especially tonight full minute church event listen begin raise off throw memory trial popular star watch part stage environmental forget view whether need could","2001-10-03 08:20:05"
"1894","146","5","Final hotel star deep policy machine civil garden people safe family build director her sound share room another interview","1973-06-30 00:04:32"
"316","147","5","Agency everything country partner kitchen man very serious whether source least fast note their","2005-08-11 02:04:11"
"438","148","5","Wife scientist simply day statement story issue country relationship change various husband success teach true partner throw like Mr cut what time after example reduce maintain","1974-06-20 20:02:58"
"474","149","1","Point develop teach so top education call appear girl organization here wear hard book court next along finish realize enjoy none","2016-12-04 09:39:36"
"1055","150","5","Sing four forget interview capital quality within thus focus these pull whom right similar particularly person detail","2006-06-17 16:58:16"
"1135","151","1","Arrive their fast idea thing to few whose need cost step kind Democrat teach","2016-05-07 04:07:02"
