"1461","1535","4","Popular get food foot when speech begin recent music southern particularly tonight win body especially continue affect worker anyone good entire both whom","2016-12-16 02:15:06"
"510","1536","5","News history ready worry join note moment either short human image traditional surface","2007-04-30 21:20:15"
"645","1537","2","Paper note anything reach security American bank finally social woman policy him can","1985-03-01 20:47:13"
"1842","1538","3","Official floor land issue again board can common remain help information knowledge establish","2005-12-25 22:58:49"
"1936","1539","2","Future support girl total phone without environmental group investment long generation popular cause music message since author key view light instead scene keep spring middle","1989-09-13 15:41:26"
"941","1540","4","Office ahead major total young remember black everybody certainly question condition community their focus give enough teacher whether","1984-08-05 16:40:49"
"1112","1541","5","Choice bring newspaper soldier manager address paper write trouble short responsibility add take store two coach cup director group young drop","1998-09-05 09:37:03"
"150","1542","1","Themselves treatment clearly again protect movie leader live trouble all manage see collection condition threat reason economic near maybe bank","1993-01-28 00:45:16"
"445","1543","2","Itself but according through democratic hour poor stuff doctor of grow author also in radio attack investment heart federal common knowledge attorney other enough send to floor","1994-07-14 12:44:22"
"775","1544","1","Explain natural two account respond media job remember environment reduce begin white reason middle","1985-06-20 00:23:13"
"1011","1545","1","Art mean shake soon science style she poor father author role chair moment argue season sort age order oil certain","1979-12-24 21:22:08"
"1862","1546","2","Whether alone hospital style medical whose here room during generation both interest including hear lead meeting operation later add off gas teacher cultural","2012-06-20 19:21:33"
"1958","1547","3","Sing foot level work often institution hand floor least cause firm allow student full nice media safe possible want moment education reality","1974-03-19 04:18:33"
"1286","1548","5","Western light face could back drop price role science bit four hit of box notice knowledge society century","1992-08-13 19:29:51"
"1303","1549","1","Bill view card try mouth American field evening focus important floor something teacher major heart across international write check size artist","1998-05-04 10:59:55"
"219","1550","2","Cultural build no less stay feeling challenge out help travel yet baby front statement economy give entire weight shoulder risk threat military begin find nearly mother relationship","2009-07-02 13:35:29"
"860","1551","5","Market study push may save born husband night short blood their usually per moment form civil rule skin and high need item at vote program","1982-03-11 14:50:18"
"1220","1552","4","Country opportunity position energy receive or machine between face onto accept finally arm risk might miss social such defense yard that center as window","1978-12-21 01:25:37"
"1670","1553","1","Even fact stand down public little day free all land cold book close those behavior thousand field minute be ahead blood situation her","1986-01-03 13:09:30"
"1497","1554","5","Good again able citizen wonder start trial away receive painting a huge leg coach always difference ahead until design rate often teach","2017-12-26 16:29:53"
"332","1555","5","Treat head rule event data she next range today how again white off change strategy identify sit imagine fire trip","1972-01-30 22:54:56"
"779","1556","4","Also wall whom security almost particular friend should national economic article employee draw structure","1995-02-28 02:44:59"
"1889","1557","2","Popular month woman toward degree management smile daughter door billion our capital church above forward when air write challenge minute high half bed name","1988-06-18 12:35:26"
"582","1558","5","Together catch exactly traditional sea less drug record interview catch dinner figure professional","2001-08-23 01:10:25"
"1473","1559","4","Car two young last world help one social fly account fine indeed front human","2022-04-29 07:00:22"
"1786","1560","1","History always free ability security those benefit positive strategy rather act focus cup authority order find seven exactly move indicate product generation suggest science animal couple sea work","2002-12-22 11:11:30"
"1260","1561","1","That beyond environmental sometimes hear myself drop benefit provide conference stop why read leave because young play size let main debate affect either","1990-08-06 05:50:52"
"1365","1562","5","Soon sort parent simply score baby media which do end almost many season hotel find","2017-06-20 17:06:55"
"553","1563","2","Body me first magazine behind better expert teach relationship whatever manager him say general head language always necessary design couple pretty other collection","1999-03-21 03:14:53"
"1177","1564","4","From owner peace everyone pick finish certain peace magazine direction strategy international picture nor central off performance door but country group","2004-06-24 19:09:12"
"409","1565","4","Produce if kid public show try say it focus author once want three myself population provide he response staff training personal I suddenly shoulder face chance","1994-12-31 13:25:23"
"644","1566","2","Else return hospital between financial picture movement development those game audience already table yeah box Congress matter ok explain church smile station interest executive","1988-06-08 07:01:14"
"1256","1567","2","Degree condition high east traditional we activity relate lawyer describe others light yourself western population above","2013-11-10 01:55:57"
"1025","1568","3","Approach drive management those already interest expect together believe bed have her myself at trial nearly role total","2016-03-08 12:54:00"
"28","1569","4","Sort college benefit little truth plan magazine mission dark personal boy party city grow","1992-02-18 03:20:18"
"451","1570","3","Sense audience final many drop technology different list now push even herself choice assume media physical office popular give woman able deep significant whatever car","1984-04-28 20:55:59"
"647","1571","4","And ten study yeah through team item one card president very energy will","2010-07-08 08:16:12"
"110","1572","4","Training make information drop dog draw project past story agreement carry him above entire value break fill","1972-01-03 02:29:53"
"804","1573","5","Concern player check candidate interesting music opportunity community show yard push evidence","1995-04-05 08:58:30"
"1914","1574","1","Hospital campaign least where remember sometimes western rich describe main on generation hotel realize anything project manage American media leg age become Mrs","2016-05-28 08:15:17"
"1044","1575","1","Reach score score end director tonight sport law fear also maintain anyone total country","2009-05-20 11:48:27"
"65","1576","4","Just sport keep she order red eight beyond condition best guy race without year need occur itself identify behind","2020-05-27 20:03:15"
"426","1577","4","Model although represent seem little ahead make western above want threat yes even high he rate its up participant","2010-05-06 21:08:01"
"1926","1578","5","Peace officer half say table half look discover Congress memory who star result bar above movie man small","2014-04-06 09:36:31"
"48","1579","2","Treatment report moment occur see research consider dinner particularly want serve because exist painting create month near during she","2002-12-05 03:23:23"
"810","1580","5","A offer sound important decade heart write country worker be throughout prove big more tend cup glass bank quickly late like force none career anything off yourself","1982-01-01 02:26:54"
"614","1581","2","Floor they note who institution question receive prevent instead last would serious style which line particular ready party push red","1989-04-02 20:56:30"
"971","1582","1","Newspaper front dinner loss political national into ten size year article real soon address decade church the should happen us","1995-09-02 23:57:27"
"465","1583","2","So glass discuss instead particular order fact such raise third both music evening herself current west design practice","1986-12-19 18:49:56"
"789","1584","5","A him group show say matter what bag nice dinner production improve employee college design thing often low","2002-09-19 10:48:13"
"392","1585","1","Within yourself control avoid official third building Democrat there rest true region rate","1979-11-10 00:30:38"
"452","1586","2","Suffer discuss church begin arm might fill attorney whole include claim oil admit ask thing almost high season organization support total listen tonight away debate son","1996-07-01 05:00:44"
"519","1587","4","Out friend form including teach you husband surface business hit leader today blood goal others thousand administration project professor likely read","1982-07-20 01:02:23"
"900","1588","2","Big method discussion step style blue middle drive century senior few often be mission watch establish cover religious still foreign second structure white","2002-02-23 13:10:06"
"1433","1589","5","Why behavior medical staff individual magazine real situation bad western finish ability free watch down prove attack policy enjoy company","1995-09-09 09:40:25"
"818","1590","2","Might left democratic central morning face challenge evening consumer official science but enjoy result inside medical give federal mouth area admit store clearly choice","1993-12-25 23:56:06"
"1696","1591","2","Race computer stuff the technology add assume traditional my heavy candidate professor ability age central by what score around a suggest sometimes real","1989-09-02 04:46:23"
"1722","1592","2","Determine way result them recently turn where agency bill place boy together","2005-07-25 20:39:53"
"1036","1593","5","Measure idea skin maintain teacher expert send parent go anything if major lawyer memory almost firm focus follow term","1991-02-18 17:25:12"
"1770","1594","3","Line tonight set actually college group open American stage performance benefit enter message sit","1987-08-30 23:03:05"
"1893","1595","5","Customer value sure idea beautiful color common carry black admit bad music understand method","1984-03-17 07:37:32"
"1232","1596","3","Fear debate interest similar general add else church fill often system let lose","2011-05-14 11:43:07"
"738","1597","2","Many wonder over entire general physical relate south someone past catch deep man after go form positive","1992-01-04 01:10:53"
"264","1598","1","Safe sure big by certain friend dream huge mind much environment side human know prevent wind feel manager culture yourself grow school speech reason sister society","1995-01-30 04:02:14"
"1205","1599","3","Few machine positive hope up director case issue age energy so future best sell garden spring once shoulder","1987-06-06 16:32:13"
"1697","1600","4","Turn not him wait alone country factor culture leave run miss accept soon around difference board stay section citizen sign","1979-07-06 08:26:05"
"1662","1601","5","Significant address visit marriage tough magazine edge box dream agent artist education yes art recently fight hand operation identify","1989-03-25 04:16:33"
"282","1602","4","Tonight happen seat western charge final able place fall teach sea everything Mrs listen successful","2006-06-20 10:18:30"
"339","1603","2","Window sense close break change lot executive girl drug accept charge where tax month sport sing reduce paper must talk culture","1975-03-04 05:06:51"
"420","1604","4","Trip peace voice south check require skin machine cold husband work carry effort fall huge conference dream generation this election outside or policy opportunity position market","1987-09-04 12:13:03"
"1506","1605","5","Shoulder participant result risk enough upon agent east try practice office protect easy store company film","2011-11-14 17:07:54"
"196","1606","3","Security community kind exist green fund nation seem team success kind maybe get run three nation he because exactly just begin","1999-07-17 10:17:31"
"354","1607","5","Knowledge financial item pattern indeed image involve since rock much themselves return sea event role high white action reflect interview along million detail door book","1986-05-05 08:15:05"
"1436","1608","3","Indicate particularly quite next draw really well recognize ask term wear American know sound member none sell rest week enjoy nature","1986-11-12 12:13:12"
"284","1609","5","Discussion state figure industry later prepare sense place none require as statement teach agree","2012-09-06 05:43:26"
"1924","1610","3","Before structure we free fly yourself couple enough paper mind guy relate police laugh structure","1996-09-17 12:49:55"
"179","1611","3","Present energy everybody call approach notice piece table as participant cell look word use seek it notice in father realize","1985-06-21 03:57:50"
"177","1612","3","Her lose analysis foot talk establish interview how floor think by still run kind director","1992-01-27 06:53:09"
"1574","1613","5","Everything suddenly hour both owner talk participant relationship establish run season anyone serious because","1979-07-12 11:09:28"
"1880","1614","4","By factor response daughter picture people side red develop woman listen ground material check however public family tough fact table point","1979-10-11 19:41:27"
"1702","1615","5","Begin possible just them laugh experience necessary least party miss worker buy water learn","2002-08-06 04:57:54"
"1849","1616","5","Loss still church teacher feeling window record entire any stage safe coach store join back floor itself deal kind yeah official politics","2018-04-16 02:40:50"
"713","1617","5","Far buy decade language here out factor despite such movement health fire true everybody blood behind suddenly hit perform a media organization","1975-06-29 19:36:08"
"1037","1618","2","Send general deep clear foot scene information body former chair song impact well under recognize accept government table no social whatever require address travel within check positive","1991-02-21 07:25:33"
"486","1619","2","Write knowledge short class yeah listen report little wife rich night tend","2002-09-04 01:36:21"
"127","1620","1","American again leg surface certainly particular beat hand understand describe base more part Republican continue short save history movie likely serious meeting","1974-06-22 01:16:41"
"1469","1621","5","Drug baby company almost experience collection career forward run wrong order wonder local alone individual but player research much key finally southern push organization student","2001-06-10 03:14:19"
"37","1622","1","Cause analysis year trouble billion seek debate clear science move simple ten","1976-05-07 03:35:30"
"829","1623","2","Clearly any state character sing four beat notice after responsibility half dog central experience radio local particular forward black represent","2002-04-03 11:28:49"
"1375","1624","1","Staff none rule night senior between forward pattern generation always positive kind to ball story current road friend support home like sister election amount behind","2003-11-09 17:30:37"
"724","1625","2","Back exactly soldier summer believe last usually near peace strong outside last between effect be conference question present fish past way risk those police popular cell manage","1993-07-18 23:51:14"
"239","1626","1","Catch but weight sister capital provide produce range husband data finally between father name him budget something course true those audience toward pay catch","1994-09-20 01:05:45"
"1510","1627","3","Key fund line subject responsibility enjoy design color walk movement group hour forget order decide plan medical","1995-11-05 03:27:57"
"1658","1628","1","Then box physical rate lead even stage indeed resource management talk thank claim exactly after address professor next ok although imagine rise arm he","2000-09-17 04:41:55"
"124","1629","3","Describe religious manager far group behind price movie mention close common require participant total which region various time sort phone my way little under from seek","1991-10-14 05:13:26"
"899","1630","5","Science skill item collection difficult window say vote democratic so dream total myself","2010-10-09 06:02:13"
"872","1631","1","Various try determine itself other high news film prove degree fight marriage student","2012-08-27 05:38:21"
"1319","1632","2","Who open personal as then style everyone somebody kind from hold system affect pass power break star around","2018-01-05 15:03:01"
"280","1633","2","Weight Democrat peace respond ok if think this mother plant child position huge room least class speech","1972-05-19 16:37:50"
"370","1634","4","There address their include exist sell performance training husband discussion continue soon network man else","2016-09-04 10:40:33"
"39","1635","3","Go easy war radio the know here answer nor choose leg network produce while glass chair","2000-09-30 09:41:00"
"392","1636","4","Bank tonight win least teacher present much develop member drug sell leader front mind your next should course note ask five","2017-12-29 13:37:01"
"182","1637","2","Local record detail best again her stuff two hope manager almost fund summer people executive summer agree Mrs prepare notice surface pick","1997-10-02 06:59:54"
"1737","1638","1","Here skill bill rule wall fine specific exist imagine speech country population glass memory speech law may bar run whom job adult low seek","1980-09-18 16:21:11"
"1727","1639","4","Leg break our threat individual life participant big brother company cold respond scientist later really box real spend east tough have child arrive draw stage they rate","1998-06-25 10:51:57"
"1354","1640","5","Significant money reach us wonder try guess behavior marriage owner ten body thing show sense final baby impact piece top","1981-07-05 06:43:15"
"1371","1641","2","Either Mrs others image order worker ago prevent recognize decision teach know similar safe under market identify garden mind team","1970-06-04 04:22:15"
"1341","1642","3","Need available development little institution because baby half development around fact trip together lead already write own six available young good","2018-01-30 14:48:39"
"1508","1643","4","Enter huge city last former rather really remember understand well deep media may hold bit power","1980-06-27 22:16:46"
"1033","1644","3","World cut learn hard local arm smile drug this wait case voice letter success body stock suffer score strong","1988-09-12 03:57:03"
"389","1645","2","Hospital turn answer happy science stuff reflect have best change rock road consumer citizen expect since data watch support Mrs thing especially somebody seat edge sell","1974-04-28 13:07:14"
"1342","1646","3","Our offer important nothing get go charge article full total half simple represent myself public at among page its high benefit walk project have however agree act","2007-07-14 15:34:10"
"1258","1647","4","Return wife choice nation good half another message expert cut near ready teach age name scientist begin north form develop plant may central which","2021-05-04 23:50:21"
"447","1648","4","Sort adult four idea particularly son trouble force cell this send job threat guess if energy especially beautiful hospital job little voice score natural have end","1978-03-08 06:43:39"
"1063","1649","2","But change onto alone kid live later thus modern short this knowledge here whose","2014-03-27 07:55:45"
"1259","1650","2","But project drug across early voice at best guy gun wife case Republican although break west power drive politics another many","1986-11-25 19:02:17"
"688","1651","3","Brother any represent or certainly wish if back adult because lawyer student race once fill tree science your dinner not north scientist shake culture listen rather score","1996-11-30 16:00:58"
"143","1652","4","Buy day special left foot tough low floor likely out strong be sound loss letter worry far build","2021-10-27 10:55:21"
"1214","1653","5","Nor field leg safe both century bill management left somebody century firm investment model program truth table key both thank miss according that source","1982-04-13 17:02:45"
"1042","1654","4","Though while particularly center fish factor mission hand seek that PM could","1981-10-12 06:56:45"
"19","1655","3","Bit end how speech five way three last garden exactly action size","1987-12-18 17:12:48"
"966","1656","3","State camera study region production example station deal admit matter instead civil","1984-07-07 11:26:31"
"1128","1657","5","Morning whether nice five five short ok democratic happy candidate provide on feeling determine far production level any effect position home matter","1991-12-22 12:20:22"
"615","1658","2","Against data her eat model size suggest church health cold hope accept someone understand performance rock require five","1972-06-08 20:17:44"
"115","1659","3","Car rate then spring brother about wind sign before become water couple understand look teach role customer information wear include office two teach shake main","2007-03-23 13:53:04"
"739","1660","4","Game leave against card include growth less design job floor possible evening social world design much interesting box gun age change","2018-05-30 20:56:04"
"1565","1661","1","Hot seat teacher paper administration entire relate entire forget white near agent help set expect enough thing score every meeting key","2000-08-31 18:41:42"
"1617","1662","3","Guess indeed couple any business field campaign director teach military level represent customer action tend yeah discuss","1972-01-19 08:39:26"
"126","1663","5","Wait ask record together box cause perhaps listen population cause learn career under","2012-08-10 00:50:01"
"1558","1664","2","Country environment kitchen magazine economic personal position certain whatever ask place blue","2011-08-18 06:48:30"
"780","1665","2","Read explain else paper trial plant social result hold machine interest data cut yourself group hope member civil religious return study other crime simple specific kitchen maintain","2009-03-21 16:15:59"
"1519","1666","1","Tell soon order issue smile seek want cover fast old suddenly light ground society early gun form before rate work quite manager thing","1989-10-21 02:21:43"
"729","1667","4","Able tax nice and wife treatment a scientist speech child pretty speak unit factor day shoulder participant water glass level standard though shoulder specific hot course be","1984-04-02 00:15:11"
"1407","1668","5","Eat wife attorney mention somebody stand student southern think billion century also property direction rest green ten matter image police never sit water","1973-08-14 12:15:00"
"520","1669","1","Rather image yes add cold item capital follow growth several page without necessary opportunity democratic full","1980-02-08 06:57:56"
"15","1670","3","Then on spring section whom attention reason fear seek those crime police first media skill listen identify performance which data dinner break government see case star natural","2009-04-01 05:13:58"
"1881","1671","5","Call TV election material couple once place gas after fill animal read walk speech fly claim if state in fight outside gas now","2003-09-26 07:49:53"
"495","1672","2","Recent test partner not same laugh until election service often keep probably suffer local want else same rise child coach past less authority particular","2015-11-04 14:47:37"
"1580","1673","5","Everyone after already rise water fact simple writer sound so some page nature according foreign hit bed occur idea including sort after","2008-03-29 21:06:18"
"623","1674","4","Ready woman remember move east author chair bank sea design seem simply we happy our parent mission network development perhaps share education fire institution","2019-01-10 06:40:53"
"877","1675","1","Sense board trade ground difficult nice project experience home medical teacher somebody country exactly friend support bag relate enter skill","2015-04-01 03:34:57"
"1906","1676","2","Find listen should information store firm above until toward large business statement","2010-05-06 03:18:59"
"444","1677","1","Sport action become sport minute spend ready left practice subject everyone test lot administration order performance wide two","1993-01-04 10:23:17"
"939","1678","3","Help hold culture response interview region get loss candidate store red traditional require future couple cup real without trip mouth land rock development","2001-11-14 15:23:44"
"1435","1679","4","Type building step send hard notice mind industry process condition race while control information tonight","1998-04-22 05:20:36"
"423","1680","1","Foot almost water hour including around see call later place knowledge child against art from education exactly local rich tough image send seat option that list","2020-09-17 09:09:20"
"1564","1681","4","Act accept thing deep shake cut operation American finish so necessary any home trial use law know its spend enjoy order least thousand form television would","1991-07-08 22:31:24"
"980","1682","5","Visit recently look entire worry friend charge hour against party successful expert material","2000-05-16 09:02:19"
"196","1683","4","Language environment walk director view officer over capital husband lay short same administration hot amount","1978-02-06 09:27:36"
"1271","1684","4","Cultural rate investment represent though apply effort floor model light nation road compare whether letter agency six chair make","1980-06-05 02:05:35"
"1071","1685","2","Note prevent wife account activity model about quickly simply consumer put project choice use behavior specific claim community back down","2021-05-06 19:03:00"
"1926","1686","3","Year late performance despite sit alone situation note method magazine concern also all body system professor","1986-08-10 07:58:28"
