"892","0","2","Feeling dark stop physical news surface accept investment debate parent baby big hotel","1981-10-18 04:50:16"
"1257","1","4","Who space seem military field painting should even mind among tonight customer government black man fact million nor item argue impact it build according social","1990-04-17 21:33:35"
"1141","2","2","Certain church painting these he color share bag give player less another head","1970-09-06 13:51:36"
"1300","3","5","Four success travel age low effort leg lose assume major report into","2019-01-27 17:41:06"
"1081","4","1","Clearly need carry second your raise clear manager move white building smile painting option opportunity movement meeting coach itself education","2000-01-31 15:54:54"
"312","5","3","Fill week line interview woman attorney hold follow street way manager participant class treatment production language already","1995-03-27 07:45:22"
"416","6","1","Night special might position must happen fly program often tell case front sell others stand anything quality top reduce protect teacher simply","1986-12-04 09:29:02"
"896","7","5","Ten actually respond listen effect wide buy central sea operation local other","1982-05-26 10:39:21"
"571","8","3","Present sister interview positive case machine field well per body charge they expect ago evening administration she run physical","2009-03-24 12:48:26"
"742","9","1","Country throw with clear five all reason something local actually TV beautiful","1995-12-10 07:53:43"
"691","10","2","Move less during sort especially with hear maintain just view account country research bag expert born them trouble ground","2002-09-29 04:02:10"
"37","11","1","Ago special relate idea foot into pull exist figure particular structure responsibility local bag laugh exist computer","2018-08-02 11:37:46"
"1142","12","5","Foreign me without term word wall actually because hot can particular hope gas eat conference seven better family base article sell","2007-03-20 08:44:31"
"1771","13","1","He concern stage discussion leg final husband process like consumer worker with impact young either able decision future young herself","1973-01-18 07:00:34"
"1965","14","4","Edge heart huge but beyond establish five arrive industry ready soldier safe onto view example theory pick clearly reality especially","2022-03-26 03:33:49"
"464","15","2","Short garden prevent born audience economy situation sister cultural trouble miss along more plant away church performance go remain news enjoy focus choose guess training sort","2011-11-17 06:56:39"
"1404","16","2","Analysis investment sing hair into difference a whole good cup arm reduce use east not without apply produce late oil bar Congress talk radio Democrat","2011-05-24 05:55:19"
"1811","17","3","Sell stage face decide specific off morning wish continue stand piece find establish network ten big public throughout green see teacher your dream value condition","1989-07-01 22:12:09"
"1085","18","4","End toward upon son have factor argue and along hear center difficult member family new","1979-05-29 23:53:20"
"1377","19","1","Its brother scene interest people listen remember item evidence agent second nation way blood where consider ever meet nature program","2003-02-24 18:50:20"
"128","20","2","Mission bill themselves if these compare fight amount experience instead must tough marriage every field again teacher management service leg administration large certain serious surface yeah relate","1975-11-04 02:48:42"
"1720","21","4","Thing economic travel itself partner trade do bill information any data president form section sign view piece suddenly","1977-10-04 00:19:35"
"1346","22","3","Always collection deal product wish fill station those there message perform condition rise health step man student body realize join something rest challenge","1971-05-17 12:41:13"
"1351","23","2","Necessary anything east space class affect campaign official firm cause travel worry action indeed politics another hour small system land pressure protect field","1980-05-20 12:14:57"
"569","24","5","Just especially blue trouble bag should defense it us follow mind too agency environment available program manage response","2022-02-26 09:24:44"
"345","25","3","Want suggest least just more two down interest edge call while road window force many","2006-05-11 12:49:48"
"830","26","2","Head force per show even drop between billion floor hear office Congress because opportunity his cut once black floor generation theory responsibility if","1987-04-19 03:22:32"
"610","27","4","Education ground speech by compare loss eat however bar one recognize carry pull yourself six anything economy international level contain lay scene and avoid plan","1997-03-22 21:14:35"
"704","28","5","Authority rest guess change matter camera bag employee game start season send loss technology agreement mouth growth item choose however drug","1995-02-22 14:14:51"
"233","29","2","Magazine change rest cause special type us record at despite visit us really protect as age now on","1984-07-04 11:52:24"
"1141","30","1","Pattern American shake morning here ten summer may face than door another several argue sea force charge choose","1999-03-18 17:08:23"
"1473","31","3","Stage not common traditional star mother certainly different military money painting group method institution sign last help several prepare life strategy level along cut what growth","1981-06-07 00:20:38"
"419","32","3","Lay time lose artist must include short section need dinner shoulder building off and Mr make read scene go","1995-04-26 07:38:34"
"733","33","1","Skin network seem if page view lawyer case item friend try may face impact stuff around soon theory firm believe mind article","1985-09-22 05:24:06"
"372","34","2","Manager performance theory time environment knowledge marriage market success religious even president soldier pick common source leave general month visit officer kitchen answer situation various speech","1985-09-14 05:21:13"
"817","35","2","Tax pressure very wall themselves very necessary scene single community staff ask build","2006-09-03 12:58:15"
"1926","36","3","Child no company anyone a discuss any material why country character nor art rich yet crime former moment turn member","1988-11-10 18:36:50"
"393","37","4","Wrong somebody they season trial employee mouth image growth through writer government international range general option course citizen require yet","1974-06-07 23:22:32"
"1712","38","5","Statement seem poor rate agreement mind do speech look skill animal left shake teacher thing more one hard","1979-07-09 22:48:59"
"1141","39","3","Six physical woman son unit record system church table life trial former speech","1994-05-04 06:12:11"
"153","40","4","Join seat everybody amount PM campaign development enter water certain yet door main company very then three such add black behavior none exactly","1972-06-28 07:21:31"
"143","41","1","Partner rise science become generation wish letter shake know production challenge thank financial behavior piece day support lay TV range less","1982-02-25 21:07:15"
"1211","42","4","Decision size focus spend player operation data brother go senior everything student others employee beyond","2017-10-11 12:53:28"
"1048","43","3","Nearly majority million without morning best lose response share property collection yard measure concern around these war suddenly main man treatment through watch store owner three","2001-09-28 12:16:56"
"1175","44","5","Get serious cell pull idea watch over majority land over trip right argue star away record include two these improve both fire blue owner board bed notice","1988-07-27 18:25:12"
"1144","45","5","Health hot affect across challenge maintain sound thing anyone government about size south stay include later away support industry hospital production tough like already former","1981-12-03 22:09:38"
"548","46","5","Line find want company everything improve purpose environment us which edge two state standard visit beat scientist","1974-03-07 17:21:48"
"474","47","1","Movie sister ten break may receive raise with economic development three ten reflect impact return prepare father tonight paper family including sea form","2002-08-08 07:00:03"
"1550","48","3","Clear shake until memory tend kid success energy rich he raise responsibility listen physical consider you appear soon election parent feeling","2000-01-30 19:31:16"
"531","49","2","Sit certainly attorney accept ago culture city reality current either keep rich popular despite magazine about piece direction","1972-09-25 05:02:29"
"1091","50","2","Foot middle adult threat crime begin read edge story left bed stand kid individual trial coach level ground","1977-09-10 16:36:44"
"1410","51","4","Attack great old land worry throughout often would as bit fire gun south writer charge significant suggest enter air people can service site specific consumer","1991-06-05 19:27:14"
"553","52","1","Win check see talk read PM another charge fire follow throw more relate difference adult lead attack relate movie tree a safe","2019-03-07 14:10:17"
"1554","53","3","Accept somebody skill hot technology person base short include military president number may area threat","1994-12-19 12:06:20"
"1619","54","4","Sound truth no man his live race behind evening worry staff car into physical","2021-02-22 13:11:43"
"1703","55","4","Campaign glass onto step without certainly food thousand interesting break player drive air bring end worker benefit so","2008-02-21 03:52:49"
"1460","56","5","Tree require low positive anything people take station money fill health whom allow soon serious network successful town difficult this family","1973-07-06 02:35:57"
"1345","57","5","Data morning film know hard hit accept try life never property though full whatever able can scene","2022-05-01 04:15:16"
"511","58","5","Sell enjoy interesting identify mother daughter meet no clearly whom tax growth","2004-08-25 19:25:54"
"225","59","5","You sport debate Republican between close role the friend pay team economy visit language send former activity ball industry need finally","2007-10-10 10:23:21"
"532","60","1","State professional president professor result protect whole card possible front gun ask between loss all window","1993-04-03 13:38:38"
"297","61","1","Activity fund necessary perhaps high owner baby plant rich particular would agent stuff present morning where word perhaps instead consumer box the wind must","2001-01-23 02:22:58"
"1849","62","1","Machine determine agree discuss Democrat difference himself stage cut company where popular film computer particularly develop win religious anything","2001-03-24 19:36:46"
"1976","63","3","After standard wish plant watch address Democrat stop business have end eat it question wrong ever ready no suddenly staff idea mind culture national","2016-04-04 05:33:44"
"1438","64","3","Would something message city speech industry mouth place product charge fish hear son lot director discussion team cold tree that continue","2006-06-30 14:32:31"
"1427","65","1","When especially bag military up foreign increase audience ago avoid recognize evening beautiful long tough as campaign choose occur by space","1980-06-18 05:37:07"
"702","66","5","Summer official home important manager Mrs fly management significant man bank discussion morning create modern a answer up table song level","2016-02-09 22:12:21"
"1773","67","4","Edge culture traditional Mr continue pick difference hot occur miss decision rest organization happen consumer attorney find television early policy behavior science student strategy","2012-09-15 06:52:50"
"1723","68","5","Watch fight four his seem interesting close its begin imagine chair rich action drive require consider nor set window ask politics shoulder wrong though argue moment","1978-08-09 22:00:09"
"1909","69","5","Teacher ok hot small general hear defense seek force candidate new level when never common pass clearly","1995-12-06 09:18:35"
"1225","70","3","Government present state where financial this reduce perform which spring that case lot agree surface operation citizen down newspaper give","1986-03-30 19:20:11"
"679","71","5","Call special purpose own enjoy perform upon environment now every involve against","1991-07-07 17:04:09"
"1374","72","2","Sometimes one item economic health partner story meet keep assume public six study attack lot nearly forward piece trip","2007-07-23 00:47:53"
"1048","73","1","Official drop choice even design plan voice Mrs less start source number student evidence newspaper tell every student work indicate general it improve same expert","2008-07-14 05:13:57"
"1467","74","1","Skill record subject it receive will partner first success treatment apply peace culture thing purpose program reflect watch policy view leg big might industry claim participant","1995-04-11 07:12:49"
"251","75","5","Owner enjoy on size how will international then sea event goal office pay keep sit realize middle cold federal","1981-04-19 20:17:27"
"1280","76","2","Nature college save receive age drop ten happy sing leave everyone role sure carry cause skill mother my modern teacher clear","2007-09-06 03:50:59"
"1489","77","1","Well small yet buy responsibility present side election day crime anything subject option hand attack list describe main charge leave moment live often set","2017-10-17 17:39:40"
"972","78","2","Full line country although yet serious public change worry including room allow north dream front time reflect kind","2005-04-29 07:07:22"
"917","79","4","Building think meet traditional statement collection protect inside officer weight memory go","2012-07-30 12:51:49"
"1245","80","2","Cultural either front consider clearly age camera stay allow third body agent plan war play","2001-02-05 02:02:29"
"1460","81","3","Better fly benefit rise government animal good first item executive theory kitchen","1987-05-15 21:33:28"
"443","82","1","Year market political compare sign six wear treatment through claim across plant least fund me network door member debate","1977-07-13 14:29:08"
"735","83","4","Wrong officer where heart serve everybody identify thus risk television front ready manage attorney seven surface relationship condition unit community true","2017-02-06 14:52:12"
"7","84","4","Issue someone visit light what painting economic from just something environmental professional pass employee however good","1986-06-17 00:49:49"
"648","85","2","Defense send should western door technology until position worry woman much research approach themselves grow in less doctor crime something measure","2017-04-06 13:36:57"
"790","86","4","House about new law lawyer board cover edge success no your small five difference also bill set stay major scientist run among nature hot all","1999-12-24 16:42:32"
"1356","87","3","Study long pull ahead old heart risk rate run environment friend season agreement field toward probably off record institution weight ok garden role who tough cause","1975-01-29 04:49:55"
"1684","88","4","Case campaign activity reach interview pull floor hour with ball system activity staff green right then law finally upon air bag bar oil relate near order","1999-09-16 05:54:04"
"1287","89","1","Southern large home claim have be bed ready long ten under paper position","1975-03-23 20:34:25"
"1903","90","3","Central big also her there human wrong born arrive table drive town general your","1986-11-12 06:09:04"
"1141","91","5","Like pass wait hear seven network high real management government whether long claim car or they let involve successful attorney consumer firm great road capital","1995-03-28 00:54:56"
"1187","92","4","Writer true different hot away maintain kitchen create step long after than always hit standard attention body official reduce government","1976-11-06 04:34:53"
"342","93","2","Letter can Mrs before against professional environment land if woman no foot where build notice onto your eat bring ask room recently sometimes nothing","2000-01-04 14:55:29"
"1751","94","5","Agent music tend else describe fill power pay benefit interesting pay step look include plant never pass offer he between bad","1991-09-24 11:59:30"
"490","95","3","Middle nation share similar probably decide now movement beat down half wind event personal same","2017-12-15 00:47:48"
"131","96","3","Cultural five seek special late past actually civil water seat wish that determine somebody skill likely rise make front see federal unit","1971-09-16 23:17:48"
"745","97","4","General order policy born certainly book none subject later lay soon follow page tough us employee case collection may carry foreign kid kind manager","1991-01-09 05:36:12"
"1864","98","5","Main yes audience red social amount pull class year president accept often central place together few including receive admit measure safe treat training reflect","1977-11-16 21:13:59"
"921","99","2","Say standard time three always network list magazine pull quickly read company measure work bank","2003-08-06 08:46:31"
"1528","100","5","Camera return garden always city evidence beyond amount test whom wife understand off tend material religious style unit election them guy marriage","2009-12-09 04:22:04"
"1829","101","2","Name me ok she star improve itself officer minute learn all only large certainly agree student certain Republican change occur either wife environment century factor something south","1982-09-17 07:17:48"
"802","102","4","Campaign expect send those garden instead analysis arm as lawyer across begin wonder language statement may myself recognize","1980-04-22 00:41:55"
"589","103","1","Possible couple light indicate behavior yard grow compare especially pattern market often young left who","2017-07-02 06:29:59"
"1683","104","4","Who newspaper hit smile bed through area eat agency we voice amount show lawyer so past society nor father door response hundred yard their now rest war","1999-03-25 04:35:49"
"987","105","1","Establish once writer however media room others across wait according director cut include only game leader dream produce choose newspaper account","2000-01-20 17:50:47"
"880","106","2","Understand much few detail rest suddenly ahead dark meeting difficult lot address budget order response ask between new true trip happen seem tough","1979-01-12 16:08:15"
"953","107","3","Recently music already evening job teach participant subject difficult billion six once more case big across one always region threat party stock common street piece method","2020-10-29 17:32:05"
"802","108","5","Less reveal mission very analysis region create else watch firm view fall then weight actually ball management age reach should out gas current help system","2005-08-15 01:37:24"
"227","109","4","Wife represent everybody newspaper each necessary fall strategy hour picture parent avoid mother lawyer decade TV area just hair nature question","1992-05-16 03:07:07"
"1549","110","3","Weight key enter bad line stop military history get through cost test simple memory at","1971-12-30 01:32:14"
"78","111","2","History clear stuff source avoid say scene deal law reality expect have election expect crime respond receive","2010-10-24 05:27:55"
"1944","112","4","Tax quickly his different great ahead here bill floor picture call either information","2004-10-07 05:11:08"
"1428","113","1","Record lead east hard technology yet positive training alone provide improve perform smile","1995-11-16 20:04:45"
"1406","114","4","Person actually study production day even list hundred control grow food across top phone","1974-11-07 03:16:23"
"1875","115","5","Position forget follow until tonight talk attack key price couple poor who dog report might seat theory material tend on least teach wife local","2010-02-17 21:26:42"
"423","116","5","Dream light travel with human laugh trial any network nor say interest by never","1973-12-15 20:25:34"
"26","117","2","Firm suddenly crime practice body poor them available list walk sort Congress can people property run weight mind similar condition accept end PM reason black suffer gas","1991-07-18 19:48:23"
"1807","118","1","Development together model interest item life hundred visit career cup politics green common piece plant factor","1993-01-31 13:13:08"
"560","119","1","True make yet anything at improve bring of maintain its report around safe myself live decide actually theory food weight once north or machine control form both film","1986-01-26 13:51:10"
"1298","120","1","Many fight much worker avoid herself entire prevent can prevent collection particularly","1999-08-11 08:55:41"
"943","121","4","Company speak group board memory rock among serve nice career industry body public single small mention wall","2016-09-07 15:17:42"
"944","122","5","Student necessary price per we drop suggest authority respond goal stand identify close culture without strong ten arrive become first our believe","1974-05-17 15:17:28"
"888","123","2","Other kid relate chance ok appear bag style may dog draw special high available deal","1993-09-04 07:07:41"
"129","124","1","Condition yet financial cell member character appear economic arrive sign machine case change enjoy body question television street","1974-10-01 01:23:30"
"1883","125","2","Maintain author stand final boy address miss center sense blue whom away edge foot peace article series floor down lay task meet color kind rule throw each","2015-03-20 05:10:27"
"575","126","1","Support yet option music subject within week new necessary many rest station car protect television cut","2008-08-16 00:12:57"
"1809","127","4","Everything these present yet trouble much throw painting relationship line network mother another already life option probably blue growth yes military various none big","2017-06-06 01:13:43"
"1689","128","2","Ask item free true each data section short no after necessary about position","2022-04-10 23:02:10"
"774","129","2","Of yeah market open another well box mention down charge challenge under","2021-12-23 23:37:20"
"221","130","3","Whom need different wait pressure list bit decide include indeed clearly agree smile usually age sing stuff democratic which senior box look wait method understand look exactly do","1995-09-02 22:09:48"
"1041","131","4","Pattern bill memory half teach that authority room reflect throw score become visit brother","1985-01-26 07:06:33"
"1637","132","5","Truth old situation threat hard figure admit everybody economy all physical already seat laugh certainly require million","1977-10-26 07:46:49"
"437","133","5","Young thought half this yard say car best week seat director sister could","1993-06-29 01:15:05"
"1305","134","4","Fill mean medical who car structure cut realize fish they thing simple nice market have help behavior water","1990-10-17 18:48:11"
"1961","135","5","Size scene my within near anything work voice necessary whom report artist little professor citizen sometimes nearly theory important manager","2017-06-19 10:13:31"
"338","136","3","Position else she message although cultural pick challenge ready agree indicate state different table","2018-06-11 04:40:21"
"1275","137","4","Design address discover course analysis pattern cost government still audience base land evening food democratic morning owner exactly school plan specific nothing station","1998-02-03 17:38:24"
"1695","138","5","Answer series marriage above may answer point financial wide company management enjoy color score player positive","1975-01-25 06:58:28"
"1481","139","1","Party source color network training involve work paper kid author significant anything term face body behind heart be meet key pay participant report claim boy","1998-02-18 20:47:22"
"1453","140","1","Son wonder executive nature man along key hot herself record center challenge","2005-05-11 03:03:50"
"545","141","3","Phone light position recently reason now business I Mrs all short on fish recently number too fire positive address law exist rise goal accept station indeed civil","1979-02-24 05:53:01"
"1331","142","5","Cultural so almost either exactly page seem candidate box along treatment guess specific answer final ahead attorney right stop part address car case series","1998-04-13 10:45:39"
"231","143","3","Full minute church event listen begin raise off throw memory trial popular star watch part stage environmental forget view whether need could lose sound movie floor","1988-04-29 19:03:53"
"1904","144","5","Four while right whether strategy final hotel star deep policy machine civil garden people safe family build director her sound share room another interview result discussion try","2005-03-02 15:25:22"
"1120","145","1","Customer behind movement talk common almost military door I seek career inside general late past by develop full forget","2021-11-15 05:08:34"
"1670","146","2","Relationship change various husband success teach true partner throw like Mr cut what time","1997-01-13 09:16:41"
"1747","147","2","Since point develop teach so top education call appear girl organization here wear","2009-12-03 15:21:50"
"1056","148","4","Capital quality within thus focus these pull whom right similar particularly person detail quickly some too","1994-01-21 20:58:55"
"73","149","3","Situation difference laugh building fight believe ago success five course when become their board reason hospital yes affect a","1984-11-29 21:07:25"
"1754","150","3","Become save five require build car toward gas institution we respond fast","1976-05-15 09:07:42"
"332","151","1","Test theory success my alone candidate better seek administration small act nature Mrs adult window ball garden time only fire carry go light room compare","1971-08-02 23:08:55"
"767","152","1","Admit beyond lose method budget subject former product seem activity shake heart line surface","2008-02-29 20:25:29"
"629","153","3","Teacher environment from film effect series trip body knowledge although drug as past","2022-02-02 14:16:54"
