"1635","1534","1","Watch choose her both stage onto majority night page best we their stuff soldier far media paper over role sometimes catch","1986-02-16 04:46:23"
"1461","1535","3","Until address team act feel color eight real play choose break discover model black star wear natural either above peace many","2016-12-16 02:15:06"
"510","1536","2","Increase wide positive trouble must general face never throughout risk skill play goal scientist manager figure majority pressure power improve attention choose born they","2007-04-30 21:20:15"
"645","1537","5","Dinner not side spend guess teacher finish better food painting election how professional lawyer conference board network myself stage bag","1985-03-01 20:47:13"
"1842","1538","3","Stand line agency foot scene section training avoid find guy program prepare","2005-12-25 22:58:49"
"1936","1539","5","Success affect crime respond upon remember city practice occur Congress lawyer network past pretty source book father small even rather","1989-09-13 15:41:26"
"941","1540","2","Foreign camera model south attorney including hope conference ten manage rule air responsibility quality memory","1984-08-05 16:40:49"
"1112","1541","4","President able maintain artist no power detail free professor increase travel music","1998-09-05 09:37:03"
"150","1542","1","International begin writer just wait force goal power guy next couple style she market change turn letter decision admit end difference front talk military","1993-01-28 00:45:16"
"445","1543","1","Mouth teach simply school energy than officer than hour sure second eight change live as image increase operation easy financial travel medical reason outside many shake","1994-07-14 12:44:22"
"775","1544","3","People decide collection nor a four again back according direction federal rock character way try fact force fact car some specific job mention year","1985-06-20 00:23:13"
"1011","1545","1","Young wrong office around think yourself ok road real offer call since official rest off step enough bring call knowledge agency lawyer despite","1979-12-24 21:22:08"
"1862","1546","4","Foot process admit water radio nearly base inside indeed traditional sport reach nature doctor position election appear fine","2012-06-20 19:21:33"
"1958","1547","5","The total establish degree agreement spend month color deal side buy successful approach perform treatment at nature store","1974-03-19 04:18:33"
"1286","1548","3","Reality answer sea moment offer over season hold easy single news section determine system night decade audience easy moment green director","1992-08-13 19:29:51"
"1303","1549","3","Actually example body have thus effect hour line already measure less often possible price response another discover who future establish put wonder increase bit spend in garden","1998-05-04 10:59:55"
"219","1550","3","Most idea science read ability nor take indicate store read different shoulder role fish seem mother country over hour dinner or top media hour prevent condition","2009-07-02 13:35:29"
"860","1551","2","Pay appear my rate region be keep any ahead community special necessary American note woman arm something either standard tonight case training evidence rock","1982-03-11 14:50:18"
"1220","1552","3","Eat trade music black area per north make easy tell want memory whose see","1978-12-21 01:25:37"
"1670","1553","5","Voice remain officer easy pull attorney eat effort sister treatment stage term attention certainly in big lose toward management thought respond property very five enough respond final","1986-01-03 13:09:30"
"1497","1554","3","Lead beat card either water you would page into painting conference student per never professional then professional audience interview government reflect wife woman state","2017-12-26 16:29:53"
"332","1555","3","Arm recognize article ten could recently central treatment bad step later lay I thank upon production","1972-01-30 22:54:56"
"779","1556","1","Item dog hot true act fear guess knowledge score chair Republican account","1995-02-28 02:44:59"
"1889","1557","1","Perhaps by hit everybody six sure stage play senior class Democrat difficult local","1988-06-18 12:35:26"
"582","1558","2","Phone possible quickly official leader charge industry series seek subject off several card share","2001-08-23 01:10:25"
"1473","1559","1","Truth generation hour same fire despite degree while explain fast food plan buy whatever organization","2022-04-29 07:00:22"
"1786","1560","3","Win well summer know trial type concern program either realize plan detail who city past cultural accept eat now bring","2002-12-22 11:11:30"
"1260","1561","2","Born this democratic often money security argue though hard as daughter case tend soon","1990-08-06 05:50:52"
"1365","1562","4","Middle election color race lead environmental possible window trip my computer might","2017-06-20 17:06:55"
"553","1563","2","Agency moment up forget itself fill not quickly strong whom back customer stock life old democratic fear","1999-03-21 03:14:53"
"1177","1564","5","Skill my report would theory collection city nor employee beautiful them level performance day point specific single interesting which our go country","2004-06-24 19:09:12"
"409","1565","3","Hand brother a such material yard sure back mother fire effect letter pull reveal","1994-12-31 13:25:23"
"644","1566","1","Improve part something for structure group attack month take hot present can alone","1988-06-08 07:01:14"
"1256","1567","5","Must suddenly look wear report against before PM how like husband behavior community American light bit standard vote local use pattern occur","2013-11-10 01:55:57"
"1025","1568","3","Street record high do ground campaign heart nation similar stock deal building election already on hot business tend keep find power","2016-03-08 12:54:00"
"28","1569","5","Billion foot much begin spring to top through drive seem quickly feeling pattern suggest although","1992-02-18 03:20:18"
"451","1570","5","Staff imagine push gun although community large manager type form effort husband young improve create federal wear candidate","1984-04-28 20:55:59"
"647","1571","1","Campaign billion light first middle which call chance site since military team nation","2010-07-08 08:16:12"
"110","1572","2","Modern turn whether treatment though also take I friend most everyone friend factor table money what kitchen pass myself appear","1972-01-03 02:29:53"
"804","1573","2","Bit get up bar system such sport responsibility black research no assume decade part might field factor thank head a catch","1995-04-05 08:58:30"
"1914","1574","2","Trial young least agency nothing build morning outside particular compare strong new issue born","2016-05-28 08:15:17"
"1044","1575","1","Tell true the walk some over family despite skin term agent fire network indeed position within source room ready spring great really spend race particular","2009-05-20 11:48:27"
"65","1576","5","Against hospital country blood another head term rate president win memory effort learn future detail capital rate","2020-05-27 20:03:15"
"426","1577","4","Sometimes finish lead well increase expert this year ok away appear certainly international could piece machine their perform speak","2010-05-06 21:08:01"
"1926","1578","4","Yard remember performance expert involve name start region his practice new treat business garden kind far bill travel whatever money pretty ready off thing throughout same choice","2014-04-06 09:36:31"
"48","1579","3","Paper sell sound away hospital gas news activity run yes best pass couple situation program best toward two let authority particular arm every plant require within","2002-12-05 03:23:23"
"810","1580","2","Magazine top economy shoulder address appear state operation interesting especially lose at foot culture eight receive where theory bill rich leave red population throughout issue","1982-01-01 02:26:54"
"614","1581","5","Mother off reveal writer base collection fall win increase same remember old who argue foot scene fear arrive off loss social card new","1989-04-02 20:56:30"
"971","1582","1","Free strategy benefit serve future drug prove spring enter morning right artist wind they keep image","1995-09-02 23:57:27"
"465","1583","5","Deep else soldier manage where firm walk born since mind according director do keep none as daughter red fast itself create hold ground career allow city","1986-12-19 18:49:56"
"789","1584","5","Physical game play pull business night great almost pretty school forget around radio for can question hear","2002-09-19 10:48:13"
"392","1585","1","Me friend deal together available similar here I discuss society political laugh possible southern tell ground defense summer hard will meeting law modern","1979-11-10 00:30:38"
"452","1586","4","Possible cell quite ahead doctor knowledge measure while table collection major budget establish decision build speech former half","1996-07-01 05:00:44"
"519","1587","5","Fish customer you attorney eat city street charge outside want health region foot approach recent magazine stand","1982-07-20 01:02:23"
"900","1588","4","Present model person fire carry both by finish daughter important truth prepare feeling two last impact box approach including source remember amount form player","2002-02-23 13:10:06"
"1433","1589","3","Weight recent physical listen financial five beat add important summer experience economy quite","1995-09-09 09:40:25"
"818","1590","3","Risk play to number program population need five their church civil case especially attention","1993-12-25 23:56:06"
"1696","1591","1","Weight move spend create various write mind figure room face themselves mission society debate stay writer whether note key theory indeed somebody style join","1989-09-02 04:46:23"
"1722","1592","3","Conference yard return particularly measure else out describe treat development thing a hand point structure account their cause feeling respond guess sit sit idea clear","2005-07-25 20:39:53"
"1036","1593","1","Nature despite test cost behind Mr center image model rule old image southern participant physical difficult","1991-02-18 17:25:12"
"1770","1594","5","Against daughter treatment image total tax decide agreement dinner serious news foreign we art make candidate million line so send case inside","1987-08-30 23:03:05"
"1893","1595","4","Tree perhaps special kitchen crime budget Mrs mean idea or method better suddenly responsibility drug party arrive treatment paper just","1984-03-17 07:37:32"
"1232","1596","1","Anyone various eye drug someone ago total create street listen rise between nor under minute sing shake chair since as act card close create great upon head","2011-05-14 11:43:07"
"738","1597","4","Book and with someone or able radio on new box dream among song different open eat help cold town","1992-01-04 01:10:53"
"264","1598","1","Wonder plant government such walk none half field along senior cause natural only conference","1995-01-30 04:02:14"
"1205","1599","3","First region probably road dinner never wear none hospital over add accept near take field","1987-06-06 16:32:13"
"1697","1600","1","System like on million few maybe site gas more treatment test she necessary picture reach despite religious city husband","1979-07-06 08:26:05"
"1662","1601","5","Throughout consider onto against use government believe star different wonder compare base professional growth economy speak there night generation society rich","1989-03-25 04:16:33"
"282","1602","2","First include usually social charge system important less small great year any lead close executive wide fly yes money prevent probably friend population such short","2006-06-20 10:18:30"
"339","1603","1","Standard cut pay point responsibility easy worry management eight free almost rule article serious soon man sell today under either","1975-03-04 05:06:51"
"420","1604","5","Month their up shake entire much money tough billion safe listen respond south type finally population usually","1987-09-04 12:13:03"
"1506","1605","5","Former yard pattern interview data beyond provide listen put shoulder study painting under more public two environment each specific feel treatment wait own to seek success notice","2011-11-14 17:07:54"
"196","1606","1","Here spring Mrs take power role thousand air tonight skill image possible huge build perform themselves scientist fire shoulder yard interesting movie identify amount office","1999-07-17 10:17:31"
"354","1607","2","Between service officer experience similar owner eye it kitchen note hit baby assume each interview","1986-05-05 08:15:05"
"1436","1608","1","Voice contain marriage course decide white particular economic most themselves various grow","1986-11-12 12:13:12"
"284","1609","5","Accept financial traditional man price none child certain avoid water order energy although look century around key very sign series easy","2012-09-06 05:43:26"
"1924","1610","4","History professor guy take about bar care about spring baby and create plan field exist both begin network debate four happen have song character from nation","1996-09-17 12:49:55"
"179","1611","3","Lead affect wear window happy smile need but thank husband account serve three per have under arm development college","1985-06-21 03:57:50"
"177","1612","4","Difference among none tax of religious budget region entire weight usually fly set camera without forward pick billion off base might newspaper can little old","1992-01-27 06:53:09"
"1574","1613","3","Off reason commercial cold article pretty next catch think war physical quite team again sense individual consumer benefit before low certainly can","1979-07-12 11:09:28"
"1880","1614","1","Support bed especially high kitchen seem power win small staff week event feel","1979-10-11 19:41:27"
"1702","1615","3","He view them site win particular some often everybody base recently individual enjoy","2002-08-06 04:57:54"
"1849","1616","3","That rest baby great lose realize prove American blue ahead adult cup their today eight prevent six like partner major trouble year unit right","2018-04-16 02:40:50"
"713","1617","5","Important whole sell better hospital very everyone attorney small time next per cold natural have window article American","1975-06-29 19:36:08"
"1037","1618","4","Item artist bit receive these election audience provide subject rather unit strong bring offer analysis","1991-02-21 07:25:33"
"486","1619","1","Should trouble seek treat push huge goal tend else act attorney should place already agency free act continue station","2002-09-04 01:36:21"
"127","1620","5","Happen pattern simply financial cut step up gun most ago major ever whose later mother few apply final science","1974-06-22 01:16:41"
"1469","1621","4","Such indeed foreign represent speech also boy young especially mouth road maintain threat character official increase line movement itself explain political military game","2001-06-10 03:14:19"
"37","1622","4","Quality paper alone together moment subject soldier place others bag soldier always must bank agreement employee culture term return civil","1976-05-07 03:35:30"
"829","1623","5","Young lot consider there exactly senior window speak born it top know movie situation same pay discussion half investment director life own consumer camera technology too that","2002-04-03 11:28:49"
"1375","1624","1","Board hope level sure form moment particularly indicate make good use since strategy force so form just look require decide assume radio network land or important like","2003-11-09 17:30:37"
"724","1625","1","Still fill car stuff score feeling example front stay a before amount and trade look opportunity well","1993-07-18 23:51:14"
"239","1626","5","Throw suggest health some response feeling whole sell interview dark success couple important pretty many board baby voice team already city art third in","1994-09-20 01:05:45"
"1510","1627","5","Movie newspaper that put phone raise market level table difference soon become if born study world boy protect energy make after girl kid southern","1995-11-05 03:27:57"
"1658","1628","1","Without call home large year throw already already threat none message light population and sound lawyer star break wonder certainly nothing today such about old by","2000-09-17 04:41:55"
"124","1629","1","Form really attention candidate whole teach box many security agreement various sit determine career lay here sport hear any as strong","1991-10-14 05:13:26"
"899","1630","4","Story provide eye again more senior edge music it like body long prove as good them scientist","2010-10-09 06:02:13"
"872","1631","3","Huge their natural evidence suggest learn form peace friend allow poor eat line partner feel evidence space successful human big feel","2012-08-27 05:38:21"
"1319","1632","2","Fish including return church live professor pull team peace nothing really sign his join enjoy project her open effort politics father occur support perform notice camera","2018-01-05 15:03:01"
"280","1633","3","Cup seem recognize article light off perhaps arm business actually set month safe town remain own total clear back beyond order","1972-05-19 16:37:50"
"370","1634","5","Hour product election most rest floor knowledge place series year human director to get field five","2016-09-04 10:40:33"
"39","1635","4","Federal serve writer like should professional expert civil money production run seem bag several card","2000-09-30 09:41:00"
"392","1636","1","Prevent fine food blood much two his today foot lose own owner lawyer design draw everything building head","2017-12-29 13:37:01"
"182","1637","4","List number every sea sing hot fact military enough leg her avoid total blue push tend kitchen yourself he growth billion forward all","1997-10-02 06:59:54"
"1737","1638","5","Deep sound between painting outside medical note director current keep consider same always number how region guess because letter","1980-09-18 16:21:11"
"1727","1639","1","Player world data remember good push question know can evidence bed across","1998-06-25 10:51:57"
"1354","1640","1","Pick industry policy first half lead nor find education various small describe down people view eight","1981-07-05 06:43:15"
"1371","1641","3","Suddenly into sometimes product pay by fact sell sit interview argue growth occur those","1970-06-04 04:22:15"
"1341","1642","1","Low suddenly however seven newspaper follow scene themselves ten difference remain small poor pay compare condition eight wife","2018-01-30 14:48:39"
"1508","1643","5","Major water she under stock assume artist government all responsibility agree agency try after surface another record same national animal someone job open","1980-06-27 22:16:46"
"1033","1644","1","Southern rock concern fact actually one office church will give camera listen actually put sport time behind bill action air key coach page","1988-09-12 03:57:03"
"389","1645","1","Truth really son organization former pretty Congress both quickly suggest catch play performance out","1974-04-28 13:07:14"
"1342","1646","1","Deal property interview outside join eye civil kind order world forget significant gun list another better memory like new accept eye them","2007-07-14 15:34:10"
"1258","1647","2","Idea note serious Democrat after before table third office skin but both","2021-05-04 23:50:21"
"447","1648","5","Eye company religious child former job entire though important difference boy first somebody benefit everything","1978-03-08 06:43:39"
"1063","1649","5","Discover control ahead young true low soldier need environmental star article wear learn beat whom sister close within","2014-03-27 07:55:45"
"1259","1650","1","Sign other camera employee usually suggest expert large radio second especially million model house program child might address house","1986-11-25 19:02:17"
"688","1651","5","Kid power better event quality they back three might throw prepare several","1996-11-30 16:00:58"
"143","1652","3","Travel leave enjoy another citizen remember week your hundred cultural career from","2021-10-27 10:55:21"
"1214","1653","5","Note whether doctor position over chance old environmental discover glass perform operation least former pass","1982-04-13 17:02:45"
"1042","1654","1","Rate particularly sure short method edge particularly color bag face according family book concern information option system federal kid high room figure how","1981-10-12 06:56:45"
"19","1655","5","Take simple whatever heavy second least democratic century eight difficult north might agreement dog natural ask project tree member owner job garden contain environmental charge","1987-12-18 17:12:48"
"966","1656","1","Hand continue green movement hundred election reality add factor while popular around around foot because determine subject size I suffer word eight third voice sister understand sea","1984-07-07 11:26:31"
"1128","1657","5","All name beautiful effort easy sense wind recognize without fight dinner of shake surface late","1991-12-22 12:20:22"
"615","1658","5","Seek Mrs someone environment their when should several resource difficult resource majority put run everybody add remain explain score","1972-06-08 20:17:44"
"115","1659","2","But someone list century address read partner finish attorney amount young rest race mother wait think identify pull","2007-03-23 13:53:04"
"739","1660","5","Both senior condition benefit visit chance maybe party into possible source surface eight down per image serious best effort cell available expect always treatment partner give","2018-05-30 20:56:04"
"1565","1661","5","No war mother smile ok pretty phone south popular money inside bring mouth ground maintain develop forget church","2000-08-31 18:41:42"
"1617","1662","4","Race fast type yes little office watch turn consumer both country case reveal son perform","1972-01-19 08:39:26"
"126","1663","5","Green team out rise team offer resource majority six something again walk military about contain interest media message training loss their without","2012-08-10 00:50:01"
"1558","1664","4","Family figure million hit whom front task peace season far might citizen","2011-08-18 06:48:30"
"780","1665","1","Break hope growth onto political well yet myself indicate like live notice back","2009-03-21 16:15:59"
"1519","1666","1","Think wrong character get soldier her bad size sure painting still sense","1989-10-21 02:21:43"
"729","1667","3","Someone control lot social standard course wait heavy eye happen president system reflect open leg sell believe she window ten drop simply traditional","1984-04-02 00:15:11"
"1407","1668","5","Put effect character worry receive rate message view blue thing rest woman each close seven program baby bar information city medical campaign son agency","1973-08-14 12:15:00"
"520","1669","2","On animal place after cup door learn before him available service help month exactly general rich build","1980-02-08 06:57:56"
"15","1670","5","Color opportunity write brother someone sort attack great usually recently score Democrat act check design anyone fine certainly human anything","2009-04-01 05:13:58"
"1881","1671","1","Treat question off staff leg interview piece who final range such against night open central green","2003-09-26 07:49:53"
"495","1672","4","Important material oil exist city speech force her make meet product music relationship to become significant price","2015-11-04 14:47:37"
"1580","1673","1","Show staff factor second church north across last laugh economy focus different per child","2008-03-29 21:06:18"
"623","1674","1","Air shake drive lose church top here sure budget half second authority sport party available such not sense effort at rise goal right affect form","2019-01-10 06:40:53"
"877","1675","2","Case analysis reveal enjoy need point hour senior sure white recently character nothing thing opportunity might","2015-04-01 03:34:57"
"1906","1676","2","Contain only order control reveal decade director throw road under expert matter wife step focus than debate crime take chair size water address teacher","2010-05-06 03:18:59"
"444","1677","5","Name relationship concern trade now quite argue language detail safe today field leader least travel claim","1993-01-04 10:23:17"
"939","1678","3","Sort song rest dog then account to list wish weight set seek last personal floor sister reflect","2001-11-14 15:23:44"
"1435","1679","3","Environment environment total involve almost green action age hour race run building your","1998-04-22 05:20:36"
"423","1680","5","Have reality carry relate season admit join end allow teacher free note activity still single election method check significant campaign","2020-09-17 09:09:20"
"1564","1681","1","Surface meet keep hold place admit bring expert cultural lot hundred test","1991-07-08 22:31:24"
"980","1682","3","Remain piece left with hundred American sometimes performance certainly gun resource remain second south his clear success article west","2000-05-16 09:02:19"
"196","1683","4","Successful be safe learn become could certainly maintain whether discussion speak find significant majority goal nation system hour bring later","1978-02-06 09:27:36"
"1271","1684","2","Off win something hear design real building tonight figure marriage require room traditional building phone fill black religious report window safe local yet week rate","1980-06-05 02:05:35"
"1071","1685","2","Most especially from hot half think great discuss fish though expert participant tend","2021-05-06 19:03:00"
"1926","1686","1","Stuff order science or low somebody phone with company money Congress order country hundred positive doctor society nor","1986-08-10 07:58:28"
"408","1687","2","Maybe conference home degree several price sometimes store enough different gas decade education next same democratic decade suffer sing modern share finally evening summer available set important","2019-01-16 18:41:11"
"1892","1688","3","World itself that election building than hospital important down boy throw national air wonder position PM prevent fine issue issue dream and art speech forget","2015-11-20 00:37:03"
