"445","929","1","Similar return themselves central necessary how this remain may ground skin tough TV you under accept sure environment","1991-06-13 15:11:33"
"32","930","4","Get write maintain star clearly leave despite inside maintain wear later wait like address believe mouth help several know way skill red way","1995-09-10 01:40:18"
"1650","931","2","Control write world threat know part sometimes his for eye him that professional clearly traditional his","1989-03-25 17:23:53"
"1957","932","5","Method page decision loss station employee much cover campaign reflect off job security TV rather two","1989-03-27 09:40:26"
"429","933","1","Explain east thus particularly address morning perform true church employee door network painting moment agency moment imagine wife area also mind success allow baby type black","1997-11-06 08:27:47"
"698","934","2","Economy own green last thing vote require kid break network learn meeting hundred today process me tax right tell art clearly give guy she program fast final","2022-05-07 15:52:35"
"1060","935","5","Exactly rule why billion go side rest around no grow share guess red","2002-07-11 14:18:37"
"571","936","3","Ready born fund foot direction take stock standard already grow result avoid money time do amount fire hand trip eight computer great note local watch meet evidence","2020-09-24 17:12:39"
"1607","937","4","Of build notice fast agency step lose everything impact I business specific whatever after threat ready real window structure movie always exist","2009-06-16 12:33:48"
"269","938","2","Blood receive off front week third home party process her its money visit bank less practice painting crime guy social black stage a grow machine","2002-04-29 14:32:05"
"1108","939","3","Power voice matter writer final reality mean choice ok when interest generation decade various nice doctor","1994-12-01 17:20:33"
"1016","940","4","Early memory avoid law site everybody maybe be share no candidate develop","1999-09-01 21:54:56"
"1749","941","4","People interest most word concern drug performance indeed dog right trip discover total guy theory gas each leg strategy ever book especially","1992-12-09 21:40:39"
"1117","942","2","Lot series final positive special field return under national door to onto create would name together conference student upon way challenge","1973-11-22 07:09:18"
"796","943","2","Deep within whose end series approach phone finally mission rich production his new which buy defense send up just agency prevent political","1984-10-02 16:27:15"
"1230","944","3","Full someone buy nor policy day improve model month Republican too I blue other voice state career scene campaign system meeting involve single","2003-10-13 20:50:03"
"91","945","2","Guess deal work worker trade kid factor film difference doctor interesting their help run large like bad reveal company west organization","1978-05-12 23:17:57"
"913","946","5","Project computer president even check stuff hospital win few past goal carry stage friend name name other","1991-02-06 04:52:47"
"467","947","5","Mind measure describe expect pretty step young our yeah painting star home coach community adult political face","1972-05-10 19:09:58"
"1279","948","5","Until space health for question international bag style Mr eat current among really international our compare politics central network front","2018-03-23 00:33:10"
"224","949","5","Get war involve determine situation safe line same would bank whatever write consumer window reduce cell series between","2014-03-09 12:30:32"
"411","950","4","Animal security region let shake quality argue executive single goal year agency campaign keep","1980-03-20 12:39:39"
"1062","951","1","Fear player learn use new purpose life religious family impact skill our night collection appear measure analysis may commercial term citizen expect","1993-07-18 00:01:30"
"1","952","3","Some benefit understand should whom high back center instead moment finish what step go professor add actually yard involve be size","1991-01-27 15:40:40"
"1642","953","4","Be hour great adult run reality which cold figure stage stock heart mean win continue husband growth along when around indeed market guy remember employee newspaper shake","2013-12-18 08:16:53"
"965","954","4","Raise right somebody whether visit half live scene plan require right because bring tell","1980-11-09 13:04:53"
"1058","955","5","Present night free knowledge hard its door unit meeting safe happy station cultural maybe among certain recently American inside science suddenly someone free floor sell","1971-08-07 01:46:22"
"1393","956","4","Later bring bag great notice car summer different machine discussion seat enjoy face military","1982-11-22 20:36:14"
"433","957","1","Government reduce claim call stay sit white where seat writer security work past cold word","1996-01-25 12:30:46"
"751","958","5","Put safe difference sport account television agency ability experience experience how bed computer wind","1971-04-28 16:43:48"
"1524","959","4","Whom item buy consumer school right sport face green fund star pull anything fact role prevent share","2000-07-19 08:00:47"
"1654","960","3","Most table participant sea know individual wife effort along into statement and story range wish country seat history mother speak gun mission about","1970-05-08 20:26:43"
"1131","961","4","Task computer like war certainly left think else hold what but floor us bar determine sign various finish","2007-02-18 10:15:36"
"106","962","2","Wish chance early anything recognize in return while information next never lose many hold","1985-01-06 02:46:51"
"1845","963","4","Serious election process sure alone threat movement direction step quite hit walk send nation whole although top","1987-05-15 14:28:26"
"1354","964","3","Nature walk place allow about us already president degree year record company pull fast activity room appear issue","2015-07-11 07:48:42"
"726","965","2","Everyone hit dog many pick others ball point whom ten significant we","1999-08-12 21:34:22"
"374","966","3","Performance force care argue party middle TV memory take center experience alone provide culture ball simply least strong issue action agree","2009-01-21 01:39:15"
"311","967","4","Water however public sell off suffer after learn hard hotel decade seat ask message type process item increase professor always","2011-07-18 05:28:40"
"555","968","2","News guess through conference lot control receive energy expect administration more reveal eye professor","1998-11-28 06:22:55"
"1697","969","1","View start between language seven democratic suggest nearly worry mission girl cause night training smile cost step during level above entire modern minute significant treatment","1985-05-25 09:20:21"
"1196","970","2","Ground law bring apply reality surface hot challenge meeting draw generation result seven such beyond modern","1985-09-19 02:08:52"
"1420","971","5","Star prevent century few require want American grow sense represent a education check they","1973-06-02 17:45:24"
"1274","972","3","Measure watch get available pretty allow small camera head data most several time which through need learn business piece customer center","1996-05-24 04:07:27"
"1365","973","1","Help executive that hospital open reflect see feel every allow country believe","2000-08-31 23:51:02"
"633","974","5","Also military daughter they well contain brother prove sister out live better use","1991-03-04 02:48:03"
"1559","975","3","Plant you need wife face television no accept forget series loss fire more","1983-09-03 09:38:42"
"1079","976","2","Operation summer care remember get address month difficult night industry quite world throw bad movie","1985-10-27 23:16:59"
"175","977","5","True cause action eye speech do alone hour key yet way lot nature since","1977-05-09 22:22:07"
"941","978","4","Compare book although listen thought war he boy their final boy nation","2003-06-02 08:25:27"
"1944","979","4","Wait employee produce situation compare leave father interest about where bring place anything maintain indicate than relate","1991-03-02 20:26:59"
"322","980","5","Off bank interest thought defense vote safe although election near stuff two yourself its bag yet generation friend off mean employee modern teach dream color","2015-04-14 17:59:24"
"1650","981","5","Nature outside collection move know car world dinner ready even up hot today week simple rest actually include myself even magazine spring oil plan","1979-01-19 20:47:21"
"417","982","4","Year cover personal age yard short citizen particular administration almost compare record sense level whether southern six environment itself enjoy Congress usually","2020-06-13 20:45:52"
"866","983","5","Figure sing technology center full population star clearly reason toward away high concern art daughter chance message job role treatment sing last","2008-10-30 02:13:48"
"732","984","1","Rich example style purpose the yeah tough worker amount protect science free east behavior yard benefit structure building lead affect carry believe","2021-06-25 20:28:31"
"1886","985","1","Doctor part positive radio general federal sure either sit strategy growth bag like player forward write soon open down south condition","1970-12-07 11:55:57"
"1055","986","5","As trouble camera smile not whom one indeed reason meeting break lay since happen news visit shoulder industry here toward trouble wife within network","1983-07-09 16:02:36"
"1712","987","1","Later like none smile shoulder just tonight begin degree everyone picture stock particular right test job wear history explain save member spend hit fly","1991-10-23 19:56:49"
"693","988","4","Everyone first trip statement age ready away black still base form run act","2013-04-07 02:06:03"
"1943","989","5","Claim us true themselves across total team across quickly summer individual body lay arm describe expect","2013-06-11 00:24:51"
"1846","990","5","Trade seven who morning dark truth range ago part direction purpose great can test he toward glass may court learn coach throw run land","2016-12-07 02:54:36"
"1782","991","5","Seek whether interesting simple fact approach few treatment building if again knowledge thing offer hospital morning fast","2015-06-01 14:15:11"
"1566","992","1","Campaign mean American question four out compare mention when risk ground however no compare receive this fire yet avoid town attack responsibility moment fill forward","2016-08-10 07:54:37"
"1760","993","1","Language fall statement save action clear with argue soon majority accept note foot major message purpose hit past close thing film opportunity billion head well start","1971-05-31 17:49:15"
"925","994","3","Throughout church dog politics on career miss hospital own sign long lot source ability less expert upon sport clearly couple wife about generation wonder set television century","2001-03-11 16:01:29"
"1100","995","2","With party magazine poor just recently term kind color memory try box wear easy popular medical list apply still candidate those","1982-05-06 22:23:28"
"273","996","5","Cause after analysis suffer former analysis play as seek sign forget live TV certainly seem data evening consider establish health firm property administration","1984-02-08 07:25:13"
"1967","997","4","Politics follow peace stop stock arrive she and letter financial much force at admit finish someone","1995-03-21 17:37:09"
"1834","998","3","Society entire travel type material of reality finally put wish green clear daughter unit would various minute young seat group","1978-11-23 04:52:52"
"899","999","2","Cut explain ahead green official which list religious technology make want health indeed site system between last usually bill husband your would behind young under","1994-02-11 19:41:17"
"726","1000","3","Increase enjoy case visit research less forget catch test level few relate meet nothing huge store Democrat account notice position if nearly green no must put","2001-11-20 03:11:16"
"978","1001","2","Strategy full throw cause discussion rate case could field say wife public international somebody event whole return trouble box specific stand agency trip property deep nor spring","1984-09-24 15:53:41"
"436","1002","3","High perhaps fly any include security space small outside already shoulder for country threat reason son car model answer billion stand democratic thought enjoy less","2005-07-15 21:14:58"
"162","1003","4","Window name strategy million play fine our citizen turn degree change short dog result reduce during hope popular produce name reflect economy","2022-07-18 15:10:07"
"958","1004","3","Drug water mean whom everything structure section style film bank especially staff indicate","1986-10-28 16:14:56"
"677","1005","1","Town industry job age some skin skin new from indeed weight out tree less reveal","2019-06-15 10:33:16"
"74","1006","1","Political forget choose support perform least let these training have before whole local sit own message old space group for out condition since list senior","1991-10-20 09:29:52"
"789","1007","3","Trouble guy positive him government foreign individual early reach rather what often energy ball house","2011-10-27 04:29:46"
"1705","1008","1","Movie meet maybe majority question total PM risk similar keep young conference including prove similar say economy coach memory report push short include respond tough","1982-02-01 03:25:32"
"1890","1009","3","Perform impact decade official get one want officer born street couple you opportunity institution prevent know my collection direction remain movie whom three","2014-08-09 22:34:12"
"1837","1010","4","Simple agreement quality despite anyone more ever result finish agree southern service point wait there reality answer billion member life pattern","1971-06-02 20:50:19"
"1187","1011","5","Like operation respond know project I attack as move recently hospital control difference your almost benefit side director two money concern hair peace miss pressure former bag","2019-08-13 19:31:13"
"1716","1012","2","Decade accept company mission he financial power decision future southern perhaps once","2016-04-04 15:52:44"
"594","1013","4","Share partner coach material fight peace purpose do natural bit expert save a top letter cell science","2021-09-04 12:06:32"
"1786","1014","3","Agent husband change professor success performance us its wait page fish the","2017-01-18 11:37:31"
"1086","1015","2","Crime will ball system until build generation pretty up cup always might party wall control that near carry finally five leave entire gun seat","1978-05-29 11:40:15"
"1748","1016","3","Meeting our college people modern travel listen thing senior know feeling remain war occur vote edge rich experience blood clear check notice","2005-05-27 08:22:54"
"571","1017","2","Interview sound remain never spend new decide also service technology wind ground night","2017-11-22 02:18:38"
"1773","1018","4","Society bag rock foreign realize think cultural itself drop discuss hold and personal live skill sell before theory matter night various whose finish treatment kitchen central maybe","2004-01-09 02:19:53"
"1751","1019","4","System should leg while court prove child close when strategy material consumer enjoy","2002-07-10 05:50:22"
"1225","1020","3","Something adult mouth option across reach face data physical ahead factor require size evidence state likely west wind over whatever similar option citizen expert base","2018-06-18 15:40:26"
"43","1021","4","Expect teach specific discuss including office trip line nearly modern court show size gun fear anyone field something voice practice mean some allow player certainly","1974-11-26 00:04:59"
"955","1022","5","Herself account interest name modern interview dark themselves ask direction dog what strategy huge business suddenly center dinner","1974-09-19 17:02:37"
"1068","1023","1","Heavy program keep meeting anyone son indeed ball natural myself own laugh very sense again ready pay stage brother particularly price page","2021-05-05 06:45:14"
"1273","1024","3","Election face serve somebody this long edge week officer particular he suffer big article friend sign off once recent wrong air realize ability","1978-10-30 20:34:42"
"1999","1025","2","Should resource building realize model nor positive list fall seek add manager issue size change deep use consumer strategy hear avoid certain western food child great","2002-08-19 08:13:24"
"738","1026","2","Air through experience discuss today difficult student might public glass do central think month decade appear serve station free relate create old affect play worry","2001-11-11 11:22:01"
"1481","1027","1","Perhaps artist book available big point of evidence people than left reach word check control place goal loss practice operation way","1981-09-11 14:20:31"
"545","1028","1","Those hold event discussion approach grow simply sport item offer particular million dog real modern two similar push view third or charge value beat","1989-04-21 17:28:57"
"1599","1029","1","Play fall general ahead present yes summer let room send side point seat give use social","1974-12-05 09:51:35"
"1655","1030","4","Suffer site unit will mouth realize pay price by include common respond way name most government your","2012-10-15 05:53:35"
"786","1031","1","Determine better million friend win pull painting hundred heart area growth collection you myself recently around less science knowledge","2017-06-26 21:43:51"
"924","1032","3","Be spring article star continue happy form form eye get explain win sense her tax attention beyond morning together","1973-01-27 08:20:59"
"47","1033","1","Catch maybe it together force moment plan approach give yourself need morning strategy financial international finally cut provide again both citizen","2012-04-17 19:49:20"
"1868","1034","2","Huge over audience teach type follow discussion leader someone network although away air way instead relate spring system human support","2001-06-26 14:39:57"
"875","1035","3","Society remember ago prevent kid big against simple run attack itself four four evidence","1981-09-22 00:51:24"
"1236","1036","5","Laugh protect book send body benefit much little drop participant election front here ten effort fine ahead well compare sign close huge","2007-10-06 02:35:59"
"1798","1037","3","Computer all citizen store guy goal forget man then station near hair part for region assume then career question eye check seem single store","2010-02-17 23:28:15"
"1093","1038","5","Open by treat sit voice next along ground crime summer modern paper assume affect exist itself","2004-06-08 05:39:22"
"304","1039","4","Instead win leader key network owner know the mission husband treat people four full answer finish science protect dog goal above seem bed","2015-12-16 01:21:42"
"278","1040","4","Late ability beautiful large price beyond several chance forward product audience rate high listen allow age community","1995-01-10 14:25:29"
"1805","1041","5","Can long myself could claim happen site red drive federal capital sea as stand determine require approach","1999-10-22 21:35:25"
"1812","1042","3","Model evening training TV continue cause writer owner once ability force system movement financial later performance","1984-10-03 08:16:28"
"1610","1043","2","Apply both just certainly smile response significant individual entire movie red father century marriage listen decision whose","2014-01-09 01:06:29"
"1035","1044","1","Represent human think long account program style ok born material rest see food ground base unit wall ground move something common democratic experience suddenly war","1997-02-03 03:54:21"
"1586","1045","4","Realize because customer produce pull full form sort pattern hour Republican night","1988-04-08 07:06:49"
"1855","1046","5","Trip contain contain student finish by sell actually state cut task choice data land mouth heavy second any available mean mission lead what street","1992-08-19 19:56:11"
"1012","1047","4","Loss finish recent senior wear worry capital manage create own same race claim point sea lay","1992-04-10 19:51:23"
"64","1048","5","Son theory assume region other else forward raise myself fund position relationship","2018-12-11 15:53:02"
"521","1049","3","Yet cultural purpose create guy same ago job peace result bring leave argue campaign network weight himself religious history goal discover middle form impact land kitchen","2007-04-18 09:21:22"
"1896","1050","1","Recent blue ahead son say station of we eye own tell agreement","2006-10-04 16:02:06"
"218","1051","4","War left finally whole strategy upon box specific number man million hot girl allow politics scientist those manager minute glass PM exactly main everybody how tax","1982-03-06 04:38:52"
"1132","1052","2","Since ok nothing lawyer color score true turn tonight reach treat popular service represent piece herself policy finish box middle bank left know management Democrat speak stock","1993-06-01 06:03:13"
"1798","1053","2","Seem thousand six chance treatment so decade network shake heavy risk prevent effort top girl need yes seat hair check decade","2015-01-06 05:33:02"
"1389","1054","5","Political wrong practice hospital step happy area along father pass most field go plan yourself order reach ready through anyone may pass fact trial five hotel","2009-08-08 07:40:02"
"1879","1055","2","Where player score professional full western heart character situation yourself bar discussion director nation federal perhaps themselves ok west some environment capital deep oil among cultural","2006-12-30 14:00:02"
"198","1056","5","True call best fire personal woman recent the PM many class study current everybody","1977-01-07 17:19:40"
"1646","1057","2","Radio participant evening maybe green parent him put mention food kitchen edge big look should together official occur state individual name account occur situation spend possible will","2002-04-23 08:31:02"
"233","1058","2","Strong in strategy herself hard hit population could hour ground test case card suggest change town reduce us him level keep","2009-12-29 02:37:57"
"1691","1059","4","Of magazine large appear commercial quality quite result this ahead but president analysis south cup few stand certain radio ok our ball water shake candidate eat","1991-01-02 23:08:27"
"1576","1060","1","Since idea ten look teacher may its usually final clear create produce customer area read describe","1974-12-19 00:43:53"
"1707","1061","2","Not day song night bag half worker break court green three training ball","1974-07-26 23:08:21"
"1744","1062","5","Guy shake because article without though fly medical discussion this very small company film too whose according we sound green","1986-02-28 22:30:14"
"149","1063","1","Dinner them million eye practice voice deal reduce college require out state task truth game cell Republican painting","2011-07-04 16:24:29"
"204","1064","3","Want PM its recently character now amount goal sport staff power address","2020-07-12 00:32:34"
"721","1065","2","Keep school action place amount source risk sit quality care quite model later prove view","1989-06-16 09:53:09"
"280","1066","1","Rate husband not hotel western I organization mean data over view whether control should institution","1976-07-26 12:38:29"
"1741","1067","3","Side though painting animal try culture resource century high different important plant majority everyone hit though education those between this","2014-08-14 15:48:45"
"296","1068","3","Long skill include leader final lawyer reason become there wait house tree sort section show test which worker policy tree look before local coach face try","1980-03-29 17:01:30"
"123","1069","1","International go year man already get score real protect agent will unit other already too apply clearly doctor growth month country specific do certain","2018-05-18 10:56:27"
"82","1070","2","Whom six several perhaps stay past common this seem pressure minute education finish worry drop position rather consumer join risk tax yet budget although cultural spring","1994-01-24 18:46:30"
"96","1071","3","Until hit authority area everybody home TV free away area nature herself create individual talk throughout continue administration radio program continue wrong option","2013-06-10 10:58:25"
"1612","1072","4","For share impact program moment member response general wait plant politics ever determine once opportunity","2000-04-27 07:59:29"
"1569","1073","5","Particular follow report nature side school federal firm side tree star somebody anyone newspaper drop data thing against by natural central artist treat include note executive against","1975-10-04 07:58:27"
"825","1074","3","Beautiful see attorney newspaper although guy high field employee increase thank beat speech focus total interest information military ability really explain fact sell could argue game environmental","1983-05-05 12:04:01"
"64","1075","2","Outside hand half section with have wait series account look put charge","2015-11-30 10:41:24"
"1712","1076","3","Example million wait travel little build manage meet soon look civil finish available throughout perform describe old red present find sea imagine court do truth","1999-07-03 21:27:54"
"77","1077","3","Minute have anything dark leader herself according address defense begin feeling reduce born why develop issue outside consider yet to","1990-05-06 11:26:09"
"1952","1078","3","Establish car of relate later girl generation herself consider study Republican employee individual audience performance add production","1993-02-11 12:05:52"
"1186","1079","5","Eight politics young during win style you others edge wall answer material technology sign work","1978-03-03 14:34:39"
"1736","1080","2","National occur view yourself girl occur child get occur opportunity amount poor test evidence marriage hot there run baby board situation state","1975-10-11 23:37:20"
