"1912","1533","1","Property serve seven popular relationship hour war soldier write outside already black join left score station seat seek five","1977-11-28 15:55:59"
"283","1534","5","Send inside campaign amount all agreement position pressure present summer opportunity outside","2020-05-26 19:32:43"
"1155","1535","5","Radio player data specific push hair woman time eight history read effect director present media fall picture must dinner","2012-04-08 20:13:25"
"1551","1536","4","Child ground as final by home true maybe these subject relate life church father year health light explain shake check to kid imagine subject central bar","1973-07-09 05:08:45"
"424","1537","2","Decide camera age her determine on meeting five guess my tell others soon sort parent simply score baby","1987-07-06 02:58:21"
"1057","1538","1","Both lead reach sound machine scientist about might TV artist administration industry energy try yeah already education firm final pick civil across","1977-01-19 23:00:20"
"410","1539","4","Few term open fight space open star summer determine word particularly onto material huge try high benefit paper research down","2009-08-24 16:14:13"
"1950","1540","3","Author once want three myself population provide he response staff training personal I suddenly shoulder face chance student whether before there artist low","1972-08-25 11:32:58"
"1256","1541","3","Least open data most life within high live wide for that you building","2005-02-20 19:10:42"
"66","1542","3","Above minute must suddenly look wear report against before PM how like husband behavior community American light bit","1977-12-17 13:13:02"
"1531","1543","2","Nearly role total political great activity member building movement side look political through husband first message miss really skill themselves think away","2021-12-13 15:23:48"
"1894","1544","5","Billion foot much begin spring to top through drive seem quickly feeling pattern suggest although","1980-07-08 06:20:38"
"451","1545","4","Style meeting common beat wrong product hour attack call address enough near her manage TV card mention soldier history improve focus point experience live chance recently movie about","1984-04-28 20:55:59"
"1723","1546","1","Growth bill account region road improve rise national network rate senior religious so agree meeting","2010-07-08 08:16:12"
"1372","1547","2","I friend most everyone friend factor table money what kitchen pass myself appear generation this","1983-09-21 16:05:53"
"1540","1548","1","Black research no assume decade part might field factor thank head a catch everyone cost inside address generation order which sister simple team mouth","2013-04-13 00:57:00"
"69","1549","5","Build morning outside particular compare strong new issue born public hair alone admit avoid sound station what their past","1978-09-21 01:27:54"
"1058","1550","4","Several across democratic your later my I audience for behavior food skill man create single always allow international theory memory amount executive plan something none whole","2017-05-18 01:43:11"
"219","1551","4","Service know glass material deal reach team majority firm senior after data decade visit sing sure white figure line model although","1995-05-11 09:54:34"
"642","1552","1","Wait radio practice full effort kitchen true article stage role after music throughout discuss","1998-03-14 09:33:02"
"880","1553","1","Add war artist others mention score when onto its class buy evening others speak few PM one charge","2017-12-05 18:53:22"
"367","1554","1","Offer affect ever their nature song table threat inside easy shake choose professor agree especially their continue now factor answer eight size program","2008-02-26 19:06:22"
"173","1555","4","Green determine good provide maintain law at art enter civil be character control radio one after perform ahead","2005-12-15 11:16:06"
"263","1556","5","Mother off reveal writer base collection fall win increase same remember old who argue foot scene fear arrive off loss social card new","2006-06-12 15:42:30"
"971","1557","2","Enter morning right artist wind they keep image various tend perform democratic next now receive fish street along after film good condition similar general film nation","1995-09-02 23:57:27"
"1248","1558","2","Those sing box these anyone according analysis building cover between officer lay open majority site city reality subject draw","1986-03-26 11:18:20"
"634","1559","2","Evening so most yeah political difficult home right part far court environmental","2007-01-29 22:16:52"
"1440","1560","4","Feeling performance seat forward past agreement which create tree middle him medical happy rule charge left cut painting leg situation green such become whatever language","2001-02-16 16:53:37"
"329","1561","4","Mother Republican store service require board available ok pick significant citizen prevent attack treatment anything key second area","1971-03-01 15:50:18"
"250","1562","5","Bit gas similar memory kid today music arrive wonder sense build once young force Congress tax community either traditional organization fear into be front I lay keep","1989-05-30 02:57:20"
"1070","1563","2","Important truth prepare feeling two last impact box approach including source remember amount form player she door yard safe can wait herself","2020-12-27 21:32:14"
"855","1564","5","Simple seat attention deal no window low account anyone recognize may establish politics music field beyond large gas state","1993-11-17 15:37:33"
"1183","1565","3","Their church civil case especially attention lot save box door system water yeah we chair arrive around space likely man authority five past","1978-05-16 11:48:15"
"1519","1566","4","Somebody style join spring safe say chance each page leave information statement gun above technology company continue fear behind learn","1977-11-29 07:29:04"
"367","1567","1","Include common at third store green city effect understand after hear view or type career individual","2016-05-03 21:52:17"
"82","1568","5","Those group miss everything left fall exactly leg product now wind state hour behavior hold","1997-04-12 15:59:02"
"531","1569","5","Against daughter treatment image total tax decide agreement dinner serious news foreign we art make candidate million line so send case inside","2009-03-17 01:26:05"
"1893","1570","4","Tree perhaps special kitchen crime budget Mrs mean idea or method better suddenly responsibility drug party arrive treatment paper just","1984-03-17 07:37:32"
"1232","1571","1","Anyone various eye drug someone ago total create street listen rise between nor under minute sing shake chair since as act card close create great upon head","2011-05-14 11:43:07"
"738","1572","4","Style southern like lead range pretty Republican travel reason nor bag seven growth style outside night wall sort hand purpose way improve receive fire budget executive","1992-01-04 01:10:53"
"3","1573","2","Drop catch list those new present company in vote why least wonder simply they however someone professional lay great treatment card","1997-01-30 01:25:51"
"571","1574","4","Treat dark federal ago meeting staff popular message successful past message read whole professor result do ago","1984-01-17 06:22:58"
"1991","1575","2","Cut Congress while business feel though green method phone as machine campaign write list treat spend door benefit travel talk recent see people employee company medical","1979-09-02 08:38:03"
"232","1576","5","Teacher learn area owner race service participant both during line pretty candidate blood tonight fine environmental high","1971-09-08 14:54:39"
"1097","1577","4","Usually social charge system important less small great year any lead close executive wide","1997-05-01 09:50:10"
"798","1578","5","Standard list nice character it call within town day situation particularly exist modern economy girl quickly standard cut pay","1998-07-16 23:46:52"
"1605","1579","2","South check require skin machine cold husband work carry effort fall huge conference dream generation this election outside or policy opportunity","2022-10-27 23:30:10"
"393","1580","2","Risk enough upon agent east try practice office protect easy store company film thus which part international add","2003-06-09 10:19:36"
"773","1581","3","Argue war with present hospital significant all role ground able study pressure these","1999-06-01 03:30:12"
"861","1582","3","Until dream successful short best bit the already trial big foot down who view suggest drive","1972-02-01 08:06:58"
"1494","1583","4","Say management early less attack why company example cover organization special fear","1986-08-14 02:47:19"
"1267","1584","2","Traditional physical success network discussion state figure industry later prepare sense place none require as statement teach","2007-04-27 23:27:52"
"1494","1585","3","Throw stage reason determine guy before structure we free fly yourself couple enough paper mind guy relate police laugh","2018-12-05 07:51:43"
"1837","1586","1","Because once happy Democrat wear fly politics by nothing hard fall data management then water save answer record live else like picture picture able great","1971-04-14 18:33:31"
"456","1587","2","Society hold time enter medical expert line line think choice south at people level particular morning positive prepare general law today","1974-11-13 10:19:29"
"1358","1588","5","Much on box spend keep dream seem action spring interview offer employee develop apply garden itself hot performance modern source action war PM time together assume force","2009-08-07 03:04:42"
"1339","1589","3","Statement series support bed especially high kitchen seem power win small staff week event feel it step voice boy","2003-08-21 16:18:33"
"176","1590","1","Player like civil total indicate report road six husband guy away author current may large quite anything million nor area necessary soldier such product inside improve small","2008-10-18 19:33:20"
"1511","1591","1","Some give clear skin than possible wide tree sound far buy decade language here out factor despite such movement health","1970-11-10 05:24:18"
"34","1592","3","Director yard send general deep clear foot scene information body former chair song impact well under","1994-08-11 22:28:40"
"1425","1593","5","Already program decide because important down thank lose back prevent something write knowledge short class yeah listen report little wife rich night","1987-07-10 20:37:14"
"50","1594","3","Wrong American again leg surface certainly particular beat hand understand describe base more","1970-08-21 12:28:23"
"740","1595","5","Drug baby company almost experience collection career forward run wrong order wonder local alone individual but player research much key finally southern push organization student","1971-10-10 02:17:17"
"159","1596","5","Way behavior before address relate hand long mother news class across soldier choose along election alone manage quality paper alone","2005-03-18 12:21:06"
"46","1597","4","Particular forward black represent might young lot consider there exactly senior window speak born it top know","1981-07-31 01:52:42"
"1107","1598","5","Generation always positive kind to ball story current road friend support home like sister election amount behind another board hope level sure","1973-07-23 23:03:27"
"1682","1599","3","When cell think perhaps feeling inside lot note deep to impact me himself without hit former find side term rather","1977-03-08 05:24:25"
"787","1600","2","But weight sister capital provide produce range husband data finally between father name him","2006-03-13 00:46:17"
"898","1601","5","Test news section total dinner than professional pattern health available part stay camera century wait some on view exactly scene born old affect small","2021-03-05 20:49:54"
"1566","1602","1","Performance fish environment treat sport popular them system special consumer later animal then box physical rate lead even stage indeed resource management talk thank claim exactly","1983-11-06 00:47:51"
"1153","1603","4","Available gas vote front sometimes never exactly safe every especially hope relate lawyer likely carry those vote art senior win total accept ok","2001-11-23 00:36:49"
"973","1604","5","I today as how maintain impact keep national if eat public there science","2003-08-02 05:49:29"
"592","1605","1","Try determine itself other high news film prove degree fight marriage student window grow entire heavy my party research red field story strong perhaps student seven","1999-06-05 23:57:48"
"150","1606","2","Not enjoy same difference speech fish including return church live professor pull team peace","1993-09-30 10:07:35"
"1605","1607","5","Run they help American garden item within black us deal become every time generation soldier cup seem recognize article light off perhaps","1986-01-13 22:08:53"
"160","1608","1","Mother whether defense sign middle part decide as red catch dog though","2010-06-02 20:01:20"
"1674","1609","2","Know here answer nor choose leg network produce while glass chair material federal serve writer like should professional expert civil money production run seem","1988-11-28 22:11:33"
"1377","1610","4","Food oil finally state process next dream last save sign alone quality leave ever phone life speech remember between fact not back on bar bed seem","1983-11-06 18:01:23"
"1702","1611","1","Mrs prepare notice surface pick shake society list number every sea sing hot fact military","1985-10-19 01:02:41"
"1845","1612","1","Rule wall fine specific exist imagine speech country population glass memory speech law may bar run whom job","2001-02-10 21:18:55"
"307","1613","2","Stage eye spring security similar significant black hear event front writer assume administration determine ahead recognize agree city official go student accept because","2001-09-17 22:02:29"
"1354","1614","1","Record fish thing practice citizen crime use interesting team speak whatever personal you dog case smile speech manager get your whose tell","1981-07-05 06:43:15"
"1371","1615","2","Region go suddenly into sometimes product pay by fact sell sit interview argue growth occur those visit better high","1970-06-04 04:22:15"
"1132","1616","3","Themselves ten difference remain small poor pay compare condition eight wife level prevent outside themselves pull join","1985-03-10 21:46:19"
"1001","1617","3","All responsibility agree agency try after surface another record same national animal someone job open ten week edge newspaper tax piece economy woman raise","1997-02-13 23:49:58"
"411","1618","1","Southern rock concern fact actually one office church will give camera listen actually put sport time behind bill action air key coach page","1995-02-19 18:16:25"
"389","1619","3","Seat edge sell sell ability ball local drop realize news see home appear Mrs structure cause marriage floor west","1974-04-28 13:07:14"
"1342","1620","1","Deal property interview outside join eye civil kind order world forget significant gun list another better memory like new accept eye them","2007-07-14 15:34:10"
"1258","1621","2","Idea note serious Democrat after before table third office skin but both","2021-05-04 23:50:21"
"447","1622","3","Wait decade professor station measure still away away could world action all over building president visit activity beautiful part deal meeting check","1978-03-08 06:43:39"
"1423","1623","1","Modern short this knowledge here whose region success discover control ahead young true low soldier need environmental star article wear learn beat whom sister close within","1972-05-23 01:53:10"
"1259","1624","2","Another many accept few marriage fund teacher west bill quickly property while kid day push behavior would point work key piece","1986-11-25 19:02:17"
"240","1625","4","Rather score might kid power better event quality they back three might throw prepare several answer door past well themselves force north more rock better similar thing","2018-06-03 08:48:49"
"1809","1626","3","Nature girl rest more memory general heart high born fight late ahead summer whose hot shake charge industry onto religious leader scene","1983-12-26 02:51:46"
"1329","1627","2","Community majority she night seem front seat sure identify though while particularly center fish factor mission hand seek that PM could above rate particularly sure short method","2005-06-19 14:38:41"
"782","1628","4","Speech five way three last garden exactly action size voice move mention enjoy inside administration section population not level professor","1996-12-21 13:19:55"
"1510","1629","3","State camera study region production example station deal admit matter instead civil","1982-07-26 23:40:52"
"1731","1630","4","Easy from language economy hundred line purpose art sound after top believe rich inside coach start herself bring pressure century throw evidence window campaign he","2013-11-16 03:15:15"
"1117","1631","2","Site tough mother way money century focus management every enter experience quite easy buy letter almost better say realize sell trip","2000-12-11 11:31:41"
"1619","1632","2","Information wear include office two teach shake main pretty event they whole too quickly","1989-07-15 18:29:07"
"1275","1633","4","Sign others both senior condition benefit visit chance maybe party into possible source surface eight","1994-09-20 07:28:01"
"1513","1634","3","White near agent help set expect enough thing score every meeting key particular no war mother","1990-06-07 03:13:21"
"1078","1635","1","Business field campaign director teach military level represent customer action tend yeah discuss lot race fast type yes little office watch turn consumer both country case","2016-09-19 16:43:17"
"638","1636","5","Rise team offer resource majority six something again walk military about contain interest media","1983-09-22 08:04:42"
"1066","1637","2","Whatever ask place blue sister just specific family figure million hit whom front task peace season far might citizen fast political first project various my condition realize","1980-12-05 10:57:32"
"780","1638","2","Everybody his behind break hope growth onto political well yet myself indicate like live notice back half reduce staff wide act cultural provide","2009-03-21 16:15:59"
"182","1639","5","Guy drive ready window off everyone seem property possible line standard professor low age page eye above reach able","1980-12-03 07:25:51"
"315","1640","3","Someone control lot social standard course wait heavy eye happen president system reflect open leg sell believe she window ten drop simply traditional","2009-07-15 02:06:31"
"1407","1641","5","Serve finish think white three put effect character worry receive rate message view blue thing rest woman each close seven program baby bar information city medical","1973-08-14 12:15:00"
"102","1642","3","Daughter issue painting specific nature effort series run there whole somebody quality same me by grow wind","2009-10-10 16:57:55"
"15","1643","2","Opportunity write brother someone sort attack great usually recently score Democrat act check design anyone fine certainly human anything TV story north ground blood short when risk","2009-04-01 05:13:58"
"1015","1644","5","Yard base soon treat question off staff leg interview piece who final range such against night open central green also","2015-07-07 07:09:09"
"495","1645","2","Coach past less authority particular traditional seat important material oil exist city speech","2015-11-04 14:47:37"
"798","1646","5","Result apply share last body area audience us recently officer institution kid teach toward operation until main book experience","2004-07-06 10:18:48"
"1934","1647","3","Manage industry suffer stop get real participant majority treatment often low shoulder door game economy need drug hope century dark role plan","2015-03-27 13:19:01"
"1727","1648","1","Professor ahead sense board trade ground difficult nice project experience home medical teacher somebody country exactly friend support bag relate enter skill","1987-04-28 03:22:47"
"1163","1649","1","Method himself red animal speak evening call serious beyond result first color when maintain sister find but activity describe","2005-03-06 04:22:48"
"1022","1650","1","Minute spend ready left practice subject everyone test lot administration order performance wide two stock raise name relationship concern trade now quite argue language detail safe today","2018-01-25 08:57:41"
"564","1651","4","Trip mouth land rock development similar realize sort song rest dog then account to list wish weight set seek last personal floor sister","1992-06-24 11:09:54"
"1435","1652","1","Medical bill man debate media western whom customer way image team issue high front authority for without nearly","1998-04-22 05:20:36"
"1601","1653","5","Have reality carry relate season admit join end allow teacher free note activity still single election method check significant campaign","1972-04-14 01:53:29"
"1564","1654","1","Use law know its spend enjoy order least thousand form television would role attention activity value provide health because soldier particular news cost free anyone speech","1991-07-08 22:31:24"
"980","1655","4","His clear success article west on get rest group outside apply story beat","2000-05-16 09:02:19"
"822","1656","2","Especially simple she focus less skin visit little themselves type such material today save scientist safe imagine contain study paper window pull dinner seat","1982-02-20 05:48:12"
"1357","1657","1","Charge few which thought manager loss building public structure industry woman anything fill memory beautiful","2001-09-28 02:21:41"
"643","1658","5","Attention they station rock treatment simply free sense happen blue explain back meeting behavior goal time be until career send foreign","1994-08-03 12:26:49"
"220","1659","1","Hard effect free term source tell rate imagine walk recent better from sometimes doctor even spend","1980-07-11 10:06:45"
"1959","1660","3","Store enough different gas decade education next same democratic decade suffer sing modern share finally evening summer available set important matter trouble who central","2008-03-14 22:32:02"
"77","1661","4","That election building than hospital important down boy throw national air wonder position PM prevent fine issue issue dream and art speech forget drop production of news","1974-07-27 17:22:52"
"1545","1662","5","Owner more tend meet drop social feel window skill professional role receive avoid subject defense world why society kitchen give both official ask plan attorney car","2006-06-18 09:59:35"
"883","1663","2","Example computer theory prepare decade threat final itself staff person blue sing","1994-08-29 17:22:35"
"1717","1664","3","Least carry design read us travel according garden feel discussion little source baby compare new care tough eat occur son main","1995-04-23 07:43:22"
"1099","1665","4","Popular out challenge hand in nothing leader give data participant military factor move stay it near hot public change she","1993-07-29 20:49:10"
"388","1666","3","Finally partner success to second perform past month mention campaign past TV west as since","1983-08-12 20:19:46"
"428","1667","2","Inside design painting wish wonder how firm list check small structure yard per stage out but recent month country reveal public Congress","2017-07-13 03:41:39"
"1727","1668","5","War carry building shoulder decide focus land nearly at possible information imagine parent doctor card director every television white","1990-02-24 16:01:31"
"1304","1669","4","Key set measure set series light machine term administration throughout world thought","2022-08-18 01:05:03"
"27","1670","4","Organization note effect resource forget left per animal measure from meeting break nation perform choose plan but boy inside federal team product senior interest technology","1976-05-06 05:25:57"
"325","1671","2","Southern themselves others even where shoulder own nice sell house agent right size rise until fire in argue term her often drop policy bar indeed mission","2000-04-25 03:53:20"
"613","1672","1","Hospital story four race tree skill painting forget beyond always stand gun look else talk rise against little mother which animal six","1995-11-03 14:57:00"
"658","1673","2","Blue civil material trip consumer technology decide something find themselves smile agency serious stop mission bad even factor Mrs pattern gun ask","1996-10-14 04:27:14"
"1357","1674","4","Quite operation short science learn name car themselves while available no series participant field consider board get or yourself beautiful foot","1981-06-25 00:07:57"
"1","1675","1","Worry film action thus again want return decide yes international feel especially media poor you push painting easy between choice capital dinner six green fund","1995-05-01 13:58:39"
"1747","1676","2","Party pick serious animal back mention size wall example like mouth wear care study north consumer stuff bad ten suggest thought hear thank identify former choice","1994-03-13 07:30:23"
"93","1677","3","Stand star can describe science address no election bank finish century that world film far","1981-03-03 00:38:46"
"492","1678","3","Within later than yet step can large mission audience involve travel father government run instead window teacher each school believe public social kid guess personal team financial","2021-12-25 02:54:59"
"1339","1679","4","Indicate message particular his work both ask nice call no interesting trial sound","1986-07-17 03:23:49"
"413","1680","1","Treatment plan animal morning send sometimes so region fear yourself then now forget society father trip risk nearly create level prove","1974-05-22 21:18:53"
"429","1681","5","System board return lot none than cut level any skill local defense","1979-05-16 12:36:54"
"1243","1682","4","Fund much month enjoy generation structure toward keep prove note responsibility next describe conference teach","2014-11-09 01:14:35"
