"892","0","4","Small outside land reflect less beyond course tree artist yes final heart world machine region","1981-10-18 04:50:16"
"401","1","3","Player outside also meet project election case air pretty hold arrive later mind that memory them address find member set early between answer government set near","2008-02-09 03:43:31"
"467","2","1","Score painting increase nation throughout experience tell movement cause manage where final yeah save","2015-11-14 07:28:48"
"1100","3","3","Girl believe any leave dinner risk mention author money think from particularly hundred television","1999-03-30 09:36:06"
"30","4","2","Institution particularly left west hospital American think like form degree will cover painting follow others hot safe direction","1983-06-28 19:15:26"
"1345","5","2","Think team off region show wife necessary image these surface class week ready beautiful two anyone","2010-03-03 23:43:42"
"540","6","5","Threat shake everyone yard yes just skill pass special speech peace hold during set herself road feeling then","1993-11-13 05:50:26"
"872","7","5","Star organization environmental may present suffer necessary quite expect century amount group receive road after heart sense evening pay leader case affect","2005-02-17 20:43:23"
"1406","8","3","Enjoy space mother this after material system course main ability travel market","2011-06-12 04:51:52"
"53","9","2","Ahead believe no get medical two site candidate history support address country throw with clear five all reason something","2022-02-09 11:47:47"
"1477","10","5","Energy reality must increase tree investment PM benefit story whose physical building push difficult realize drug think movie","1974-11-14 16:19:43"
"852","11","2","Different account cut report former rule similar war experience build exist picture me similar early member mother its easy involve listen scientist class husband material","1996-03-25 19:50:32"
"324","12","3","Both dark instead country where someone structure without term feeling author ago technology small they nearly care choose successful and adult a","2020-11-12 21:29:51"
"526","13","3","Sure away politics police traditional idea maybe beat record table seat do moment turn subject dog feel movie card maybe subject","1997-03-15 04:11:02"
"1496","14","5","We million before minute benefit become level account walk always north down reality within dinner again together source effect tend huge kid","2002-12-01 08:08:52"
"663","15","4","News enjoy focus choose guess training sort huge theory side act woman agency information into player offer detail account country alone PM","2007-10-19 22:30:45"
"838","16","2","Minute dream stop at bank amount thus wife show imagine number laugh send notice","2019-08-05 19:37:03"
"210","17","3","Your dream value condition much say whatever inside gas manage every safe you when manager research when official then fish pull their morning","1978-10-21 12:51:04"
"637","18","2","He factor no drug indeed someone member miss move development draw learn similar but consider financial task","2015-04-21 05:22:44"
"660","19","1","Candidate art election country school everybody event hand capital call threat action such protect military factor","2022-06-15 18:16:45"
"86","20","4","Every field again teacher management service leg administration large certain serious surface yeah relate character","1980-03-16 04:38:30"
"233","21","3","Sign view piece suddenly local itself role sense throw future control hour","1973-11-26 19:12:19"
"1113","22","1","Collection deal product wish fill station those there message perform condition rise health","2015-04-13 08:10:24"
"283","23","2","Born even value finally amount how sister bag method bit change couple least image exist various agency stand cut then look if training suddenly","1978-05-14 22:51:40"
"456","24","5","Form commercial yes particularly offer both imagine loss consumer through her interview our moment your tell but financial security federal help game against only just especially blue","2007-09-24 23:46:27"
"1871","25","1","Well sell simple record long boy rule catch condition entire policy indicate they claim eat drug majority sometimes exactly drop onto","2011-09-29 21:22:09"
"507","26","2","Head force per show even drop between billion floor hear office Congress because opportunity his cut once black floor generation theory responsibility if","1987-04-19 03:22:32"
"610","27","4","Something conference ago market education ground speech by compare loss eat however bar one recognize carry pull yourself six","1997-03-22 21:14:35"
"170","28","4","Stop fund drive team now authority rest guess change matter camera bag employee game start season send loss","1980-05-07 07:33:51"
"1402","29","5","Discover federal different management of college establish stage job any ok none nation suffer look entire occur prove wife star Democrat involve recognize","1993-11-30 08:28:49"
"1662","30","3","Soldier threat rock age baby pattern American shake morning here ten summer may face than door another","1982-12-03 20:17:10"
"1392","31","3","Difficult space also prove these less sell follow stage not common traditional star mother certainly different","2000-04-19 19:42:59"
"1689","32","4","Really training front school before campaign computer modern sometimes service bank affect her vote office method activity though military final serve","2006-01-22 17:44:10"
"1760","33","3","Computer gas worker read stand itself vote when within mother source black create newspaper commercial factor hope win must expect decision share mention language","2018-04-04 12:16:02"
"281","34","2","Then stay another real teacher consider worry hospital toward discuss about stay field break again page event","1979-06-15 06:07:56"
"202","35","5","Officer kitchen answer situation various speech paper case forget specific international sit course worry foreign reveal last network ahead size air hotel billion weight series","2005-10-25 21:00:29"
"212","36","4","Boy care four smile series pressure learn enjoy have who person summer poor woman","2012-11-01 12:20:28"
"42","37","2","Former moment turn member city civil image realize green already task language enter believe throughout keep particular most","2001-11-04 19:52:23"
"1107","38","3","Message century bring tough box follow writer difficult which fill skill particular trade street","1994-03-03 23:15:17"
"216","39","1","Top blood dog almost edge different message indeed goal everybody seem say total","2017-01-02 23:55:45"
"262","40","2","Record system church table life trial former speech continue senior quality onto almost chance age huge attention owner","2005-12-14 21:30:45"
"1044","41","4","Answer no fund little foreign line break list forget teach while key still","2005-07-31 06:15:47"
"760","42","2","Which degree democratic while sort finally here cup effort side the theory career that boy production break college arm","1998-09-12 10:53:10"
"292","43","4","Pretty news note yet wife at begin appear theory none energy sign reflect ability run body medical","1986-11-03 06:03:34"
"1880","44","4","Fine back party law always response face claim million decade nothing hand fight professional production could deep main sister thing nothing in next fire","2019-07-27 17:18:06"
"1470","45","3","Through large take Republican mouth majority write administration strategy necessary matter report street necessary quickly carry information range owner upon meet economy","1985-06-09 15:53:33"
"598","46","1","Support industry hospital production tough like already former less west course among we seat clear whether finish until laugh office experience voice","1990-11-12 15:59:28"
"981","47","2","Nice day practice write street style smile local analysis option health arm three available wind hand two debate computer","1988-01-27 05:42:34"
"470","48","3","Return human party develop product art heart special range than identify traditional really individual recently because member","2009-09-12 17:26:24"
"513","49","4","Hair science information power there without tree after carry throughout picture trial debate author until show","1992-11-20 18:53:27"
"1719","50","2","Sit certainly attorney accept ago culture city reality current either keep rich popular despite magazine about piece direction","2006-05-31 03:38:28"
"1091","51","1","Employee near plant huge certain arm program go this evidence car see approach table week family should","1977-09-10 16:36:44"
"1157","52","1","Fire gun south writer charge significant suggest enter air people can service site specific consumer science hear over today start station issue make degree","1972-10-29 08:11:50"
"1480","53","1","Pm another charge fire follow throw more relate difference adult lead attack relate movie tree a safe capital nature let say travel somebody carry citizen","2008-11-08 15:18:05"
"1169","54","1","Short include military president number may area threat relate long energy according choose show tend","1975-10-06 00:36:29"
"405","55","5","Seem cell way why huge current report remain can analysis fear a story majority lead option side increase wear send bag","1980-05-20 12:03:04"
"277","56","2","Yes join money little surface national explain standard require walk stuff appear campaign music","1987-11-30 20:56:21"
"1267","57","1","Price result shoulder almost Mrs civil form any tree when try others rate prepare adult picture increase rather life attorney goal American","2013-10-28 19:52:35"
"132","58","3","Possible then last join bank run admit south beyond government suddenly meeting chair anything rather suffer short","1998-08-01 05:18:56"
"1870","59","5","Economy visit language send former activity ball industry need finally series international another able wind help artist race customer house form book allow","2019-02-10 10:38:06"
"1475","60","1","Marriage couple determine deal talk realize here foreign market cup discussion during probably process several write field stage spring approach thing toward certain threat","1995-10-02 19:21:37"
"762","61","3","Bag citizen professor race cultural maintain seat camera nature daughter grow me security lead","2003-02-11 23:17:33"
"627","62","2","Write benefit design later personal sport look without us at lay remember might minute during","1972-11-05 06:24:06"
"721","63","5","Argue else safe movie degree center focus hotel future design similar character situation language second owner forget draw picture read age reflect investment movie institution","1988-06-03 20:19:33"
"533","64","2","Debate some after during push low former join generation best way beat late offer listen ball bit often opportunity they write treat political whole scene when especially","1995-07-19 13:12:44"
"262","65","2","Your heart however certainly glass another tell boy control seven south artist girl let ready cover yeah person summer","1975-05-01 13:08:22"
"1832","66","1","Pm interview movement again race night hotel make capital our standard require six chair house brother information anyone start scientist expect","1997-03-31 02:40:54"
"1777","67","4","Natural bank suffer let firm interview police physical finish listen arm former least candidate order people talk success weight decide call care building","1982-06-05 04:12:04"
"682","68","3","If day girl protect serious already least see view live scientist history nice","2021-02-04 11:28:39"
"1409","69","5","Final it something similar whole military relationship follow technology begin middle performance fly such skin why exist source force economy","1974-07-24 15:59:28"
"932","70","3","Government present state where financial this reduce perform which spring that case lot agree surface operation citizen down newspaper give","1975-02-19 14:23:24"
"679","71","4","Hair sound send owner carry pull one beautiful hundred project role always","1991-07-07 17:04:09"
"1526","72","1","Especially statement could specific him study especially where trade trial article sometimes card sometimes one item economic health partner story meet keep assume public six study attack","2011-12-25 05:31:37"
"1093","73","3","Join beautiful huge brother mind foreign change network really between fine state serious hotel herself chance consumer should","2022-07-06 08:51:04"
"1322","74","1","Gas push fill within rest owner artist skill record subject it receive will partner first","1972-07-16 04:31:23"
"177","75","5","Charge news you down space build arrive just offer least during sell owner enjoy on size how will international then sea event goal office pay keep","1976-12-19 06:38:20"
"1752","76","1","Toward spend thousand seek control range property civil hundred realize plant I four lay ball officer door edge","2019-05-06 16:18:20"
"1819","77","4","Coach past pass attorney stock pass very morning reason can huge daughter operation benefit street yes him","2018-07-15 08:21:13"
"1399","78","4","Hospital write act whether author test night build performance side let dark real go born man","2006-07-30 07:58:28"
"917","79","4","Building think meet traditional statement collection protect inside officer weight memory go","2012-07-30 12:51:49"
"1245","80","2","Continue American put site senior window energy matter left collection card when laugh financial you","2001-02-05 02:02:29"
"1400","81","1","Left future brother front current fear better fly benefit rise government animal good first item executive theory kitchen least case improve","2020-01-15 14:21:00"
"1578","82","2","Sign six wear treatment through claim across plant least fund me network door member","2003-06-27 03:57:58"
"735","83","4","Wrong officer where heart serve everybody identify thus risk television front ready manage attorney seven surface relationship condition unit community true","2017-02-06 14:52:12"
"7","84","5","Modern city better former sense blood sort million president guess statement and pass bill sit theory for feel be believe early fast field how","1986-06-17 00:49:49"
"1292","85","5","Discuss local lawyer manage water price step increase husband address development easy environment dinner could different crime war policy suffer to Republican success Mrs between war main maintain","2010-01-22 10:04:19"
"77","86","1","Give nearly usually provide wish develop today natural again building ahead night heart","2003-11-29 16:52:19"
"1192","87","3","World matter hear but then short fast quite age when real wait father case compare federal job pretty its","1996-08-05 07:16:37"
"678","88","1","Sing easy today both concern account civil upon player research lose within article follow likely get keep number key church record window operation may send travel","2016-09-19 07:07:32"
"1254","89","2","Similar case on strategy executive age ever speech read street scene year every eye whatever author small kid success read exactly","2018-07-21 07:47:15"
"640","90","1","Break forget use finally partner act member bit by key yeah page discover glass identify agreement story back","2000-05-15 13:04:10"
"520","91","4","Pass wait hear seven network high real management government whether long claim car or they","2022-02-03 02:11:35"
"471","92","1","Whose threat event actually rich great right home wish research total ball","1985-08-08 16:31:59"
"1094","93","2","Mother project step poor loss region wall order call work hot someone trial Republican executive hand any what","1974-09-01 23:22:52"
"1391","94","3","Professional office son arrive field piece get end interest least wonder red government","2019-09-18 15:18:57"
"109","95","5","Behavior physical suggest quality yes figure top professor fast safe national property very condition something dream save from none win beautiful support a watch","1987-08-08 04:36:06"
"958","96","3","Reality war line there talk federal road while contain somebody old support I ask","2008-10-09 14:55:38"
"81","97","4","Along popular down pattern firm instead fine fast mother meet less matter kind space president daughter million","2020-08-11 07:59:22"
"502","98","5","Policy born certainly book none subject later lay soon follow page tough us employee case collection may carry foreign kid kind","2016-02-15 08:47:44"
"1864","99","1","Pull class year president accept often central place together few including receive","1977-11-16 21:13:59"
"1065","100","3","When beautiful yeah spring trip beautiful around last race man show top amount","2008-10-02 05:48:27"
"1810","101","3","Couple radio foreign simply draw information open part friend I it strong skill really both by pass right sport and news including serious growth argue indicate north","2003-11-11 02:49:41"
"628","102","5","When student then ago toward out cell name me ok she star improve itself","1975-11-22 14:18:25"
"327","103","4","Small better me oil kind offer mission area week administration decision agency","2002-03-11 13:21:36"
"1357","104","2","Pretty get certain benefit protect head early standard someone career speak ten message tax attorney sell use lead grow one rest instead","1976-04-08 03:46:45"
"731","105","2","Collection group employee page plant north game reveal chance herself much enjoy on picture two","1991-07-29 23:53:08"
"304","106","4","Road kid affect because situation big with computer open Congress indicate hundred expert why never","2021-12-22 19:05:13"
"1201","107","3","Anyone enter lead evidence seven my car ok finally practice must speak move successful question finally draw performance deal Democrat consumer baby anything who how","2001-02-16 10:15:43"
"1505","108","1","Give act win letter technology success section court appear do deep knowledge scientist want may training administration lawyer bed","1996-12-06 06:23:39"
"1859","109","4","Beat hot investment suddenly model test before analysis consider name officer send culture nearly whom a successful low according explain cover","2017-12-01 11:46:26"
"1149","110","4","Brother debate sense fall ahead sort begin simply bill type education reduce bar career product theory far military open course civil almost hotel quickly many","2016-10-04 20:39:10"
"454","111","1","Yes upon throughout use fish how often seek what feel main production clearly","2007-05-01 09:24:47"
"1950","112","3","Mrs wrong activity outside reality page air action box girl whole perform score time high month then alone fund quickly probably","1985-10-24 20:12:53"
"1677","113","3","Here accept fast just keep yeah especially reflect agent she especially start every article project happy pick view speech value act success travel form","1999-12-23 05:39:06"
"1293","114","4","Court talk conference represent everything war too century nothing necessary interest chair wrong time capital ball seek just fight present approach sport rather painting pay","2022-05-21 01:38:16"
"147","115","4","Effort senior big responsibility me street become allow kitchen without piece save career study person actually study production day even list hundred","1998-07-08 11:48:09"
"1379","116","5","Democrat over professor design ability wish including parent drive however member public tonight live when special southern single likely officer father north number","2008-04-24 00:51:55"
"1114","117","4","Around many investment ball safe control four hour somebody entire I site side","1998-02-01 08:06:18"
"1116","118","1","Morning thus first year view arrive growth bit real author include bad see point knowledge establish relate system","1978-07-08 07:33:33"
"970","119","4","Big member party free some likely contain skin lead TV choice fight view institution","1982-04-08 21:20:52"
"1840","120","5","To significant focus up event environmental attack education along manager black TV hand enough right natural me poor recently economic tree any true make yet anything at improve","1998-11-09 11:21:00"
"1197","121","5","Skin management again fall just age bad cut amount edge force floor school each other standard stage nature city product it upon people wonder computer","2005-11-27 21:07:20"
"1603","122","2","Keep live season customer actually it management as know likely Congress six total wife for president material company speak group board","2019-05-10 09:31:29"
"701","123","5","Few team bill environmental baby in other likely recently next writer recently strong see student necessary price per we","2022-02-06 13:52:40"
"1956","124","3","Miss make inside leave product prepare laugh suggest anyone discover there marriage man recent method test drop choose","1972-06-27 09:15:20"
"1026","125","2","Explain home suddenly its effort effort each property run again let film around girl half particularly development","1997-12-03 03:52:54"
"512","126","5","Instead wall whatever itself none friend despite paper agent eat year body newspaper simply art effect reduce determine long control benefit recognize","2022-06-29 19:50:44"
"1211","127","4","Among huge kid boy pretty nature less exactly between nothing serious pass most born people class authority different other amount population fight so identify","1987-02-25 18:38:00"
"1945","128","1","Authority treatment teach structure term fact service loss like student then smile rise light statement employee her arm career","2010-10-26 20:41:32"
"1132","129","3","Quality should American fine drug maybe experience available life daughter share accept reach agree day result although power imagine serve most hair like quickly back start","1973-03-18 00:43:32"
"946","130","2","Art while star among late we free language build behind argue cup its account people finish yes thus clear of yeah market open another well box","1974-03-23 14:06:46"
"1678","131","5","Nearly they follow own next general factor catch personal pick appear whom allow board hand guy","1977-05-17 06:40:36"
"1927","132","3","History power something meet like where develop myself military practice foreign other nearly history","1989-08-02 00:53:55"
"737","133","2","Record bank suggest animal security same then case necessary later inside several wait size","2012-03-10 22:00:01"
"1434","134","1","Whom their this cause I conference drop employee issue claim leave sell partner phone economic always sign threat heavy candidate walk effect pass election","1973-09-21 07:25:44"
"1508","135","2","Artist ten herself figure forward away wonder spend eat raise court bit concern political visit realize myself there wide economy alone resource tend","1991-07-08 08:56:54"
"862","136","3","Become southern rather red whole into young culture within table my specific hour heart believe they","1990-03-20 05:22:22"
"1362","137","1","Nation open camera what sing million choose letter recognize surface fish activity month visit often past hair mother manager protect increase eat marriage evening section remain at","2007-06-14 17:20:35"
"1747","138","1","Someone notice laugh option star yes only minute indeed today establish throw although common player feel usually bar true song action page","1976-11-08 19:05:31"
"256","139","5","West drug base thing level avoid personal mother dog analysis explain son hair ball blue exist talk fund hot crime table pull professor option history program","2011-01-02 06:44:49"
"94","140","4","Up far I situation be can bring Mrs heavy plant protect me son know remain loss","1974-06-16 14:09:18"
"1139","141","3","Stuff opportunity method cause police choose before might top able add never red common she then","2002-12-08 11:43:32"
"1740","142","4","That whose admit view authority tonight card different out town same street throughout too job be until official evidence evidence phone light position recently reason now","2006-01-29 23:13:30"
"10","143","1","Past system baby matter or wide debate itself positive there tonight entire discussion career agent government quality","1980-12-05 04:42:29"
"1699","144","2","Thought talk American civil build soon individual class indicate front letter gun kid half","1984-05-21 03:01:12"
"1225","145","4","Break a threat tree us nation gun respond clearly agree phone training son where where war catch ask statement hope us somebody might middle take","2001-10-03 08:20:05"
"1894","146","2","Blue type describe Republican movement loss girl from almost loss anyone everything allow surface bad public for","1973-06-30 00:04:32"
"316","147","5","Population subject suggest most federal me development tree image hand dream where since game well brother student around real single system less hold","2005-08-11 02:04:11"
"438","148","4","How start site organization sometimes policy citizen race admit computer teach realize common table above","1974-06-20 20:02:58"
"474","149","4","Often movie page record financial on score skin upon fly paper whole mind","2016-12-04 09:39:36"
"1055","150","2","Too list area white total result report though opportunity finally who newspaper chair technology hour mind","2006-06-17 16:58:16"
"1135","151","3","Course when become their board reason hospital yes affect a agent work thus professional capital bit laugh radio past church citizen serious toward their figure task","2016-05-07 04:07:02"
"43","152","2","Institution item evidence democratic look Mr sister remember according test because even argue agent this positive center personal effect","1985-06-24 11:09:33"
"567","153","1","Test theory success my alone candidate better seek administration small act nature Mrs adult window ball garden time only fire carry go light room compare","1974-08-07 16:12:59"
"767","154","1","Success practice whose specific like stop hair maintain whose goal home how unit government give positive who main tough bring all realize win hair","2008-02-29 20:25:29"
"866","155","3","Lay provide amount professional strategy threat only thought fine seat perform exactly financial water appear close hundred every fall will","1981-10-28 07:04:12"
"1443","156","5","Almost pay box cost make later compare field almost bed defense gas human pull other","2000-01-20 00:36:00"
