"1086","926","2","Majority certain protect day personal including adult sound system miss sit across him significant participant young age crime box tax grow ball","2012-05-22 13:54:29"
"1835","927","5","Bar head home later describe door control it president since seat his again result","1983-03-31 06:46:29"
"1627","928","3","Do not again let structure lose report of few nice resource role sure nearly travel loss","2021-06-19 19:24:44"
"1251","929","2","Reflect explain few could specific represent theory Republican order off article degree message amount and above stand but southern will few","2008-05-07 06:57:42"
"770","930","4","Few senior point for from of short may cold land wall financial pay","1987-09-28 17:22:55"
"436","931","2","None one because whole assume even water prevent artist blood alone memory science good majority on true increase effect view far must","1988-06-30 01:03:39"
"1342","932","2","Person necessary remember soldier quality sea bank hard walk everyone particularly performance start exactly movie challenge treatment","2008-08-17 08:17:31"
"661","933","5","Leader produce American position about body professional meet power lose central public page buy","1974-12-20 06:34:29"
"151","934","3","Executive group pressure certainly us none quality foreign future plan hospital carry list happy entire stuff","1997-01-12 11:44:20"
"94","935","5","Include food fear hospital learn will nice where central himself receive outside none common meeting person","2001-08-23 02:19:29"
"1717","936","2","Eight method three ground memory worker important instead bring little a return well support finally step decision election quite way fine win miss","2018-01-30 19:54:37"
"379","937","2","Along exist ball begin employee industry exactly necessary class fall former avoid job deal child sound course either","1974-04-20 19:36:05"
"1047","938","1","Whatever little party address sign room gun way small front Mrs stop you born tough lose page employee sister party truth true commercial star thousand the drive","1982-07-20 08:35:36"
"895","939","2","Actually smile hour poor attack information three fast our single heart institution score protect argue form laugh them fly while too those","1977-12-11 04:13:41"
"565","940","3","Fact build early hold a teacher woman country employee become ready daughter must within enter economic help","1975-06-17 05:54:58"
"593","941","4","Write strong film letter hand stop themselves center performance tend white room nothing admit happen history structure scientist student party","2010-09-06 15:03:25"
"80","942","1","Treat or even ten rule fund guy pressure step list career strong","1991-01-17 18:43:50"
"143","943","4","Sport face green fund star pull anything fact role prevent share why","1973-07-06 09:47:09"
"1654","944","3","Most table participant sea know individual wife effort along into statement and story range wish country seat history mother speak gun mission about","1970-05-08 20:26:43"
"1131","945","3","Hold what but floor us bar determine sign various finish message away without national like","2007-02-18 10:15:36"
"1146","946","2","Federal help author reflect writer cause manage necessary look onto what black action","2003-09-17 08:06:07"
"277","947","4","Walk send nation whole although top population any much director second language development bad reason present than collection financial her one apply break people question within","1994-05-23 22:27:17"
"500","948","2","Dream support number peace less hit out science key simply professional measure direction prevent event culture action key crime than head lay","1974-03-14 23:59:18"
"133","949","2","Clear fly consumer still off value staff away there over think reason beautiful discover morning those return simple while help only","1973-09-10 23:26:28"
"1188","950","5","Name run possible yourself and discussion drive friend experience money then young institution treatment loss water however public sell off","1983-06-04 09:22:26"
"1099","951","3","Campaign world wish page far industry right audience finally community remember bit knowledge leave mind feel manager amount us as network","2018-03-10 01:42:49"
"1094","952","3","Best feel deal effort movement skin sign set worker participant matter water head your play","2020-06-16 19:54:51"
"357","953","2","Identify record quite eight method medical small leg itself walk activity threat case important population sport really sell four race method usually how affect impact kind white","2007-08-19 05:46:01"
"84","954","2","Body try west hold kid late view hour change mind store method big form product important should none player interview economic risk economic","2021-05-21 01:58:05"
"182","955","3","Tonight talk improve ok responsibility decide board week general project child story late sell my discussion shoulder expect activity","2009-08-27 23:43:24"
"578","956","1","Less call toward difficult society meeting at party up tell good many scene build","1996-08-03 13:03:52"
"1452","957","3","Political become spring key blood contain enjoy safe from seven bring focus cut personal pattern part professor somebody serve treat would leave know","1998-12-24 11:12:40"
"153","958","3","Represent share good ground myself yard thought size money itself week claim money common single energy draw large be sell manager lay everybody yourself hair","1989-09-14 12:30:08"
"1207","959","3","Reduce save common our but cut next soldier probably week article southern beat social cell","1979-03-06 21:15:45"
"1834","960","3","Respond discussion certainly particular offer teach face final resource seat claim statement fear product manager training similar here study animal movement sure no try attention break present sure","1995-08-22 15:38:37"
"1897","961","1","Hair no newspaper before politics story go thus billion best knowledge about computer section day like here bad down stock safe real my drug","1987-01-04 03:47:02"
"818","962","3","Although election near stuff two yourself its bag yet generation friend off mean employee modern teach dream color","1973-08-25 18:26:11"
"1650","963","5","Nature outside collection move know car world dinner ready even up hot today week simple rest actually include myself even magazine spring oil plan","1979-01-19 20:47:21"
"417","964","4","Whether southern six environment itself enjoy Congress usually piece generation foot here three receive relate third staff white movement money government","2020-06-13 20:45:52"
"1380","965","1","Best act involve each how lay through nearly read several author force reality hold large successful say tonight little color individual name yes","1998-11-21 23:27:59"
"552","966","5","Money type begin forget late site law TV seek body rich land human since soon hard create me type woman skill my hundred Mr operation","1992-09-20 17:33:51"
"534","967","2","South condition foreign road though loss class accept action particular opportunity second who role only against crime hotel conference different dream different for simple million hit enjoy","1990-03-08 20:57:28"
"1458","968","1","Either operation move perform soon international fly approach purpose value surface expect order later list yes have remember leader never happen model politics","2007-08-31 01:55:24"
"568","969","4","Full film north girl lose concern trip local read big west fall again listen be any stage detail whose contain","2011-07-10 11:00:16"
"649","970","3","Least accept age night once provide decision successful cold choice yard more player many offer fact institution hard tough sport world data make change decide voice","2002-12-28 14:35:18"
"1849","971","5","Identify plant everyone price want decision door hold relate last sure term fish charge likely fill threat former image law material thousand seek economic","1970-08-16 12:27:47"
"939","972","2","West avoid next determine senior theory city simply force base involve white yard","1972-11-18 06:08:33"
"148","973","4","Cut material western upon interesting exactly notice player animal become do begin real will letter news born listen but","1975-09-13 08:14:12"
"654","974","1","Chance push break reveal government nearly carry group site leg book television area recent billion","1975-02-10 14:43:44"
"1000","975","5","Bit fall test different later from various factor push south notice next human new soon best ago take send","2021-08-06 14:21:59"
"242","976","3","Morning training return admit front such out still decade wear become base far manage force","1980-08-29 08:48:48"
"1030","977","2","Box wear easy popular medical list apply still candidate those answer feeling be","1988-06-20 03:44:35"
"273","978","3","Bring wall available in air without ahead child personal too story meeting its from affect process two argue everyone social level at choose possible","1984-02-08 07:25:13"
"1778","979","3","American kid determine poor sit leader sense politics follow peace stop stock arrive she","2020-11-24 16:30:01"
"764","980","5","Experience dinner teacher model position party example health this organization understand off week","1985-10-23 05:28:20"
"333","981","3","Career section exist section baby community west movement now TV morning couple include itself reality","2018-04-11 16:47:45"
"1447","982","3","Nearly prevent strategy visit edge everyone expert yeah great manager life point serve leave get sense alone community note consumer garden south beautiful outside sing strategy","2003-05-14 18:03:48"
"1777","983","2","Seem Mrs series west travel machine more financial participant price according real later site word building material push produce continue ask democratic maintain peace","1990-07-31 10:08:47"
"1628","984","5","Happen ok certain degree question thing sing assume left future him attention challenge staff Congress again wall gas tend","2019-01-31 01:25:25"
"1767","985","4","True cover light attack wish catch him practice political sign whose man leader","2013-11-12 18:37:29"
"1339","986","5","Community most organization toward cut value management although TV eat of your boy change hospital plan sit catch else","2022-03-10 10:45:02"
"1576","987","5","Whom everything structure section style film bank especially staff indicate help success position surface word hard prove weight decide security subject bar enough","2017-02-05 02:37:57"
"1872","988","1","Budget seven door part maybe like language consider administration everybody single Congress wonder federal quite prepare usually offer place performance wrong beat that","1986-04-25 13:06:22"
"194","989","5","Message old space group for out condition since list senior deal piece answer your social focus across office wait rule admit of sign","1987-07-17 22:19:17"
"346","990","4","Early reach rather what often energy ball house with weight yes agree scene particular buy both","1977-08-07 01:58:16"
"498","991","3","Career nation walk dog improve want street maybe join job us plan recently herself","2017-10-09 13:59:58"
"703","992","3","Perform impact decade official get one want officer born street couple you opportunity institution prevent know my collection direction remain movie whom three","2019-02-01 04:37:35"
"1837","993","2","Way new before already defense near hundred simple agreement quality despite anyone more ever result finish agree southern service point wait there reality","1971-06-02 20:50:19"
"420","994","3","Yes control meet direction improve look describe analysis land material risk work out maintain style bank such draw sell moment lawyer","1980-07-02 01:50:02"
"1042","995","2","Ten dinner wrong feel will outside argue brother organization popular point she base great society company indicate successful necessary water including these writer discussion off type black","2006-08-24 17:06:03"
"1449","996","3","Mission service my customer rest senior plant during somebody per adult nearly heart any suddenly soldier bring certain three","1994-05-16 20:04:45"
"73","997","2","Religious able never executive success option mind visit to already adult writer participant along","1984-04-11 08:54:08"
"20","998","5","No drop take affect thing rich manager be short market research yet","1987-02-23 17:11:38"
"653","999","2","Idea still machine young season think side American election different world couple particularly data middle sometimes eat center","1988-02-15 00:06:38"
"1803","1000","2","Sea material instead recognize fact central evidence read allow book finish various space cold audience window","2018-02-26 00:49:33"
"1137","1001","5","Forget class himself produce work always meeting item benefit successful despite help boy whole present position hour animal organization partner send for kid truth value","2021-09-01 18:55:29"
"1867","1002","5","Thing Republican arm on wish collection event dark manager middle kitchen over","1979-09-07 16:28:48"
"1372","1003","4","Adult maintain out company stop Republican power particularly consumer young hot according card similar hospital story rich both region south assume drive list last ever","1991-05-10 08:47:51"
"1584","1004","5","Capital exactly high could dog thus among again training author sport along style rule program get stop dream anyone","2004-12-04 03:11:51"
"847","1005","4","Especially law there value all different like happen attorney remain push food bank seek","2002-02-28 21:15:14"
"1384","1006","4","Education have worry blue safe create region pull write focus culture any generation president old continue institution look right we car question rest not","1998-01-15 02:27:34"
"1413","1007","5","Wear officer poor body behind will prove spend notice close relate hit can respond direction perform low condition time glass future already hot hundred determine tend hotel mother","1996-08-26 03:15:05"
"515","1008","5","Seat sure fall thousand with fall accept past sit begin someone partner","2009-04-26 02:58:09"
"1417","1009","4","Check attention upon according put knowledge some year read into skill along guess program recently life key view mother tell until","2014-01-11 12:24:02"
"62","1010","4","Foot off teach commercial politics always notice dinner you collection visit near bill table cover rather evening industry top","1985-09-28 13:21:09"
"1407","1011","2","Exist form our offer themselves without or or should strategy mind fact left","1990-09-25 00:01:14"
"794","1012","4","Or charge value beat traditional still leader man group situation read market number evening me opportunity","1971-06-26 03:00:00"
"1603","1013","1","Yes summer let room send side point seat give use social work amount first action between suggest raise break federal finish amount should","2008-03-09 12:46:11"
"680","1014","5","Government your Republican own no eight attorney week rather approach class time identify second prevent reality seat","2020-10-03 04:52:12"
"931","1015","4","Need individual picture difficult yard condition station happen few conference report impact perform quality few water later","2006-01-16 07:16:14"
"872","1016","1","Responsibility age fine heavy crime lawyer hard everything dinner indicate should from glass machine control","1977-11-29 03:43:10"
"1402","1017","4","Traditional reach their industry field provide majority again long everyone drug budget series issue shake enter discussion worker","1991-03-12 03:30:15"
"801","1018","4","Specific down simple better especially reason already method ago half room mention him realize upon common lawyer","1971-12-17 07:09:06"
"1449","1019","5","Young bit economy across draw less stuff strategy sort be whole position customer agree war never beat prepare bring attack","1988-02-10 16:39:10"
"494","1020","2","Drug agreement according commercial degree area religious enjoy suggest top type end yard pay whether me degree condition ten continue else thank create provide loss worry everything","2007-10-26 23:37:36"
"1243","1021","5","Turn international green measure space risk shake end decision throw morning letter respond spring down respond unit loss lot entire","2001-01-24 13:06:21"
"1428","1022","2","As ability cause reveal receive set understand say although clear catch really light page day large impact draw add couple little make","2005-05-28 07:04:27"
"621","1023","1","Run election age down woman as organization material institution direction yard son probably share clear couple trip lawyer not blue sort ago office human degree garden suggest","1981-05-10 00:22:10"
"970","1024","1","No course song notice current east rule involve consumer role often can long myself could claim happen site red drive","1971-08-01 21:34:06"
"1513","1025","1","Republican ten thought teacher people bad increase enter simply when culture even civil amount foreign","2005-08-12 20:21:20"
"496","1026","2","Behavior should weight simply kitchen surface group mean personal matter reason medical full century almost floor indeed create detail huge not international sing throw office they","2006-09-01 15:03:44"
"1477","1027","2","Fact rule claim summer too cell general arrive end far four outside one clearly","1988-01-28 06:16:02"
"1197","1028","4","Similar daughter though environmental high picture decade rule school dog debate less full later any our or always many program realize because customer produce pull full form sort","2001-10-22 22:49:35"
"1242","1029","3","Media walk someone political road west life sell trial Democrat site big hair general notice agree national cost believe low there final Democrat since approach manager","2010-05-25 05:23:53"
"1537","1030","3","Dark will situation small purpose loss finish recent senior wear worry capital manage create own same race claim point sea","2013-08-26 00:26:04"
"621","1031","3","Country others catch service rest stock describe cup read relate customer you quickly agreement compare trip wrong past adult effort age thank network himself price","1997-12-04 04:33:33"
"364","1032","4","Stop fall group research give example skin assume east choose investment mention the","2014-07-10 15:21:43"
"717","1033","1","Of we eye own tell agreement final hold writer them including mission never little financial son","2018-12-21 03:16:33"
"1107","1034","4","War left finally whole strategy upon box specific number man million hot girl allow politics scientist those manager minute glass PM exactly main everybody how tax","2012-05-20 15:19:58"
"1132","1035","1","Store use risk produce paper cell agency organization phone message heart to prepare industry sense station present push health forget writer responsibility machine amount town government along","1993-06-01 06:03:13"
"887","1036","2","Local current message environment reduce theory tree smile ground mother travel enjoy fine","1970-08-31 18:59:43"
"312","1037","1","Old return turn reveal third bring dog picture send police training last including better speak sea century husband laugh among page necessary wife not","2008-08-31 23:16:19"
"1825","1038","5","Position matter west reach join game environmental himself day administration place and discuss election red","2004-01-27 18:39:48"
"779","1039","2","Plant sea involve care same art increase anyone statement fly store best sit billion along drop benefit behavior need quite enter high condition","1975-08-28 21:30:00"
"1094","1040","5","Interesting good should at he animal surface least recognize behavior ball approach war choice story available sound professional official its write physical plant everybody moment president","1981-01-24 02:13:01"
"913","1041","1","Cold onto brother question establish car raise rest on federal require position water prove evidence staff his project film voice it husband fine daughter","1971-12-12 21:52:59"
"956","1042","5","Office reality dog discuss rock pressure event science soldier hour quite movie amount","1981-09-08 13:20:51"
"48","1043","3","Nearly wear be new scene big high avoid lead former thousand almost western throw degree standard impact protect prove later","1978-05-12 17:14:12"
"341","1044","2","Shake else street adult attack nice such network high worry record watch guy single part ground employee section research fast yet democratic accept movie everybody reveal staff","2013-12-11 22:48:08"
"405","1045","3","Minute mouth to resource special before there how own nice TV forget nice agreement that forget population five necessary response","2021-05-17 13:21:30"
"494","1046","2","Thousand art well tough such life apply similar most small among environment something mind left computer late drug care nor young consumer west fact reveal","1984-03-09 20:32:09"
"407","1047","2","Yourself last animal friend call lot its before age read he big may indeed gun each","2010-04-16 10:47:05"
"913","1048","1","True PM whose brother local operation onto his test his upon floor few skill theory region control them nation arm interview establish serve still wear specific","1993-12-19 10:37:11"
"912","1049","2","Body paper fear past lawyer of treat two society share market sure big pretty behavior three cell treat right many parent born bed career least family heart","1998-06-20 19:17:59"
"1752","1050","1","Base relate view all town notice across quickly up follow into production fear","1998-05-18 14:24:54"
"1052","1051","4","Sort section show test which worker policy tree look before local coach face try leave southern few consumer TV long another citizen check speak history there billion","1996-08-02 07:53:53"
"493","1052","3","Community customer new could agree effect difference meeting improve middle ask eight dinner guess usually door still","2004-10-15 12:50:28"
"1337","1053","1","Yet budget although cultural spring well especially sea decide myself market create","1974-01-08 01:22:46"
"788","1054","1","Key Democrat figure heart hit black popular nice similar increase move too dream quite room condition part shake sometimes","1972-11-16 17:31:46"
"1612","1055","1","Allow ask table decision bag political so fire Republican how fact choice just ever here shoulder current instead know itself help into","2000-04-27 07:59:29"
"1443","1056","2","Somebody anyone newspaper drop data thing against by natural central artist treat include","2003-01-11 11:21:28"
"1978","1057","1","Personal price tree wait find artist career way across party performance staff arrive area truth body forward statement answer customer","2001-09-07 22:27:24"
"1844","1058","4","Under sound enough season reality difference institution draw leg job today action teach focus measure see physical street short traditional these responsibility director report","2019-08-06 18:22:09"
"92","1059","4","Animal list single low sister fill several evening according pick per that a along attorney person","2018-08-30 15:26:56"
"1670","1060","1","House already best science analysis adult half loss high official five purpose space off","1991-03-13 17:43:07"
"189","1061","5","Reason subject strategy mean strong first leader method color sport for region Democrat","1976-06-10 11:22:27"
"1554","1062","2","Long Democrat account situation economic with once join trade huge memory sea change cell win because perhaps recent blue trouble","2010-05-27 01:55:46"
"553","1063","1","Key play everything member concern authority hundred true community like manager detail national occur view yourself girl occur child get occur opportunity amount poor test evidence","1977-01-07 12:06:19"
"1659","1064","1","Edge toward better local agree or chair only traditional material degree your language fear up modern situation believe","1994-07-04 17:00:46"
"1444","1065","4","Another skill wear like worker house significant idea force not three recently next political character eat or big language want nothing moment","2012-05-30 17:14:55"
"1257","1066","2","Myself up would reality action represent idea us book management officer cultural bad like road trade next future find describe off this month back far","2011-08-18 12:57:34"
"1678","1067","3","Drop similar doctor anything ten deep none report key deal we term list stage president adult defense into time","1985-04-20 15:14:36"
"728","1068","2","Seem worker but officer total land yet better tonight officer I forward add simple big along threat physical old local decide stand be difference","1973-07-20 13:59:12"
"481","1069","1","World think benefit they after because collection cost defense determine those thank anything","2015-09-02 06:40:06"
"1898","1070","3","Subject structure suffer east until choose than mean anything show wind price","1979-04-15 03:23:56"
"432","1071","5","Ready along business south section before fast view alone four success west off yes involve rise foreign board case evidence clear size fish expect add almost why question","2017-07-11 20:00:27"
"341","1072","3","Detail back interview rock country bit same writer law his himself kid this history act fish above","1970-08-22 19:03:05"
"726","1073","3","Back can girl themselves yourself adult spring people pull day recent leader huge talk together stop year seat difficult coach attorney gas seek green lay","1978-07-10 04:50:10"
"1766","1074","2","Stage project prevent authority lay size sit yet movie practice score simple difference newspaper apply try though writer imagine pay able","2006-04-10 17:28:34"
"562","1075","3","Article board policy until drive evening else need also clearly nothing protect within product kind lot form agreement full strategy trip big eight growth act foreign contain","1997-05-01 20:56:01"
"686","1076","5","You free close upon successful first when official one bad popular two owner water however successful he check born onto maybe performance happen","2019-02-19 07:25:40"
"1493","1077","2","Evening would real have player difficult the dream yes effect remain bit sort music mind book artist check day","2014-06-15 14:46:33"
"492","1078","5","Such oil onto central direction trouble sister past black never news American however age hope standard painting enjoy keep true","2006-12-12 05:11:58"
