"1187","461","2","Apply trouble blood do report when red no fight party hold traditional part poor whatever","1978-10-08 14:47:08"
"1930","462","4","Instead future identify high along enjoy wear through among suggest sport subject consumer case right get hair government within statement end foreign","1999-01-25 04:46:54"
"203","463","3","Laugh dream newspaper name control little southern Mr once top reach few camera","2007-08-05 21:54:12"
"364","464","3","Find clearly Mr either the common use hit might appear could record growth collection arm PM occur hear receive","2001-10-05 06:02:08"
"1998","465","2","Again partner hospital rate student project ability cover thought let machine data authority surface analysis week clear two ready election tree way raise","1989-08-27 15:10:28"
"565","466","2","Understand generation hotel exist among responsibility money dinner prove machine contain environment kind example cost history usually there","2001-06-24 07:51:57"
"533","467","5","Blue business political south move next suggest yourself brother kid economic will consider care dog situation week leave west market technology that music method house class doctor","1974-07-28 18:11:21"
"87","468","3","Material understand statement force image stand those trial possible environment enough stage door continue add make","2002-02-23 06:09:21"
"1888","469","2","Trip fact hit do upon administration tough fight drug specific management heart state senior account mother option type maintain watch","1985-08-29 19:41:10"
"1940","470","1","Allow since house significant might set teach response still alone speech per game since page his very something wear very report","1973-05-13 07:33:01"
"1735","471","4","Should sing under talk method move customer just big campaign contain outside partner maybe summer operation product company inside message father move grow stuff hot","2016-03-05 00:43:44"
"1226","472","4","Discover those money treatment foot common reason try finally process artist growth smile","1994-01-31 22:54:11"
"1372","473","3","Begin blue want phone blood lawyer response certainly today yard soldier bank to give whose","1980-10-26 12:16:46"
"638","474","3","If member decade want available able risk most news democratic expert imagine stage each able book science analysis hot onto movement hit might piece board big ten","2020-06-16 04:56:32"
"34","475","3","Program adult always statement our sister president bring state provide mother too necessary where budget every find land street trial need","2004-05-08 04:32:05"
"336","476","1","Future hotel spring determine five right particular receive control base media mother natural them fine both school model long item","1992-06-10 23:12:29"
"1275","477","2","South machine mission wall chair break that party single PM man matter however within by establish government choice similar environment record activity","2006-03-24 22:26:48"
"1339","478","2","Assume go statement every race to bank its effort cell they next","2014-07-16 21:00:01"
"1634","479","5","Surface international theory dream accept seem do note form industry arm political debate fine kitchen","1983-03-17 11:27:48"
"1753","480","1","Fly month forget human ability adult most medical let plant me recently area still cause machine article probably begin industry","1970-07-14 00:22:14"
"1780","481","4","Condition result game long easy can might service hear white half set realize pay about out","1988-03-28 13:03:57"
"1435","482","5","Address owner each always effect each two community smile power practice huge still","1996-08-04 18:10:16"
"1733","483","5","Fund put floor short future especially than teach argue group ability teacher prepare care serve position history much occur hair spend campaign me blue state because for","1986-08-24 23:36:48"
"1832","484","1","Wrong section girl worker difference maintain indicate night herself food everything college head town example provide plant","2022-06-29 03:52:15"
"132","485","3","President foreign fall career bed little analysis visit material guy into kind owner thousand message away local could avoid if turn that","1985-04-05 23:21:21"
"1953","486","4","Effect budget ask career give list science hour right score evening watch find guy rock rate indeed media several activity lead window seven food","1977-11-01 22:22:08"
"514","487","1","One indicate boy wall lose serve beyond necessary involve national exactly whole reduce forward image thing way live although from hit","1971-10-16 08:33:28"
"951","488","2","Peace man store feel popular tax team price work worry hair partner should they","2022-11-15 11:17:19"
"452","489","1","Tax tend mouth offer tonight building just write thousand by leader write plan surface","2012-08-21 19:38:25"
"164","490","1","Off lawyer worker can increase tree have support response different increase effort west start address edge think meeting best decision apply business sound away day","1998-09-27 07:46:01"
"432","491","1","Education risk likely eye spring city purpose rest rate already professional stay really ground less camera travel","2006-06-15 05:09:02"
"576","492","2","Game card firm kind wait age nation ability actually somebody break cup within daughter born your professor technology soldier sell society authority maybe ok","2000-08-30 00:24:55"
"1242","493","3","Wish analysis lose model consumer lead drug why history treat eight ask use response today whose speak agency often involve other send process executive others state","1976-04-05 06:37:12"
"471","494","1","End provide than she lead whether much early follow too start happy voice usually laugh long","1971-07-19 10:11:05"
"1359","495","4","Seek civil tend audience among high something security fire former into natural TV treatment avoid popular","2000-02-08 05:02:56"
"774","496","2","Face gun three American market Republican force say play data stage rule","2019-08-06 03:09:35"
"613","497","1","Expect whole plan recently mother into at through capital practice work western attorney former","1988-08-24 22:04:15"
"974","498","2","Price author central than attorney marriage professor upon knowledge sure school hand kind","1981-07-09 01:25:09"
"1781","499","4","Product develop body especially college mind cold these knowledge card decide while make just life should medical dinner environment","1971-03-02 12:36:13"
"410","500","1","Hospital court TV student hundred team though deep later family test station under artist stand site fall","1993-01-02 20:34:25"
"1593","501","5","Raise however available bad deep national air officer sit site network want glass beautiful say myself stuff hair center politics understand thing","1992-09-08 15:20:47"
"1089","502","4","Off party law take control operation threat at affect customer then usually son beyond next behind common staff even enter mouth raise health third do","1991-10-19 02:56:37"
"583","503","3","Threat able interesting travel whom loss five impact subject industry real late goal best establish move ever join front threat","2006-04-20 10:22:53"
"1287","504","3","Few hit president southern energy spring might notice item why real light generation bring idea","2011-04-08 17:09:47"
"1635","505","2","Statement also almost hotel answer history list star protect win more read find soon program oil room","1995-11-04 07:15:33"
"315","506","3","Discuss eight finally ask scientist may computer market ready black mouth ahead other determine front already certain green television sound","1971-02-17 16:50:31"
"1346","507","4","Such ten likely century around believe so feel difference at lawyer idea stop over report well heart according wear","2005-08-02 02:13:07"
"1895","508","1","Benefit include turn school fire office out generation space run somebody everyone room receive able same wrong even free receive industry","1992-01-05 15:51:04"
"498","509","5","Occur no physical effect itself couple cost note figure PM behavior can two","1989-05-06 13:15:54"
"467","510","3","Either day computer challenge pull science in bed yourself hand season onto of speech fly manager pay structure go news that wind while fine create","1988-08-11 17:13:00"
"13","511","2","Bad song far ability turn control I open discuss use modern last and central relationship fear party if left lay deep government safe must second try report issue","2005-11-26 06:35:24"
"1128","512","1","Step almost sing seem as set significant take tell final up statement","1975-03-12 05:34:23"
"757","513","5","Color theory under raise mind something however feeling line body miss happy southern red forget tend tell leave amount indicate public sure threat can authority","1995-09-26 19:12:38"
"299","514","2","Wonder player here explain nor team but team land require we forget may situation Republican wait live owner investment nature throughout room direction memory","1970-04-22 21:07:41"
"1161","515","4","And newspaper out free around night food democratic fear book seat agree garden staff impact possible recent often charge only that mother office","1985-04-22 10:36:39"
"1544","516","4","Seven draw thank ahead air page in prove population clear various data main environmental team far quickly church author the difficult expert real democratic increase whatever follow","2001-01-23 12:42:13"
"1266","517","3","Administration memory test usually she positive vote away let heart crime hair above sometimes actually operation behind","1991-12-30 16:35:37"
"1354","518","4","White able wait piece yard follow the nor surface election go keep challenge quite impact network sit become buy red government drug head which situation between skin consumer","2006-06-30 05:00:58"
"874","519","5","Gun future quite find character perform can up ago sport role hand","1994-11-02 21:04:32"
"42","520","3","Cut cover challenge first coach direction almost form ever experience learn manage organization around child like","2005-12-06 08:56:17"
"598","521","4","Lay phone out north his prevent state line size gas church operation account","1995-08-31 10:31:59"
"1623","522","3","Imagine stay test hundred product data money open officer drop writer song institution church window these per agent leg off down early","2002-04-09 22:04:51"
"74","523","5","Together life house pretty avoid throughout nice wife evening campaign financial before serve indeed half make about high go need throughout","1998-03-20 06:12:30"
"1945","524","4","Area student these decade news across attorney cut beautiful its add half site write upon effect last short senior human beyond term court standard soon fight notice","2001-09-24 13:56:25"
"569","525","4","How worker who bill ok order peace enter two let color put","1994-09-25 08:24:22"
"702","526","3","Before paper vote door away present them investment resource hope power onto table important most red last politics home each treat down also since sense stand media","1975-08-04 00:34:03"
"1065","527","4","Place tell cause design hot level begin send current understand term thank strong eat especially with able some suggest","2020-07-05 13:16:33"
"1381","528","1","Forward student political central bit current him mean often painting another future gas smile at I everything commercial draw perform happy player account public parent certainly","2008-03-02 22:49:59"
"1765","529","4","Many hard direction produce return anything today store indeed often life similar soldier stuff truth debate finish keep financial apply sort subject second","2012-02-17 19:34:18"
"542","530","4","Together enter back too item well task present note may sell future large carry five scene while machine picture","1976-08-09 22:58:08"
"1712","531","1","Detail rock how later concern industry know happy why fact threat hour win cup significant position safe process","2019-08-23 14:22:19"
"1129","532","3","Lead whether leader information phone culture whole series many home she Mrs travel fact thus bit attention","2008-01-18 05:59:18"
"1945","533","2","House right gas tax force development ground describe remember consumer indeed from read bag international society friend agreement organization top lot particularly","2022-06-15 15:24:31"
"920","534","3","Painting condition offer bring box international budget could believe American buy only feeling how room firm vote else develop begin","2020-02-16 13:09:22"
"740","535","1","Suddenly mother really chair direction moment line position culture certainly play production analysis court want go","1992-09-07 07:02:41"
"682","536","2","Quality responsibility man stop want why vote over top service bad what laugh maybe book","2013-08-05 12:44:27"
"1938","537","1","Side recent modern standard not nice picture beat have everything price list after keep reveal","1980-06-13 13:18:35"
"2","538","2","Hotel it environment decision PM thought collection western ten oil real price night door high man no upon follow apply in eye education local evidence one","1999-11-23 20:21:37"
"1444","539","2","Special war lawyer affect shake quickly word happy news task according television less thank management technology have up","1978-10-27 10:46:20"
"1331","540","3","Goal natural shoulder chair leader enter adult yeah lose event suggest different word mention pay water civil","2000-02-12 14:30:11"
"99","541","5","Financial professional discussion crime collection article piece radio discover color offer chance market everybody","1982-10-17 20:02:28"
"819","542","5","Nice check hotel memory able campaign listen build shoulder herself pass trip truth style run loss instead have place learn","1973-10-06 10:11:40"
"182","543","2","Surface might group have clearly kitchen thus sister less cut enter war event","1977-05-08 01:56:45"
"1053","544","4","Again issue project commercial hospital together court current democratic health she surface attention study one","2014-07-07 01:41:48"
"1805","545","2","Class live prevent especially different agreement value choice still rise husband low year office establish","1982-10-19 17:35:49"
"1536","546","3","Green direction oil boy center agent nearly represent likely people myself during fund strategy smile","1974-11-29 16:42:59"
"1643","547","2","Discuss reason thought little window standard skill big billion often receive work single term free include kitchen structure wish","1992-04-04 13:15:37"
"1550","548","4","Person standard national call audience structure out begin decade baby firm from feeling rather check want note oil low know","1980-01-11 08:45:45"
"889","549","3","Sister assume car ask decade the process in force house method future real road know shoulder","1973-06-18 09:44:33"
"730","550","3","Our here whose next large billion training paper for usually idea set ability appear condition image miss sister cause many always plant agree suffer history","1984-04-28 19:18:51"
"196","551","1","Air bit nothing suggest he guess clearly although remember suggest attack hand white middle character worker court administration so hotel interest yourself wish policy degree","1978-03-27 21:49:03"
"666","552","2","Campaign vote high point its military TV responsibility head sit significant six","2022-04-20 05:53:11"
"987","553","2","Best real design poor begin edge why everybody answer stuff relate shake south none kind while human fish window local","1989-08-12 08:35:17"
"650","554","1","Deep thing remember evening probably teach answer positive pick side town reason have use nation rule commercial inside data create money bring single usually","1978-10-21 00:43:55"
"1639","555","1","Large fact Mr result he brother open site room husband couple white your career recent share simply yard pressure party half such process student magazine above suddenly","2016-04-14 02:53:27"
"1248","556","1","Since care away development whose thus how nor when during body magazine in soldier growth find","2002-05-19 02:20:07"
"1805","557","2","Never science yes pass himself just media current talk mouth after single build customer at floor later these move each thought then generation attention health current who","2021-11-29 08:53:35"
"129","558","3","Remain toward here dark data the system bad central source who brother coach thus decide knowledge account or before with check door five","2007-02-18 15:17:11"
"1080","559","1","Accept natural speak image sit threat pattern free month fear building personal customer watch establish base century plant approach all cold room window whom attack sense condition","2017-05-05 22:44:43"
"1712","560","4","Gas south key cup exist often consider late assume allow not different him cost article","2015-09-11 00:16:46"
"608","561","5","Result author light town however particularly issue hot thought matter visit new grow recently past war tend appear international spring","1983-12-14 15:55:17"
"290","562","2","End apply country yes magazine how character eight customer bill happy Mr certain father adult data himself method gas charge member available lead","2017-01-06 18:42:17"
"385","563","4","Very road throw open yes left instead company girl fine floor song stage","1988-06-20 23:37:54"
"1699","564","3","Since once enough establish only action a safe painting current tough until not son door left us particular point white black of","1999-01-14 01:27:03"
"1025","565","4","World even growth person year economic old suggest recent claim four against win then eat party fish sea outside","1990-02-13 18:03:42"
"805","566","2","East happen behavior ever who manager assume no nation management commercial oil lose necessary time tonight line theory down system society","2009-05-26 18:37:57"
"1573","567","3","Second parent look economy build firm effect form by state finish garden success everybody doctor seven matter","1971-01-20 10:29:12"
"1666","568","5","Quite wind main public community south both security they account until too relate detail voice building son different else","2007-03-10 12:20:31"
"1596","569","4","Church thus cover continue have college indeed end race pass believe any those media unit painting improve away tough already culture at hear product our herself","2017-09-19 10:37:34"
"755","570","2","Reach animal enjoy add share loss both soldier order trouble space animal","1995-12-25 09:54:34"
"344","571","2","Personal history international environmental language study mean detail real accept throw treat seven world write PM leg actually senior heavy weight clearly growth north memory","1975-05-27 18:58:16"
"913","572","1","Set two leg Mrs even enjoy education blue hope pretty marriage where court blood old onto figure sister","1991-08-08 14:03:30"
"1628","573","2","Major end trial their every little begin wish phone job thing begin office important tough law half positive side always ago great possible office score Republican east","2017-10-07 04:45:26"
"980","574","2","Tend interest wife herself probably stuff pass with everyone morning court exist because child population record","2000-06-09 23:32:55"
"978","575","4","Ago industry discover newspaper adult popular bill Republican machine major drive reason sign happen rock thank reveal quality fly international base manager stand experience black small turn","1997-02-01 07:40:46"
"1062","576","1","Home method these cultural produce level for you the style summer success south look live become choose","1975-06-25 11:45:18"
"1743","577","1","Common share list huge talk yet join dark close even southern quite ask my total magazine several buy film","1983-01-29 11:59:50"
"1706","578","1","Word turn floor single star only parent be century trip along hair star note network","1992-07-28 11:06:57"
"185","579","3","Rock course surface girl people me visit tree protect me course catch dream heavy information team almost media including away benefit","1995-06-09 01:56:46"
"782","580","2","Everything lay too show itself girl us both respond peace card growth operation sport light chance left foreign reveal standard","1985-06-22 13:32:15"
"509","581","2","Chair enough energy degree company across character study over financial area live fire kitchen so product student recent treat dark sign what up nature","2015-03-11 04:54:03"
"560","582","5","Law discuss member fish soldier meeting night if remain leg window threat especially","1972-06-26 06:07:09"
"1464","583","1","Real job area already second few total food have fish factor another contain for also push about mouth call forward concern foot make this back show","2020-04-15 21:23:44"
"861","584","2","Hour knowledge only any community act always town trouble cold white nor off help return campaign tell a away population economy style into","1970-11-29 22:47:13"
"912","585","4","Between our there participant sport somebody happy customer there effect assume wait life heart idea require maintain","2000-04-01 00:56:30"
"1791","586","4","Such many matter poor then factor although suggest major identify answer catch hair","1972-08-10 19:03:49"
"1935","587","3","Service music nothing into early long claim community notice best necessary meeting simple join Republican financial himself option","1980-08-01 13:26:45"
"1799","588","2","Growth he leg strategy paper source beautiful election feeling term long soldier easy hotel buy","2003-11-14 15:27:59"
"178","589","3","Hot could section film purpose whatever here argue read just blood power realize","1981-07-11 09:01:10"
"110","590","2","Marriage billion law husband year already difference store same within act morning whether line ago water value who though bar left simply","1996-06-27 05:48:10"
"461","591","5","Color smile west husband body difference hundred crime choice financial election doctor cell support scientist want ok table cause kitchen my parent serve student","2022-05-09 21:10:45"
"1812","592","4","Plant medical guy character kind image baby policy play listen chance huge buy data idea mission lay politics civil activity indicate billion protect sell firm through","1973-11-02 02:42:32"
"951","593","2","Tough seem think seek they mention western suggest according say television wide window environmental up support center same","1981-04-19 10:09:43"
"1741","594","4","Design off successful rest return safe require they forward price fear discover themselves drop member","1990-05-25 20:09:40"
"1944","595","5","Perform enjoy treat institution catch machine far resource white mother see condition suffer","1978-12-20 20:17:22"
"272","596","3","Management much role run author sit easy new small better idea later everyone knowledge any line wrong receive professional break over air begin trouble during hospital community","1995-03-24 19:05:48"
"1313","597","3","Site floor know nice author blood human recent effort cover teach home out live human offer fire wall up personal free sort know agree do","2014-06-30 22:15:13"
"323","598","5","Reach about short which if style culture energy customer defense together believe allow from over great audience","1991-09-05 09:22:49"
"370","599","4","Pay safe billion help report report family trade himself science responsibility trip night specific","2000-07-01 15:34:35"
"1330","600","3","Writer imagine hair level maybe late north go focus class on two one skill","2003-12-27 14:43:07"
"549","601","4","Nor simply war why represent stage world why call born general recent increase movie still instead tough particular expert early PM center charge often","2022-08-29 13:53:54"
"398","602","3","Senior by support physical mean reduce us weight later power risk official leave coach appear man catch the investment without leave usually father safe information not line","2013-05-04 03:55:21"
"1461","603","5","Boy cut interesting least crime statement trip purpose what story baby tough who keep century program special radio here","2020-02-12 22:36:31"
"1779","604","2","Before nor sing or able land available safe occur base eye read conference difference society billion who next decision place color produce account","1970-05-23 16:06:38"
"1960","605","4","Future walk thought activity how degree maybe often radio think leader daughter data","2007-06-09 09:55:10"
"684","606","4","Another safe own reduce huge fly seem suffer cultural population site great region fire six must management responsibility today political church policy","1991-12-02 11:11:22"
"1065","607","5","Society game cup official most yourself son involve son themselves end people attorney rest country consider ready air","1976-10-20 23:02:54"
"1051","608","3","Beat raise gas nothing address while try close in service two none operation former close ok against indeed building final practice fall investment population light enjoy group hear","1996-08-10 23:56:02"
"307","609","3","Make thought receive little cut author want leader month size house open style certain themselves say news region economic language project article each with without else always","1992-01-23 06:56:35"
"330","610","3","Thank read rich affect us might continue general evidence region happen center those involve seem not personal require direction meet modern even fly politics attention hit","1996-12-21 00:43:55"
"505","611","4","Just pull purpose two green factor over officer middle edge method lot piece bad","2012-04-12 16:48:29"
"578","612","3","Property knowledge trouble effort large onto same simple information clear deal reason here smile chair fall sound say thank second between","1976-06-09 17:24:50"
"923","613","1","People design true describe hundred away cause guy policy paper role building in","2012-04-19 08:36:29"
"689","614","5","Meeting Republican control figure since right pressure yard safe else then create social know tell hospital heart hard decide time make choose total news","1993-05-12 16:49:04"
"782","615","3","Financial industry study under seat kid exist front local office into star carry situation exactly pretty per explain usually would store value animal ahead here","1979-07-23 04:22:56"
