"74","466","3","Find what glass local few number feeling stay particularly culture have provide compare service minute dinner ball discuss","2013-04-12 05:41:15"
"1765","467","3","Hospital experience bring great society pick space behavior oil safe possible imagine before bed now ok among","1973-06-24 21:16:38"
"1435","468","3","Experience idea computer land same culture oil source away local important perhaps sister although his character produce successful huge site happy easy","2011-04-17 16:12:40"
"767","469","5","Shoulder left difference type father meet himself include writer charge carry local want general computer statement phone","1992-05-06 02:31:47"
"409","470","2","Five away economy gas both field less free marriage technology office often garden lawyer sell business our five treatment able tree decision religious capital feeling nation wait","2005-12-06 07:35:35"
"569","471","3","Win nation culture grow difficult decide leg must night force investment choice citizen grow together grow hope scientist avoid check produce catch","1982-07-08 04:10:01"
"1887","472","3","Ok create themselves today company about popular production they present rise bar medical bag can responsibility politics skin economy table entire who wife admit term common","1987-08-04 11:46:08"
"1740","473","2","Attack sport respond fill fund red bring practice firm wear follow hundred suffer wall task necessary three television participant yeah citizen child","1973-11-11 23:29:42"
"1763","474","1","Challenge again available above else nation summer enough produce compare officer close mouth agent five cold agreement say man test thank policy","1998-10-26 21:38:46"
"1359","475","2","Hundred social dream do must authority main consumer trip fact hit do upon administration tough fight drug specific management heart state senior account mother option","1970-03-25 14:32:39"
"1940","476","4","Night area hit else total across last behavior investment artist us head very off them eat amount worry summer stay nice","1973-05-13 07:33:01"
"1735","477","2","Pretty technology yard physical instead least should sing under talk method move customer just big campaign contain outside","2016-03-05 00:43:44"
"1503","478","4","Behavior seat strong can color health as natural safe could step art market very do security safe dark film","2017-05-29 07:24:14"
"1452","479","3","Worry investment matter least eye begin blue want phone blood lawyer response certainly today yard soldier bank to give whose little","2008-04-23 09:25:44"
"638","480","1","Most news democratic expert imagine stage each able book science analysis hot onto movement hit might piece","2020-06-16 04:56:32"
"1491","481","3","Factor sit which against operation address process street within administration here meeting Mrs image","2011-09-21 01:59:01"
"336","482","1","Future hotel spring determine five right particular receive control base media mother natural them fine both school model long item","1992-06-10 23:12:29"
"1275","483","2","South machine mission wall chair break that party single PM man matter however within by establish government choice similar environment record activity","2006-03-24 22:26:48"
"1339","484","2","Skill capital report guy hard skill sea accept sense account subject sing inside court wrong determine student section company get","2014-07-16 21:00:01"
"1634","485","2","Herself information actually relationship night reality office dog team yes surface international theory dream","1983-03-17 11:27:48"
"1721","486","1","Deal page play car along seem figure hard already wait shoulder report affect win pull anyone fish artist glass miss difficult anything company finish","1992-06-14 01:23:21"
"848","487","1","Full identify prevent onto fast effort very create apply along raise both out hope choice agree mention week stay better","1984-03-29 23:59:45"
"800","488","4","Do note interest song page serve produce once face whose market hour former until matter people","1991-03-10 12:11:22"
"273","489","1","History much occur hair spend campaign me blue state because for personal police hear beyond environmental present up power attention compare itself beyond test","2003-12-08 15:28:35"
"1792","490","1","Democrat foot despite low exactly information together wish realize contain force history star institution between unit occur door window structure","2002-09-25 11:09:16"
"1173","491","2","Camera painting strategy president foreign fall career bed little analysis visit material guy into kind owner","1985-04-22 03:17:58"
"1344","492","5","Recognize want Mr price effect budget ask career give list science hour right score evening watch find guy","1978-11-08 23:07:50"
"1000","493","4","Finally education purpose serious treat ability forget it notice can man maybe director against green cold believe reflect case chance along cause start consumer not","1983-03-12 21:25:27"
"951","494","3","Do deep best collection either bar popular set in message plan single","2022-11-15 11:17:19"
"1450","495","5","Offer tonight building just write thousand by leader write plan surface foot crime item","2018-03-17 06:41:14"
"164","496","1","Off lawyer worker can increase tree have support response different increase effort west start address edge think meeting best decision apply business sound away day","1998-09-27 07:46:01"
"432","497","1","Education risk likely eye spring city purpose rest rate already professional stay really ground less camera travel","2006-06-15 05:09:02"
"576","498","2","Game card firm kind wait age nation ability actually somebody break cup within daughter born your professor technology soldier sell society authority maybe ok","2000-08-30 00:24:55"
"1242","499","5","Air book I south wish analysis lose model consumer lead drug why history treat","1976-04-05 06:37:12"
"1811","500","3","Above market light discover firm age pull across through chance worker thought within you above food nation spring wall trip ok beat degree north","1987-10-22 23:22:47"
"1862","501","3","Strategy kind but everything eye thought analysis nothing help happy by return describe wind son return economic beautiful major bed","1978-08-16 18:54:37"
"1227","502","1","Along attention lawyer her popular individual rock task really attack clear create personal teacher group right citizen","1977-07-19 07:24:26"
"1018","503","4","Ever form similar amount present by trip toward affect point of rock apply benefit away idea speech something","1995-05-29 17:14:14"
"1978","504","3","Sound hit yard investment morning hot within those part thing once life view","1999-02-26 10:00:36"
"636","505","2","Open tough meet under guy box put season result line teacher owner gun offer way particularly growth car head happen window","1975-05-02 13:31:07"
"485","506","4","Continue discover activity none throw realize animal meet dinner old stage remain truth perform resource worry practice","2015-01-09 11:47:02"
"1373","507","3","Around executive accept manage political physical go ten race lay money television particular answer child college sing position sister later kid four until edge","1971-12-19 20:34:01"
"1645","508","2","Understand thing reveal might understand police court mother kind season build deal","2005-02-12 10:42:35"
"1816","509","4","Off party law take control operation threat at affect customer then usually son beyond next behind common staff even enter mouth raise health third do","2007-12-30 06:21:34"
"583","510","2","Energy strong teach gas total water threat able interesting travel whom loss","2006-04-20 10:22:53"
"1653","511","2","Sell individual billion agency wide between gun few hit president southern energy spring might","1984-07-25 09:13:09"
"584","512","2","Statement also almost hotel answer history list star protect win more read find soon program oil room","1995-11-04 07:15:33"
"315","513","1","Chair shake hard fast discuss eight finally ask scientist may computer market ready black mouth ahead","1971-02-17 16:50:31"
"677","514","4","Find from interest moment research story happen sing see teach effort since also none enter improve process type itself","2002-08-25 01:22:43"
"1507","515","4","Draw question class today laugh kind record without fly nearly free risk benefit include turn school","1981-10-16 05:15:06"
"1505","516","4","None where trip while back because wonder step speak agreement table court home hundred five new interesting nearly together term whose","1973-08-21 15:24:54"
"518","517","4","Picture price cold car prove political movement bad follow campaign some all ten none child listen reveal","1978-10-26 00:58:32"
"703","518","4","Kind apply win debate design art debate generation crime approach star focus eye and","1993-10-30 07:06:47"
"91","519","3","Education so even necessary include old how statement race with week grow entire hard concern road until finish size believe bar foreign account image next","1990-04-09 14:57:39"
"1769","520","1","Have worry hope her age player tax event economic adult even statement vote six leg","2006-06-16 18:25:37"
"1893","521","4","Inside city kind increase claim church myself here above power decade improve market professional catch treat several per","1999-03-25 16:46:54"
"1801","522","1","On year site interesting kind fire note house safe suddenly citizen school firm though red","2000-05-18 00:54:47"
"1932","523","2","People admit anyone commercial choose young our off at teach huge Democrat explain too dinner natural us together nothing one agreement return we movement consumer through two","2022-11-29 10:33:31"
"1780","524","2","Walk report structure before west skill standard my as it position about participant physical she often above property scientist show","1972-01-28 21:11:37"
"194","525","4","Wonder stop father husband development win cost yeah oil bag environment process","1977-03-22 22:55:29"
"32","526","4","Follow the nor surface election go keep challenge quite impact network sit become buy red government drug head which situation between","1999-12-04 10:11:55"
"874","527","2","Hour war authority human reach agency other candidate two consider onto spend fish out approach","1994-11-02 21:04:32"
"490","528","3","Dream tough memory interesting kitchen thank either suddenly sing data response owner store stop six worry once wind","1980-10-24 14:50:32"
"1332","529","5","Send country car anyone own never rate ask area turn physical us focus society chair how marriage meeting admit impact reality letter staff information","2004-04-08 05:41:22"
"520","530","5","Again entire worker than certain recognize paper security sort each owner country bag value address already trial increase small sort by beyond difficult letter listen","2010-09-13 22:19:22"
"903","531","4","Join door painting morning budget office member message season get experience south citizen wear nature though fight professional nice cell record too score","2021-08-28 03:58:13"
"845","532","5","South throughout can near official bring over choose capital exist own space management","1976-08-06 20:39:04"
"433","533","2","Office like lot boy card term keep husband how worker who bill ok order peace enter two let","2015-03-02 10:43:01"
"702","534","4","Language collection indeed time military entire last share quality which teach environmental painting social yet adult rise term minute","1975-08-04 00:34:03"
"1865","535","2","Fire not these color wonder live artist according option production around challenge until south international sometimes positive parent","1972-08-04 22:54:20"
"1741","536","3","Recently ask agency not general smile experience size majority region open security skill indeed bring officer player site check truth project agree such","1995-12-04 23:48:39"
"855","537","4","Off their difference price reduce miss door leader low performance perhaps debate add television say strategy situation","1997-05-06 12:08:35"
"1023","538","1","Table threat community and there decade yourself everything idea stay traditional board enter huge best society","1984-08-30 12:48:34"
"1525","539","5","Once green relationship wind treatment walk support yet professional everyone movement town lead place situation table system figure structure make role","2022-09-28 18:39:49"
"1281","540","2","Hour win cup significant position safe process thus seven enter program give cut time myself agency position raise energy water radio onto","1991-07-18 02:36:29"
"1486","541","4","Information phone culture whole series many home she Mrs travel fact thus bit attention sing site soon us particularly power candidate clear parent time film allow increase","1981-09-02 21:18:07"
"1594","542","3","During usually dream natural sport network behind under sport market collection step anyone run","2003-10-27 07:52:29"
"1386","543","2","Smile man drive enter first like kitchen performance carry exactly eight senior how without try number","2012-01-21 08:10:44"
"740","544","3","Nation move blue ever radio country ago simply than huge rule remember whole they into us structure","1992-09-07 07:02:41"
"1706","545","1","What laugh maybe book hot PM Republican wife fund lawyer break how during us positive scene know let","1973-04-26 19:42:43"
"886","546","4","Health gas during near professional check paper single practice group part right attention begin public fight woman keep major exist off most maybe mission","1994-08-05 06:48:20"
"884","547","2","Why campaign nation international arrive big remain shoulder best rock evidence such all training baby ok color court","1984-04-27 02:05:35"
"1322","548","4","Thank management technology have up executive pattern without according whose area experience skin look know raise stop whether animal","1972-03-27 00:10:18"
"825","549","1","Ahead network alone force course human story religious unit sound protect west state treat door thus prove deep finally tree","2005-10-23 19:03:17"
"995","550","2","Idea woman feeling long while attorney good long good fly hit about interview accept evidence everybody voice","1982-07-19 10:09:00"
"764","551","1","Shoulder herself pass trip truth style run loss instead have place learn others maintain manager even life particularly room sea stage oil notice","1999-07-21 05:53:52"
"1842","552","3","Have clearly kitchen thus sister less cut enter war event detail compare star view lose college type east should let above more around husband others receive feeling","1985-11-09 09:22:50"
"111","553","4","Project commercial hospital together court current democratic health she surface attention study","1995-02-10 05:17:51"
"1805","554","2","Agreement value choice still rise husband low year office establish how lay question skin skill huge","1982-10-19 17:35:49"
"1973","555","1","Win writer take can with score point must power hair stand force field center data","2022-07-23 16:46:03"
"1274","556","4","Structure wish population fine hospital back seek service hope medical draw capital","1979-11-25 13:05:45"
"301","557","5","Standard national call audience structure out begin decade baby firm from feeling rather check","2015-01-26 06:48:29"
"56","558","3","Here result free for technology expect sister assume car ask decade the process in","1999-07-17 11:55:54"
"1606","559","5","Machine toward over mouth teacher couple coach instead power real author wait that discuss site agency travel growth our","1994-06-05 20:58:31"
"1583","560","5","Near upon reach culture thought board stock much large break power develop back community myself response war also air bit nothing suggest","1971-11-10 03:37:31"
"32","561","4","Under foot lot six shoulder paper summer now woman now major response check consider industry main especially miss American daughter true economic us century","2002-09-11 03:40:58"
"1354","562","4","Increase rest than develop agree fast work national though outside partner require run fish against class best real design poor begin edge why everybody","1974-01-01 21:33:07"
"609","563","2","Eight little check member yes important sport evidence form dinner city almost second article","2016-01-12 17:26:21"
"1769","564","5","Table suggest might get crime level set employee paper lay natural structure father quite hear physical","1983-11-15 00:49:03"
"50","565","3","Student magazine above suddenly chance begin collection next inside billion together imagine couple meet customer close wrong time effort than you onto young particular reach","1976-09-10 02:36:57"
"1907","566","1","Your within mean certainly how ahead environmental along huge road half several point him happen teacher","1998-02-07 04:33:28"
"956","567","1","Again budget their thought western include up level price environmental worry three its history government prove expect she same story nation","2011-06-11 12:52:49"
"1682","568","2","Simply pattern none church land drop car throughout executive should fear piece reason news simply","1988-03-29 14:57:53"
"261","569","2","Watch establish base century plant approach all cold room window whom attack sense condition break should notice number","1970-02-13 10:31:37"
"1648","570","3","Yeah election board try prove gas south key cup exist often consider late assume","2019-04-08 05:23:36"
"1056","571","3","Seven share police guy first author forward especially dog what speak alone power send","1989-05-05 02:20:59"
"1015","572","3","Never too sound class treatment help weight thing under authority contain ground develop former seem test yard compare end apply country","1992-01-23 11:36:02"
"310","573","1","Threat hand ever respond student five contain but anything personal popular firm hair difference newspaper career whether news","2001-02-04 08:31:38"
"1639","574","1","Discussion arrive range explain only list think movement house from challenge type for simple during industry position cost middle day","2012-06-26 18:39:35"
"883","575","3","Bad close lawyer include government whether tough leave religious each hope world even growth person year economic old suggest recent claim","1976-07-25 05:31:59"
"836","576","1","Win each day bad war network soon drop difficult gun note product free deal local TV medical war environment body sort or government","1992-05-22 22:16:55"
"278","577","3","Central film huge hour this hard organization start second parent look economy build","2017-02-22 13:59:15"
"630","578","1","Stage family picture measure start huge always suddenly occur within enough floor health indicate page quite wind main public community","1972-01-09 08:09:30"
"1491","579","5","Enough rise whose consider same to black leave bag loss window chance step watch peace eye the act wind likely","2015-02-13 08:41:29"
"533","580","4","Face production thus speech worker financial responsibility special responsibility quality in material main movie he across seat run","2001-12-02 06:36:30"
"1984","581","2","Speech water garden population that than among opportunity peace experience war effort where yourself develop actually water public member speech","1986-09-02 00:21:28"
"145","582","5","Close decide itself feeling the chance his threat feel from follow business discussion national receive system catch consider high fine capital travel early far what","1974-09-09 10:51:29"
"1671","583","3","Garden thank space ok require information chance item accept serve what forward night word market respond affect though","1983-02-08 08:32:40"
"54","584","4","Official keep huge federal lay against happy medical nation structure live law history boy former nearly whether husband write need finish you culture","2014-02-05 05:29:53"
"1349","585","5","Save necessary control heart prepare energy detail huge trouble culture design up economic item","2011-10-23 19:36:24"
"54","586","3","Sense seat shake at trip return likely rule very of successful walk check reality heart friend whether always old operation ground necessary maintain state","1985-08-29 21:15:07"
"1215","587","1","Drug assume public dream wind serious water sea choice particular present talk send expert surface beat good hour draw ask","1992-11-28 15:53:31"
"413","588","2","Street offer take voice standard forward father open participant state amount enough in pay husband its always today decade car road brother raise choose experience final","2011-07-14 11:23:54"
"816","589","4","Tree south us level security increase water final home audience pay wait age game shake include indeed this far imagine trade clearly","1983-09-11 11:52:53"
"1970","590","4","Finally dream development exactly government improve federal bag agent thought Mrs score off allow inside process start want of agency PM","2016-06-14 20:14:07"
"1206","591","3","Professor computer quality wall travel value little score base media age place","2001-12-06 23:01:47"
"1715","592","1","Mrs national it why bed event rather already factor before buy walk study administration central company lawyer","1970-08-12 14:54:49"
"1158","593","2","Human teacher difficult employee challenge do fish left process admit without necessary chair rise agreement citizen","2001-07-06 00:05:16"
"1497","594","3","Young along remain street table since put early information suggest quickly win range Democrat large newspaper life so","1975-04-21 13:59:16"
"547","595","4","Food know thousand station there own someone cut property system sense camera miss stock other vote tree tend","1970-01-11 11:00:46"
"1223","596","1","From PM Mrs themselves live especially direction agreement fact less media place animal reflect see east tend out glass","2011-06-04 20:25:24"
"97","597","2","Book machine maintain food well old pass ask respond word first out huge data","1994-10-03 09:13:25"
"1144","598","5","Nature employee economic those call enough civil culture certainly reality majority hot offer unit","2017-04-07 23:54:10"
"62","599","2","Information actually low hospital effect remember family husband plan for floor hot could section film purpose whatever here argue read just blood power realize hard","2022-04-19 09:04:47"
"110","600","2","Marriage billion law husband year already difference store same within act morning whether line ago water value who though bar left simply","1996-06-27 05:48:10"
"461","601","5","Site national rich color smile west husband body difference hundred crime choice financial election","2022-05-09 21:10:45"
"420","602","3","Home current for identify movement run once watch factor week arrive company American much PM action individual rock miss","2003-05-06 20:10:35"
"96","603","4","Believe future strategy national writer tend any state region several all food explain during past senior enter same board stage discuss","1998-04-29 03:01:13"
"1949","604","4","Police catch nature word listen including light final develop you television anyone price country little responsibility","1994-08-21 02:53:26"
"1341","605","4","So rise business western role plant position game personal worker today nothing add science game painting through true perform enjoy treat institution catch machine far","2001-11-14 03:41:54"
"929","606","2","Unit especially ball world inside quite second institution soon nothing down key nature risk risk operation","1999-11-14 17:34:49"
"782","607","2","Important issue seem should wife available political pass worker president around common pattern partner ask high large clear special bank lay what heart bill family weight financial site","2010-11-29 17:52:44"
"1803","608","5","Course course apply reason fill fly wonder rich agency story hit method sure important beat speech quickly morning difficult decade","1998-05-26 21:44:56"
"1600","609","1","Worker know campaign provide million little lead man boy show loss election similar successful federal key experience admit","2021-02-10 06:20:31"
"1330","610","2","Beyond before total relate position project executive before reason they rule both large fact this young ever wind guess","2003-12-27 14:43:07"
"1584","611","4","Center eight recently without stuff interest anyone large really class material music change sure bill contain white whatever data even its nothing claim station recent responsibility","1994-07-30 17:46:40"
"1446","612","1","Important help sense color name law picture Republican between major ball wall defense prepare type","1986-01-02 12:54:11"
"1109","613","3","Soon manager Mrs anything hotel see policy space daughter can determine source admit sell perform boy cut interesting least crime statement trip purpose what story baby tough who","1993-02-16 00:26:37"
"1434","614","2","Fact either you to record skill write close before nor sing or","1999-10-03 20:08:30"
"1623","615","4","At nearly drug raise west someone speak five team number president low eight conference learn the","2002-02-09 16:24:37"
"1057","616","2","Indicate various old human feel about clearly person investment expect trade federal remain director business nor knowledge inside state create race","2006-03-30 16:36:59"
"1313","617","1","Stand be here watch business hour color health site gun particularly morning ask west house surface drive authority mean","1981-06-27 07:33:24"
"1954","618","5","Successful college contain choice guy threat better challenge television seek beat raise gas nothing address while try close in service two none operation","2020-09-30 15:50:17"
"1391","619","5","Production they seat less simply fly then different recognize head make thought receive little cut author want leader month size","1992-07-04 06:52:12"
"9","620","5","Thing face statement visit eye spring suggest them than into market ago","1995-11-23 10:51:14"
"705","621","3","How save social group outside their hundred reflect record message shake lot grow pick throw concern some international likely long","1992-03-04 10:53:11"
"729","622","2","Local song party spend specific born drug moment his else worry human they practice consider information agreement","2010-11-30 17:58:13"
